id,title,publishedAt,viewCount,likeCount,commentCount
KdRH4MGX6zc,Review Makanan HALAL Di JEPANG,2025-12-11T10:00:39Z,21088,1495,86
GyXMy9WixyM,gimana kalau kamu yang atur..? #shorts,2025-12-05T03:00:31Z,19154,1755,69
MMntFQbM0LQ,Cobain Lumpia Paling Enak Di Semarang 【24 Jam Di Semarang】,2025-12-04T10:00:41Z,20320,1631,167
zH-lvr6TSWU,surabaya beda dari kata orang..,2025-12-03T04:01:06Z,84015,3891,49
WR0vfHrkSsI,ayo kita bantu saudara kita di sumatera.. #shorts,2025-12-01T04:45:04Z,73141,5722,35
Ty_vjI8foi8,"ayam rendang, mie aceh, telur balado.. #shorts",2025-11-29T14:00:57Z,23232,1523,39
D98ZKTsImvA,🔴 MARI BANTU KORBAN BANJIR SUMATERA - PART 1/4,2025-11-28T12:42:10Z,6381,904,19
rXd7c-Lagf8,"24 Jam Diatur ChatGPT Di Surabaya, SUKSES atau GAGAL?",2025-11-27T10:01:29Z,34647,2425,193
ibPr-dlqfZU,"🔴 ALAMAK, Gimana Pendapat Kalian?",2025-11-22T11:28:11Z,4020,516,14
zZo7LYXFjA4,Alamak (VERSI JEPANG) - Rizky Febian & Adrian Khalif / GRXXX Cover,2025-11-22T10:00:06Z,23489,3858,183
C94ZQSixbAI,Alamak - Rizky Febian & Adrian Khalif / GRXXX Cover,2025-11-19T12:00:06Z,96503,11464,468
bBVEev_GFP8,lagu viral tiktok tapi versi jepang.. (everything sucks) #shorts,2025-11-13T06:00:29Z,36858,4110,74
DkHH08pE_x0,everything sucks (Japanese Version) / Cover By Akemi Nekomachi,2025-11-11T12:00:07Z,16118,2434,156
vXt1TwvrQmY,Aku Coba Hidup 24 Jam Diatur AI Di Jakarta Dan Ini Yang Terjadi!,2025-11-06T08:01:13Z,34770,2516,87
s-f0mawNAH4,kejebak di kereta bawah tanah jepang.. #shorts,2025-11-05T06:01:00Z,45929,2337,44
ENimek1YrOQ,tebak mobil.. #shorts,2025-11-04T06:00:16Z,63273,2699,46
7Yizp3uRltI,apa nama 2 makhluk ini..? #shorts #vtuber,2025-11-01T06:00:07Z,284940,7322,219
AonXqDhMQko,gimana rasanya pegang bulu babi..? #shorts,2025-10-30T06:00:14Z,239431,6646,97
bwuhnMarbP0,siapa yang keluar di pikiranmu..? #shorts,2025-10-28T06:00:39Z,123609,8852,474
NuTYDo7Rj4k,sabun rasa baru.. #shorts,2025-10-25T06:00:31Z,1817500,36808,569
54bamH7Nq3A,gimana supaya ga kagetan..? #shorts,2025-10-24T05:00:06Z,71017,4228,29
pxqOmUi6IJk,ada ga di bandara indonesia..? #shorts,2025-10-23T05:00:56Z,76217,3342,24
jEzbkXdvGhk,baygon rasa baru.. #shorts,2025-10-20T06:00:41Z,2223356,54320,647
z-PpM0Hysgc,cowo namain kucing.. #shorts,2025-10-18T05:01:06Z,405489,17639,151
ArSjktRD6y0,tugas memasak.. #shorts,2025-10-17T05:00:19Z,30866,2107,25
ZQVO6g45dmM,di sini seram si sana senang.. #shorts,2025-10-16T05:00:45Z,37261,2555,63
6eBmwYNRkzU,pengen minum dingin aja susah.. #shorts,2025-10-15T05:00:14Z,154372,8740,191
ekYZ66waCoE,bakat bawa keberuntungan.. #shorts,2025-10-13T05:00:44Z,110549,5849,59
YVlr8VFcFCs,ngajarin temen baru main minecraft.. #shorts,2025-10-11T05:00:38Z,111869,5818,43
HydHVs7cKq8,jangan pernah lakuin ini di jepang.. #shorts,2025-10-10T05:00:19Z,1063690,49304,194
UWWc9al4ImU,🔴 Apa Yang Terjadi Kalau 4 Cowok Masuk Ke Backroom? 【Inside The Backroom】,2025-10-09T14:34:48Z,5121,497,7
mRclNyOG4Lw,Apa Yang Terjadi Kalau 4 Cowok Disuruh Namain Anak Kucing?,2025-10-08T08:00:59Z,109756,4015,127
u8dw-6kS-KE,mau mah.. #shorts,2025-10-06T05:00:57Z,854607,26588,209
7z8CzzKb1_U,BERSAMA THE BOYS MENAMATKAN MINECRAFT,2025-10-05T11:40:09Z,6621,732,8
FhRuQTlBmpw,JANE DOE (Chainsaw Man) #shorts,2025-10-04T05:00:23Z,16552,2152,44
1BMWU0WDx2s,nasi padang kalo dijepangin.. #shorts,2025-10-03T05:00:01Z,42754,3798,60
gy-LFwq3dRo,akhirnya dunia ini bakal terjadi juga..,2025-10-02T05:00:44Z,35126,2592,36
z0aDSeP4v34,jangan sampe ketauan.. #shorts,2025-09-29T08:05:24Z,33364,4565,14
oydm2XsiLsE,APA YANG TERJADI PADA TUKANG P*K*L SETELAH LULUS SEKOLAH?【TROUBLEMAKER 2】,2025-09-28T20:24:14Z,3716,410,7
rn3Ve78DqyY,AKU PULANG KE INDONESIA【FREE TALK】,2025-09-27T12:37:21Z,3891,625,9
pQh3J3QzuJI,HAND REVEAL (IRL Stream Jepang),2025-09-21T08:40:18Z,22088,2947,65
Tc4LaXHoEDs,IRL STREAM JEPANG PERTAMA (maaf masih pemula),2025-09-14T08:19:42Z,10196,1584,41
kolvwt0HLng,alat ini jarang ada di dapur orang indonesia.. #shorts,2025-09-08T05:00:46Z,399981,17743,168
-gHHtfCQOQk,"Sebelum Ke Jepang, Ngobrol Dulu Yuk :3",2025-09-07T16:16:06Z,4150,695,12
ZAYmaEk1eHI,AYO MENDAKI GUNUNG DAUN YANG LAGI VIRAL!! Hari ke 3 Main ROBLOX,2025-09-04T15:25:09Z,7084,773,20
mmK98O3pznM,ayo naik gunung viral! #shorts,2025-09-04T05:15:03Z,149349,5428,116
1MmhJAvE4K0,AYO MENDAKI MOUNT SUNDA!! Hari ke 2 Main ROBLOX,2025-09-03T13:55:47Z,4015,604,10
6m_8UQTmijg,ayo mabar roblox mendaki gunung sunda..! #shorts,2025-09-03T05:01:09Z,90065,4564,110
1apT5mBUdW0,AYO MENDAKI MOUNT JAWA!!,2025-09-02T14:28:39Z,3234,542,4
k3cJ330cJZA,apa kamu crazy rich..? #shorts,2025-08-31T05:00:57Z,61330,3956,198
XiOpBh3uVvk,cosplay penjahat.. #shorts,2025-08-29T05:00:38Z,56518,4188,86
r_ViivJ8tqM,MENG-APEX BARENG @gingehenna & @MikazukiArion  【APEX LEGENDS】,2025-08-27T18:24:20Z,5587,1081,2
CMILzSZYBBg,Siapa Yang Bakal Jadi Beban? 😂【PEAK】,2025-08-26T15:33:51Z,5703,812,3
R1MDq3c8hBE,jokes tukang bangunan.. #shorts,2025-08-25T05:00:25Z,55496,3185,36
_45H7N_bBgc,7/7 Apa Yang Terjadi Kalau Kamu NgeGym Malam Hari?【The Night Gym】,2025-08-25T01:39:02Z,2577,422,7
aGGzIYAOCks,6/7 Pemb*n*h Ini Berdasarkan Kisah Nyata..【Tales Beyond The Tomb - Route 86】,2025-08-23T16:28:11Z,4081,655,12
5BVmWHZWpjs,pemb*n*h ini berdasarkan kisah nyata.. #shorts,2025-08-23T05:00:11Z,40086,2743,38
GIeTBz8SwYg,5/7 Aku Harus Jualan Nasi Goreng Untuk Mengobati Ibuku..【Obsessed : Night Shift】,2025-08-22T15:28:49Z,4494,624,15
zibXGnUgbRw,4/7 【FORGOTTEN VILLAGE OF GONDOMAYIT】Berkunjung Ke Desa ANGKER 💀,2025-08-22T01:29:59Z,1905,355,8
RNasUufBUqk,hati-hati dengan yang kamu takuti 😨 #shorts,2025-08-21T05:00:29Z,43795,4256,68
27IomwAItU4,3/7 【WHISPER MOUNTAIN OUTBREAK】Apakah Aku Bisa Selamat Dari Monster2 Ini??,2025-08-20T15:32:15Z,3496,501,6
1UuD15Geric,2/7 【Scary Game】Seberapa Seram Game Ini??,2025-08-19T13:21:49Z,2282,389,11
3lgS_WEldME,indomie indonesia vs amerika,2025-08-19T05:00:04Z,900100,34381,220
che7KiXrrOU,1/7 【Pikabuu: STOP!】CEPAT HENTIKAN Sebelum Semuanya Terlambat!!,2025-08-18T14:40:09Z,6456,1135,16
UijqGaOf3WQ,pengada ada aja adil atau nggak ya ga tau ⚖️,2025-08-18T05:00:27Z,38447,2861,40
Q5trk5ozUKM,youtuber VS vtuber 🤨,2025-08-16T05:00:33Z,48033,5237,68
xl54hmOw5HU,aku ga akan kabur lagi 😤,2025-08-15T05:00:57Z,46313,3992,78
D6aJTRgUn5I,kisah botol saos 🌶,2025-08-14T05:00:11Z,65800,4477,45
bAiqJUUi2oo,rela ga demi Rp327 miliar? 🤑,2025-08-12T05:00:42Z,101501,5149,167
XeC7nCwMRJM,perangkap 🪤,2025-08-11T05:00:38Z,863500,28781,160
Z867oFtvLUM,kisah roda ⭕️,2025-08-10T05:00:38Z,92125,6741,50
36565vwtsX0,anaknya yang mana? 🧒,2025-08-09T05:00:04Z,115185,6280,53
rjANc-SeUvQ,adopsi anak penyihir 🧙‍♀️,2025-08-08T05:01:00Z,55579,2865,49
RspXrjoUdZA,we listen we don't judge 🥰,2025-08-07T05:00:21Z,1767918,38846,145
XdYF3ZETzUc,matematika itu menyenangkan 💀,2025-08-06T05:00:26Z,1706357,54516,378
1pkkdqjjFa0,tes mata 👁👄👁,2025-08-05T05:00:06Z,230098,11828,52
t4th71k2GXc,tiramisu terbaik di jakarta 🍰😋,2025-08-04T05:00:54Z,113678,7228,28
XEcyOKQBu4g,me vs zombie 🧟‍♂️,2025-08-02T05:00:34Z,31901,2207,40
4Wrf7P9aKaY,gimana rasa babi? 🐷,2025-08-01T08:00:04Z,162814,7184,67
F2zkOL0NlBs,nyolong uang 💸,2025-07-30T08:40:00Z,123827,9490,132
AUkFZ0hz8KQ,cobain makanan paling mahal 😋,2025-07-29T08:40:00Z,34173,2151,28
6oMc19jwrz0,ketika barangmu hilang di kereta 😱,2025-07-22T17:00:17Z,56376,4854,71
59dsFbD9PRc,Makan SEPUASNYA Di Restoran TERMAHAL Di Indonesia,2025-07-18T08:40:00Z,126524,3693,180
B3FQLbCjNMo,perjalanan paling deg2an jam 3 pagi.. 😱,2025-07-15T08:40:00Z,55256,4705,64
bK-OEbDZtkY,apa yang terjadi ketika barangmu ketinggalan di toko..? 😱,2025-07-11T08:40:00Z,80171,5705,57
T6I8xrZwTPE,cara orang jepang buang sampah sembarangan.. 😂,2025-07-09T08:40:00Z,121237,8039,36
MyO4uo-Oc84,rating sambal terenak.. 🌶,2025-07-07T08:40:00Z,93088,5363,73
9mFLT8bCgyw,minuman paling ga enak.. 🤮,2025-07-05T08:40:00Z,50928,3744,68
S6RY7S_fd9A,mesin ini sangat berbahaya.. ⚠️,2025-07-03T08:40:01Z,81025,4082,51
IrB5KgD550Y,buat anak kecil tapi yang tua juga bingung.. 😵‍💫,2025-07-01T08:40:00Z,57807,2743,78
cMMoopoK7qo,makanan di restoran ini diantar robot.. 🤖,2025-06-29T08:40:02Z,48652,4025,55
Ru3qMv_eXOY,ga boleh bungkus sisa makanan.. 🍖,2025-06-27T08:30:27Z,641063,35861,51
8x-_Ly4eyB8,kejadian horror di game pindah ke dunia nyata.. 😱,2025-06-25T08:40:00Z,55577,4249,46
sWn1thWM_L0,Ranking Restoran Keluarga TERMURAH Di Jepang,2025-06-22T08:40:01Z,101373,3726,159
3xeTubmHliA,cari makanan halal di jepang..? 🤔,2025-06-20T08:40:00Z,928749,39684,139
2RIpAH3RgKA,dikasih snack sama gelandangan di jepang.. 🍰,2025-06-18T11:20:00Z,1434903,55227,87
6vF0612jb3g,gimana rasa daging paus..? 🐳,2025-06-15T08:40:00Z,639238,24301,65
pIO2XQJHtr4,"nyobain ""makanan kucing""..? 🐈",2025-06-13T08:40:00Z,309296,14262,164
xNIFQXQKVjw,sushi cuma Rp1000 di jepang.. 🤩,2025-06-11T08:40:01Z,1979944,76869,194
dNy59IUZQts,harus coba ketika ke jepang.. 🤩,2025-06-08T03:00:41Z,57903,3373,22
VeFvyGEwgQI,Restoran Sushi TERSEMBUNYI Di Tempat PALING RAME Di Jepang,2025-06-06T10:01:00Z,71976,2689,84
IRI2E9FXzfg,seaman apa jepang..? 🤔,2025-06-05T03:00:18Z,1264361,61162,360
LQ_UbtKuXDM,jangan tiru yang pernah aku lakuin..,2025-06-02T03:00:23Z,127497,7535,68
f__ituJDP9o,uji keberuntungan pakai receh.. #shorts,2025-05-30T03:00:51Z,94545,4812,33
Dek_viB9iRo,digeledah dan diinterogasi petugas.. #shorts,2025-05-28T03:00:12Z,202506,11196,96
e4cXILIqy5g,10 Cemilan MURAH Yang PASTI Ketemu Di Jepang,2025-05-22T10:01:11Z,76477,3573,107
Xf8EcBVSYHY,temen tau diri vs temen rakus ketika ditraktir.. #shorts,2025-05-22T03:00:42Z,161649,10791,75
j5T5sIvemVs,ayam goreng ¥100 mana yang paling enak..? #shorts,2025-05-16T03:00:49Z,71055,5067,50
EQT6KOKTCKI,ayo coba menu BARU di @marugameudonindonesia !!,2025-05-12T08:00:17Z,49654,5957,125
oIpXpW3avms,air minum indonesia vs jepang.. #shorts,2025-05-09T03:01:02Z,160877,6462,28
L549pvKby34,beli celana branded cuma Rp 10ribu.. #shorts,2025-05-07T03:00:21Z,44863,2972,30
-SHcPjzJO8M,restoran ramen berdiri di jepang.. #shorts,2025-05-05T03:00:00Z,69024,3323,37
-sx1RxQrSio,Ranking 10 Rasa KitKat SPESIAL Jepang,2025-05-01T10:00:01Z,48484,2419,86
RVaYeyzpfdE,webcam paling bagus untuk vtuber.. #shorts,2025-04-23T03:00:37Z,166555,12603,76
fXlK7ievLps,Rp 10 ribu di jepang dapet apa aja..? #shorts,2025-04-21T03:00:49Z,90949,5310,29
ErAv3YHObj8,24 Jam Cuma Beli Makanan 100 Yen Di Jepang,2025-04-17T10:00:21Z,532566,10231,421
YquaSJHJlrI,aku masuk majalah jepang.. #shorts,2025-04-15T08:06:34Z,146478,11630,113
xROOqzOg39c,headphone wireless canggih.. #shorts #Razer #RazerHeadset,2025-04-11T03:01:05Z,37618,2336,43
65_J5CnW3Bg,top 5 akemi short cover 2022 #shorts,2025-04-09T03:01:51Z,25779,2499,57
Bqwrd2S45nk,bau badan paling sinting.. #shorts,2025-04-04T17:00:16Z,94174,9452,97
lptMAFTDPtQ,segepok cuma 10ribuan.. #shorts,2025-04-04T03:00:46Z,84615,4596,65
4dffIPIaGwk,semuanya serba Rp 40.000.. #shorts,2025-04-02T03:00:04Z,52859,4262,39
ERSkXd0sRZM,"Restoran Serba Rp 40.000 Di Jepang, HARUS COBA!",2025-03-31T03:00:19Z,156610,4738,96
_GLI3Zklp9w,paket paling besar dari luar negeri.. #shorts #RazerChair,2025-03-28T03:00:36Z,29239,3172,60
eD4fSEfRL6w,🔴 Udah Pada Libur Belom?,2025-03-26T23:50:59Z,12812,1066,40
5zI5EKPaojY,dikirimin paket packing kayu dari luar negeri.. #shorts,2025-03-26T03:00:06Z,35642,4094,37
i8NalQ8Re9c,😁,2025-03-24T03:00:28Z,65150,7491,194
fL2iF2IuqXg,udah diskon 350 juta.. #shorts,2025-03-21T03:00:40Z,102589,10379,309
YcPZC8CfPeY,semoga aku ga racunin orang.. #shorts,2025-03-18T03:00:25Z,407226,25024,178
iflP77fGNu4,tersesat waktu masih kecil.. #shorts #vtuber,2025-03-15T03:00:41Z,251410,22651,147
5ofZLQZHTcc,jangan pernah pasang koyo di sini.. #shorts,2025-03-12T03:00:05Z,256023,25503,127
Ilovi9vbNB0,🔴 Kasih Tau Aku Game Seru,2025-03-04T11:10:53Z,9353,1228,18
6jYKFNYdrtg,senter iphone vs android.. #shorts,2025-03-01T08:00:06Z,73506,6984,50
KfuSs8yc2I8,permen yang lagi viral di jepang.. #shorts,2025-02-26T08:00:27Z,263047,20729,101
IyV7C31QLlM,makan es krim ikan teri.. #shorts,2025-02-23T08:00:25Z,43646,3529,60
5Sxto83tVvc,Cookie Paling Langka Di Toko Serba Ada Jepang,2025-02-20T08:00:05Z,18548,1129,60
N3Rb2AESDw0,aku pilih pemenang giveaway.. #shorts,2025-02-17T08:00:30Z,40781,4487,77
pHzpXZ2EVwo,Koiiro - Akemi Nekomachi Cover (Piano Ver.),2025-02-14T12:32:23Z,47189,4360,231
67HUontKaF4,jangan sampe kena tipu.. #shorts,2025-02-13T08:00:06Z,158238,21024,172
9n1axkNE3aY,kaos tipis tapi malah hangat.. #shorts,2025-02-11T08:00:08Z,678914,60943,72
f-hcFRTWynE,gyoza paling gendut yg pernah kumakan.. #shorts,2025-02-08T08:00:29Z,53474,6824,47
YlaKIL9uSc0,minuman rasa cheesecake.. (aku suka bgt) #shorts,2025-02-05T08:00:34Z,35387,3508,39
fzW9_2tPxFQ,Restoran Ini Jual Hanya 1 Menu Dan Kenapa Kamu HARUS COBA!,2025-02-01T10:00:41Z,39877,1873,107
EUZSV43aoWE,minuman motif squid game.. #shorts,2025-01-29T08:00:15Z,82616,4911,54
eNEEcIrsv4M,pencapaian paling keren di youtube.. #shorts,2025-01-25T10:00:41Z,32402,3674,41
_RPyB38YV0g,isi lampu LED.. #shorts,2025-01-22T10:00:42Z,1035501,80781,312
ZfoeyH8zbps,"jangan panik, HPmu belum rusak..! #shorts",2025-01-19T10:00:30Z,65773,6082,72
1YM00qg5G64,kantin kejujuran terbesar di indonesia..? #shorts,2025-01-17T10:00:03Z,87653,7564,56
HeBaWZwRbXA,collab yang ditunggu banget.. #shorts #ColorfulStageEN,2025-01-15T10:00:16Z,39463,4445,71
rLNG0ketPl4,24 Jam Hidup Diatur Game Di Jepang #ColorfulStageEN,2025-01-13T10:01:01Z,81701,3488,220
YgbF1NrFfsY,restoran collab indonesia x jepang x cina.. #shorts,2025-01-10T10:00:42Z,109032,10273,68
KJla2gMc3vE,website pemerintah kena hack..? #shorts,2025-01-07T10:00:30Z,103494,9192,75
h6VdQAYvxRA,hampir diendorse jud* online.. #shorts,2025-01-04T10:00:41Z,158247,13658,148
6n8McbIqjgg,Perbedaan Tahun Baru Di Indonesia VS Jepang,2025-01-01T10:00:10Z,24409,1615,112
f_ShdOJT0fA,youtube play button aku rusak.. #shorts,2024-12-29T10:00:39Z,427848,26210,121
3sAm02NxEig,Aku Cobain Makanan PALING UNIK Di Jepang,2024-12-27T10:00:04Z,83079,3667,113
hxcqIIGqtrM,cara dapet boba gratis.. #shorts,2024-12-26T10:00:43Z,768393,68826,233
labUITDyJx0,mungkin aku yang salah.. #shorts,2024-12-23T10:00:46Z,86286,9849,65
Qs-puOilze0,3 Tempat Makan MURAH Di Jepang Yang Harus Kamu Tau!,2024-12-20T10:00:33Z,97826,3413,108
p0Z5ybKV5R0,lagu yang bikin trauma.. #shorts,2024-12-17T10:00:52Z,307109,21413,518
i7BIR5WMf8E,Tempat PALING HEMAT Beli Makanan Di Jepang,2024-12-13T10:00:45Z,256800,6377,208
TFl2fpvBvFw,🔴 Petualangan Budi Setelah Lulus - TROUBLEMAKER 2,2024-12-13T02:42:21Z,14200,936,27
7qDVZt8FUJQ,game ini bakal rilis tahun depan.. #shorts,2024-12-12T10:20:00Z,53301,4241,35
jT41utX5o40,nyobain permen legend dari shin-chan.. #shorts,2024-12-11T08:00:29Z,121637,7100,92
uMBdxcEy11Y,"Nginep Di Kantor Jepang, Bangun2 Kok Di Hutan..?",2024-12-07T08:00:43Z,95482,3297,111
oILuf0eyX2k,kota besar butuh lebih banyak ini.. #shorts,2024-12-05T08:00:39Z,83290,6838,90
N-hTdHbGpXM,pensil ajaib pemberi jawaban.. #shorts,2024-12-02T08:00:13Z,1748135,86137,751
LqoDKcO0GsQ,es krim kopi panas.. #shorts,2024-11-29T08:00:16Z,76581,7814,59
2ceLB7qPMOg,jadi gojek warmindo ke jepang.. #shorts,2024-11-29T08:00:02Z,56258,5428,90
FF_3F7UEp7k,aku turutin LAGI permintaan subscribersku.. #shorts,2024-11-26T08:00:10Z,152632,22161,721
bIrhmoTI0-w,🔴 BATTLE ROYALE VS 30+ VTUBER LAIN - Dusty Derby,2024-11-24T14:45:38Z,19672,1887,17
hH3nPT_tJM0,menang itu bukan segalanya.. #shorts,2024-11-24T03:00:35Z,75318,9761,61
I90_LyYxSig,"Aku Pindah Ke Jepang, Ini Hal Yang Perlu Kamu Ketahui!",2024-11-23T08:00:13Z,159413,7302,294
q33-14t3tqM,🔴DUSTY DERBY - MENJADI NOMOR 1 WALAU AKU HANYA DEBU,2024-11-20T15:09:10Z,12643,1041,13
O5Spva_5b0w,sejak kapan kamu sadar..? #shorts,2024-11-17T08:00:28Z,1010204,63525,151
hcquNQye4Ps,tutorial praktis cara jadi vtuber.. #shorts,2024-11-14T08:00:37Z,91188,9449,46
cyhI9zII7F4,behind the scene APT,2024-11-12T08:00:25Z,241353,18486,165
1MnfQXdyY2Q,🔴 AKEMI FACE REVEAL 3D,2024-11-11T13:02:43Z,242737,10936,689
By1pcDvvyDk,akemi face reveal.. #shorts,2024-11-11T08:10:00Z,602939,41829,358
zfW1R1wvC-8,Tutorial Cara Jadi Vtuber LENGKAP & PRAKTIS,2024-11-07T08:00:55Z,86357,4913,138
BqbeHZ9gQw8,plot twist paling gila di gameshow.. (@krowthornes vs @GarinBubbles) #shorts,2024-11-05T08:00:08Z,67364,7894,47
kllhDzkQEC4,kamu ga akan nyangka dengan yang aku jual.. #shorts,2024-11-02T08:00:29Z,118372,13038,238
Gt-Yyfzo1nI,aku turutin permintaan subscribersku.. #shorts,2024-10-30T08:00:09Z,78285,9207,459
9cbW46puSlc,jarimu yang bisa tentuin.. #shorts,2024-10-27T08:00:04Z,45496,4988,84
PNjhQoMSe4g,hobi yang beda dari yang lain.. #shorts,2024-10-24T08:00:19Z,209797,15930,94
GipPkVMrv9M,akhirnya aku tepatin janji ke kalian.. #shorts #vtuber,2024-10-20T08:00:12Z,636210,44898,147
WNVrMaP45R8,Mengubah Hobi Masa Kecil Jadi Duit,2024-10-18T08:00:20Z,28926,1790,58
E0FQjz5mMAY,"2,5juta subscribers = pindah ke jepang #shorts",2024-10-16T08:00:15Z,209331,13995,262
WNn1v3M1wSE,followersku kelakuannya ada-ada aja.. #shorts,2024-10-14T08:00:27Z,1020253,69262,973
LCdei0gf5fM,🔴 SIAPA YANG AKAN MEMBAWA PULANG KULKAS DENGAN 6 PINTU? 【Akemillion Show】 @krowthornes @GarinBubbles,2024-10-13T13:22:08Z,29730,3497,35
tlEo3wwFcPI,🔴 PART 2 Merebut Kekuasaan Negara SPOILER WARNING!! - Metaphor Re:Fantazio,2024-10-11T22:56:39Z,3469,241,7
vj3_U2olSgI,🔴 SPOILER ALERT!! Apakah Ini Salah Satu Game Terbaik 2024? - Metaphor Re:Fantazio,2024-10-10T15:02:12Z,2784,342,5
1h7WL4kW1ao,lagu ini salah lirik.. #shorts,2024-10-08T08:00:01Z,2502146,79649,380
hfcfpnEtfug,Tebak Di Mana Lirik Yang Salah!,2024-10-05T08:00:27Z,185177,4361,167
0rn6jAOHo_A,🔴 Berburu Kartu Langka!! - TCG Card Show Simulator,2024-10-04T15:11:40Z,5202,546,8
CQKImyLyxqA,waspada modus penipuan.. #shorts,2024-09-30T22:00:08Z,651897,38367,413
Ma6-Nq7psVE,aku gombalin temen.. #shorts,2024-09-29T08:00:15Z,317844,18253,74
icNLdB_bFm4,Aku Gombalin Teman Sampai Dia SALTING,2024-09-26T08:00:24Z,527778,18706,441
6AgGv5Q4NJY,kesalahan bodoh yang aku takuti.. #shorts,2024-09-22T22:00:04Z,58369,6837,50
VnN4tC1DBqE,pilihan lagu unik buat dinyanyiin.. (ft. @gemagathika @AveKanehoshii @xSoutaa),2024-09-19T22:00:31Z,192114,13489,277
U_BpAyGu_lg,harga model terbaru akemi 2024..,2024-09-16T00:36:39Z,210175,16759,47
mxTeB0B1glo,🔴 MODEL BARU 2.0 - Dan Agenda Baru,2024-09-14T14:07:59Z,31335,3088,41
AH6a0UA51rk,Berapa Harga Model VTuber? (2020 vs 2024),2024-09-12T08:00:04Z,534689,16649,440
H_WRbd6d3-A,kehilangan cinta pertamaku.. #shorts,2024-09-09T22:00:10Z,265285,22982,363
30nl_aD7Sk4,baru tau ada yang 96 jam.. #shorts,2024-09-06T22:00:08Z,100472,10926,75
5BzcHRLYgKs,desain youtube play button baru.. #shorts,2024-09-03T22:00:06Z,414702,25295,54
bM5ElACQI0k,coklat @MrBeast terbaru.. #shorts,2024-08-31T22:00:34Z,822688,43808,187
myLfNsr8ZX8,isi kartu ATM.. #shorts,2024-08-30T22:03:53Z,504271,39287,62
3Cqr18Vy9d0,minuman kopi paling kemahalan.. #shorts,2024-08-27T22:00:10Z,498268,37356,267
1ssOzXxgT7Y,Aku Review Coklat @MrBeast,2024-08-24T22:00:02Z,91230,3263,125
v9uCSCxBcA4,alat supaya pakaian jadi baru lagi.. #shorts,2024-08-21T22:00:46Z,3646407,211039,436
39gaT_cCAa0,5 snack limited edition di jepang.. #shorts,2024-08-18T22:00:02Z,251472,21694,99
mZWV-P3kheA,masalah ketombe.. #shorts,2024-08-15T22:00:34Z,229203,23354,164
zdhR-VSOoeQ,5 snack murah pengganjal perut di jepang.. #shorts,2024-08-12T22:00:39Z,207959,16759,84
PXk53jREuU0,borong di sumpermarket sampai dilihatin orang.. #shorts,2024-08-09T22:00:12Z,16125776,573128,1639
bRXYtLtLz7c,masalah dengan lagu yang lagi viral.. (fatal) #shorts,2024-08-06T17:00:32Z,136816,17660,175
Yvo3QklG68U,isi kotak internet.. #shorts,2024-08-04T03:00:21Z,75025,5762,68
ZIAmm1LpYho,request kalian yang paling gila.. (koiiro) #shorts,2024-08-01T03:00:21Z,197892,26393,392
Ic0be8Zpja4,teriakan paling kenceng seumur hidup.. #shorts,2024-07-27T03:00:11Z,2261859,143462,1191
QbAmaEN-JIo,makanan bergizi Rp 7.500.. #shorts,2024-07-25T03:00:14Z,489686,40439,552
CtwNX_hEZ6s,minuman energi oshi no ko.. #shorts,2024-07-22T03:00:13Z,334624,33944,169
_O_OUCEaj5g,Oshi No Ko OP - IDOL (Male/Aqua Ver.),2024-07-19T12:00:39Z,367871,25519,1036
DBUoRwXPNqg,5 susu orang jepang dengan rasa unik.. #shorts,2024-07-16T03:00:12Z,53479,5034,99
xgGOuChg_1I,Ditampar Akemi (Versi 1 Jam),2024-07-13T03:00:42Z,33877,3209,396
8hprZHPkeDU,4 snack viral di jepang.. #shorts,2024-07-10T03:00:10Z,1138776,75747,357
Ei1L64SWMEw,reaksi orang jepang makan snack pedas.. #shorts,2024-07-07T03:00:13Z,6481090,314027,953
Z56B4OGt3xA,nyobain 5 susu orang jepang.. #shorts,2024-07-04T03:00:19Z,161710,14406,244
lxRpxBV9j7I,3 cookies jepang yang harus kamu coba.. #shorts,2024-07-01T05:00:21Z,84536,8536,53
Hk4AamucHgw,4 mi instan jepang yang harus kamu cobain.. #shorts,2024-06-28T03:00:09Z,346935,29106,309
I_oKXmCzNfQ,kue mana yang lebih enak..? #shorts,2024-06-25T03:00:08Z,177915,15720,87
nera7LWiUiI,100 Snack Jepang MURAH & ENAK,2024-06-20T08:00:27Z,1458603,24094,871
KAcWXEKekaE,dibantai sampai gregetan.. #shorts,2024-06-14T03:00:11Z,94005,7530,109
qIVr22YZa9g,aku makan makanan yang masih gerak di jepang.. #shorts,2024-06-12T03:00:29Z,400819,40698,160
ZN1tkJjrcvo,"AYO MAIN BARENG, YANG MENANG JADI MODERATOR【PUBG MOBILE】",2024-06-12T01:42:57Z,20425,708,22
9f7yKrkrYjI,"Kalo Mau RUSUH, Minimal JAGO【Mabar Mobile Legends】",2024-06-08T10:51:34Z,11335,896,21
ei8BASbt-rI,aku salah masuk kamar ketika di jepang.. #shorts,2024-06-03T03:00:29Z,149307,16409,129
TnUjwYmnbYI,gacha misterius dan bahaya di jepang.. #shorts,2024-06-01T03:00:30Z,1208954,112596,404
y8XRRSHljoM,indonesia lebih modern daripada jepang.. #shorts,2024-05-30T03:00:38Z,2478336,167511,741
WPCygmv_ahY,【MINECRAFT】Perjuangan Menjadi Lebih Kuat #anomalismp,2024-05-29T20:00:39Z,14870,1333,23
q7iFgWHbtK0,aku baru tau ini ketika di jepang.. #shorts,2024-05-28T03:00:24Z,193045,24542,68
3ziwFeDse9Y,【MINECRAFT】Anomali SMP - Memulai Petualangan Baru,2024-05-26T15:16:05Z,34034,4030,38
oo2CHR-S8h8,Aku Dimarahi Padahal Baru Sampai Di Jepang,2024-05-25T03:00:34Z,306279,29355,136
7BtiK7sEtI0,makan mi instan kadaluarsa 1 tahun.. #shorts,2024-05-23T03:00:04Z,4614609,171391,908
JhWjv7789AI,ketika ga punya sisir di jepang.. #shorts,2024-05-20T03:00:11Z,8114571,215536,564
57f4dD41qW4,🔴 Cerita Pengalamanku Di Jepang - LIVE STREAM,2024-05-19T13:19:13Z,9352,1138,41
mmvWwHh9lp4,chat dengan penipu di whatsapp.. #shorts,2024-05-18T03:00:27Z,4279642,232069,2528
UnoHgptViEA,kamu pasti belom pernah ke alfamart ini.. #shorts,2024-05-16T03:00:16Z,532510,52132,279
gPSmG16mX2Q,perbedaan ayam goreng indonesia VS jepang.. #vtuber,2024-05-11T03:00:27Z,9095762,479777,1000
b3h6FtFX9Sc,aku gacha mystery box frieren di jepang.. #shorts,2024-05-06T03:00:19Z,1352414,139761,371
BFCunO1MPv4,mystery box dapet HP.. #shorts,2024-05-01T05:00:04Z,229169,22090,88
oYkyxITl2u8,soto tapi dirakit dulu.. #shorts,2024-04-29T03:00:33Z,161963,16495,99
6Lm41XIgkds,oden famima VS lawson VS k3mart.. #shorts,2024-04-27T03:00:06Z,356127,31427,88
YHDxkhe0LrY,aku bagi2 50 pack kartu pokémon..  #shorts,2024-04-26T03:00:29Z,227137,8839,97
EMOZWd92B84,buka banyak demi yang langka.. #shorts,2024-04-25T03:00:09Z,421219,29201,94
xqajyeCkod4,Unboxing Kartu TCG dan Diserbu Bocil GIVEAWAY!,2024-04-23T08:00:33Z,45888,1705,171
tC-w6uYQtiM,main game sambil lari.. #shorts,2024-04-19T06:04:41Z,94990,8964,147
OZGGTK0VfPQ,Aku Lari Sambil Jelasin Cara Cepat Jago Project Sekai,2024-04-19T06:04:33Z,21029,1211,81
NB2x18LCuBg,membuka isi powerbank.. #shorts #vtuber,2024-04-08T05:34:54Z,975350,58305,353
PbyKKRObiSI,hotel butik terbaik di jakarta (apa benar?)..,2024-03-23T03:00:24Z,327327,22446,169
qWyUuB495Zc,kafe terkeren di jakarta.. #shorts,2024-03-11T03:00:33Z,111692,7670,152
qZv6TZOjyDo,Challenge 4 Hari Ke Singapura Cuma Bawa Rp1juta,2024-02-17T04:00:20Z,102527,3462,142
EcrukMGkybA,aku diminta palsuin ijazah.. #shorts,2024-01-31T15:45:02Z,290884,23148,173
B62GqK1zQMw,rumah temenku dipake syuting sinetron.. #shorts,2024-01-30T14:00:17Z,1480492,105990,562
cv-_X_Ucous,aku pernah masuk acara TV.. #shorts,2024-01-29T16:30:11Z,1992318,105082,2099
XDt9HmUazs0,2 kenyataan dan 1 kebohongan.. #shorts,2024-01-28T16:00:30Z,494834,34149,1466
zQjpIDTIlE4,apa kamu bisa membuka gembok ini..? #shorts,2024-01-27T13:45:03Z,613760,71590,2251
dJN_RnN0YvM,seberapa hebat logika otakmu.. #shorts,2024-01-25T15:30:09Z,213578,24933,3995
7VKpjl5XSeA,bagaimana kalo congormu saya lakban.. #shorts,2024-01-24T14:45:00Z,949744,76850,390
7T3LWZonruM,persamaan indonesia dengan filipina.. #shorts #vtuber,2024-01-23T10:00:05Z,387610,39500,297
JPW2xa6ewGY,tinggal di kota besar atau kota kecil..? #shorts #vtuber,2024-01-22T14:00:16Z,170696,12370,192
IUA9HvsGycY,gagal dapat emas.. #shorts #vtuber,2024-01-21T14:00:11Z,696982,45689,125
g4CQiatksqo,dapet paket dari perusahaan game.. #shorts #vtuber,2024-01-20T14:15:02Z,810904,73544,250
SDJbUFqG-Io,perbedaan indonesia dengan filipina.. #shorts #vtuber,2024-01-19T08:00:13Z,7052822,258886,2324
gLIKGF_-ycI,kamu pasti ga tau lantai berapa.. #shorts #vtuber,2024-01-18T03:00:19Z,1544384,122443,8418
YNPeNUCgbtI,aku cobain coklat @MrBeast yang ga dijual di indonesia.. #shorts #vtuber,2024-01-17T03:00:16Z,5325377,297015,1713
s3Ai5TsYqPQ,aku membuat kesalahan besar.. #shorts #vtuber,2024-01-16T03:00:34Z,633359,54485,406
muLFO76oa6U,penemuan aneh di bak pasir sekolah.. #shorts #vtuber,2024-01-15T03:00:21Z,977738,59184,221
hiVyJfeIKMs,5 menit lagi.. #shorts #vtuber,2024-01-14T03:00:24Z,81848,7313,116
jg-vQHLCT_Q,seberapa lama kamu bisa menahan nafas.. #shorts #vtuber,2024-01-13T03:00:25Z,538400,54186,9227
MMzI-z0pbT4,mobil mana yang paling cepat..? #shorts #vtuber,2024-01-12T03:00:14Z,60295,3411,96
