id,title,publishedAt,viewCount,likeCount,commentCount
2N0ayZlw72k,Michi Teaches Chat About The Borobudur Temples!,2025-12-13T07:56:01Z,9874,904,35
J6trjMmkLo4,Michi Plays Red Dead Redemption 2 For The First Time!,2025-12-13T07:43:39Z,978,165,9
7oaTbH4p3Sk,Who Remembers This?,2025-12-12T06:30:02Z,13323,1337,21
bIruf0DSXc0,Michi & Numi Play The ReAnimal Demo!,2025-12-12T06:22:52Z,1875,280,12
QgDe5zdwUB8,I Think He Got Mad..,2025-12-10T08:38:30Z,9719,671,7
ycN5XPKMO4M,When VTubers Play Peak..,2025-12-09T22:44:03Z,5856,643,23
N133hpqyAIw,We Have The Best Duo Chemistry..,2025-12-08T06:15:02Z,39495,2068,32
RcGMih1iRyk,Michi Reacts To Henya's Gifts!,2025-12-08T05:56:05Z,14329,1018,81
DMTFmhD9n9g,Michi Plays Snowbreak: Containment Zone!,2025-12-07T11:31:10Z,2786,297,10
nHZ6sij1rNo,This Didn't Register In My Brain..,2025-12-05T07:28:07Z,8808,791,11
xgVIfAATMx8,I Wasn't Careful..,2025-12-03T09:19:16Z,13369,950,8
TtJc-bMrBnU,I Taught My Chat Indonesian Slang!,2025-12-02T15:30:18Z,7076,721,43
TNKf4eDGX98,I Borrowed Numi's Clothes..,2025-12-02T08:50:25Z,19094,1519,21
yU8Cqy2EN7g,Michi & Numi Go To Home Depot!,2025-12-01T07:45:04Z,23826,1562,19
17gXcvGnbX4,Michi Debuts A BRAND NEW Model!,2025-12-01T06:54:55Z,7532,787,42
8Ci1QuSg6r8,Michi Learns Canadian Slang With Will Arnett!,2025-11-29T01:15:00Z,10931,616,122
7e0OOjWRLP8,Michi Reacts To Arielle's New Model!,2025-11-28T22:17:05Z,5911,431,11
bypS0Xt-3zQ,Numi Exposes Herself..,2025-11-25T01:45:57Z,16386,1687,38
zH1BzNdWntg,I Got A New Pet!,2025-11-25T01:44:02Z,15854,1242,81
7zE-dh7YJwE,This Caught Me Off Guard..,2025-11-24T07:51:03Z,71773,3815,16
v2J73vXcGcg,I Think I Love This Game..,2025-11-21T06:25:32Z,17254,1153,22
oZAsn49tiTQ,Michi Reacts To Summersong (Miyolophone) Cover By Rachie & More!,2025-11-18T08:23:33Z,2004,253,13
_xihbLJxHCY,That Didn't End Well..,2025-11-17T07:51:08Z,23085,1463,14
B6ahNrHMjU8,Michi Plays Peak With Friends!,2025-11-17T07:51:03Z,6714,601,15
pfBpkLx_OC4,Numi Calls Me A Pig..,2025-11-16T07:17:46Z,35378,2366,26
k_8aB3IbJ6Y,"Numi Was So Lost,,",2025-11-15T07:26:41Z,41788,2480,17
lb-EEnTSSOE,It''s Time To Go Gambling!,2025-11-14T07:51:23Z,19920,1513,27
ztHrQf-tOYE,Rage baiting Numi Is The Best..,2025-11-12T06:25:51Z,50052,3250,29
m0TTVsZJpZ0,I Become A Dog..,2025-11-06T19:05:09Z,34243,2973,33
65LxFmWGIPc,Can Someone Pick Me Up Like This..,2025-11-01T22:11:56Z,55464,3538,37
AbkrvSnxotI,Numi's Clingy In The Morning..,2025-10-28T06:59:38Z,75150,4702,100
L_3Ly9czvHU,I regret this..,2025-10-28T06:58:40Z,17905,1300,84
uhdOxD18QiI,My Experience In America..,2025-10-27T06:30:40Z,55902,3239,225
awX4y44sRAk,I Didn't Do Anything..,2025-10-26T08:26:35Z,24846,1512,15
SBc8hY3YCr8,Michi Made Her Crash Out..,2025-10-23T05:45:18Z,24246,1567,10
RBK-PpVGDt8,I Miss Numi..,2025-10-20T06:25:22Z,36681,3013,37
T94uF14_Vhc,LETS GO GAMBLING!,2025-10-18T05:22:06Z,23544,1644,13
pv5M-oDaV0s,Violence Is Never The Answer..,2025-10-17T06:53:55Z,14454,1168,20
zLi8u_o2do4,I CAN COOK!,2025-10-15T06:32:54Z,20059,1697,26
K3ehxyhH_sY,Michi's Experiences Hooter's For The First Time..,2025-10-15T06:30:30Z,14275,1095,53
yhUre0Eril8,Is Indonesia Open Minded..,2025-10-14T05:21:01Z,27040,2197,40
bdWgfitKW4I,We Made A Cover To How It's Done / KPop Demon Hunters!,2025-10-14T05:18:36Z,7574,784,31
V1KGlKTxA98,I Became Kuro!,2025-10-12T06:39:44Z,18510,1600,13
-MlCBHXdatg,Michi Plays Blue Protocol: Star Resonance!,2025-10-12T06:37:41Z,2559,260,7
EEOotZIK4Ic,Michi Tries Stealing Someone's Girl..,2025-10-11T06:41:58Z,10062,864,5
tCXA44dO194,I'm Sorry U-san...,2025-10-10T06:53:33Z,37217,1969,16
Q33YbVZ8oAY,Michi Plays Venba For The First Time!,2025-10-10T06:43:09Z,2900,329,19
mjtN0hVMl7c,I Tried Doing A Nice Gesture..,2025-10-09T06:02:26Z,14863,929,9
gCVXIIKZXTo,How To Summon Michi..,2025-10-08T06:42:17Z,64922,4205,30
R6GCxtfGkr0,The Nintendo Store Broke My Brain..,2025-10-08T03:15:04Z,9676,599,42
GwZb_NwrJng,Michi Betrays Her Teammates..,2025-10-07T06:59:19Z,10984,996,10
VyrLC8Gx9zA,Michi Teaches Chat About Relationships..,2025-10-07T06:55:45Z,10715,948,54
PHQFsWCKumg,The Horses Didn't Have To Die..,2025-10-06T06:36:50Z,12875,879,10
iA595Nc3yeA,Michi Reacts To Free - KPop Demon Hunters || Issa Corva & @Derivakat Cover & More!,2025-10-06T06:34:51Z,6174,560,27
-clmdjAlOlg,Mouse Is A Ragebaiter..,2025-10-05T03:15:01Z,27678,2826,17
PmO-P0HFzq0,Michi Reacts To The XQC Situation..,2025-10-05T02:13:33Z,8768,587,38
X6q6kOuwPEs,Everything went wrong..,2025-10-04T07:17:23Z,22521,2444,17
ye9EdDnEuH0,I Got Some New Model Updates!,2025-10-04T07:14:25Z,7396,651,17
2_7aZarVRZ0,Michi Can't Control Herself..,2025-10-03T07:04:11Z,20966,1698,12
9e2K8LAzDo0,The Winner of the Outfit Competition..,2025-10-03T07:00:09Z,9951,866,38
7_cjJjUL_4c,I Got Baited..,2025-10-01T06:53:24Z,54573,2729,8
nGjol9xR7yc,Michi & Friends Play Minecraft!,2025-10-01T06:51:56Z,5198,463,10
8Ye90BE0wZI,This Is All I Want..,2025-09-30T06:22:17Z,27605,2085,38
f6ZRyQfgifE,Michi Reacts to Ollie's Rant!,2025-09-30T06:18:07Z,13650,1184,38
2b2iOB7Uqco,How Do You Run Into Your Own Trap..,2025-09-29T04:59:05Z,30555,1546,11
cZKYr0DFHeA,Michi Joins An Art Class In Rust Kingdoms!,2025-09-29T04:58:09Z,2385,338,5
TA5bZOd_rQw,Rate This Drip..,2025-09-28T07:00:42Z,29937,2062,16
f5FLMY5lrCU,Michi Reacts To Saiiren Cover of ヴァンパイア (The Vampire),2025-09-27T06:44:32Z,4123,460,11
n9hKJwAuHHE,I Got A Random Call On Rust..,2025-09-27T02:15:06Z,15470,1002,2
WNrN62uzjBQ,I'm The Worst Gambler of All Time..,2025-09-27T00:13:49Z,10816,739,5
Lm6a_ctXieo,Michi's First Time Playing Spell Candle..,2025-09-26T05:55:22Z,4307,249,6
_AcNkI48IBo,Michi & Ironmouse Play Goddess of Victory: Nikke!,2025-09-25T05:34:21Z,6723,560,24
1opTaUx_dnc,We Share The Same Braincell..,2025-09-25T00:55:43Z,17996,1250,14
7heWa3XhoIY,How Did They Do This..,2025-09-23T02:41:40Z,31500,1608,8
ogIBUIYWVDU,Michi's First Time Playing Rust..,2025-09-23T02:15:07Z,5413,436,10
VSBrrzkWVFQ,I Got Caught Stalking Saiiren..,2025-09-22T03:15:04Z,19874,1907,11
A9kqVgy37DY,Chat & I Have A Dance Party!,2025-09-21T06:26:40Z,4628,615,21
OhUDKvj_HPw,This Is All I Want In Somebody..,2025-09-21T03:15:01Z,42182,2979,50
woXSx2pUUkY,I Tried Building My Own Waterpark!,2025-09-20T05:19:13Z,3394,374,13
7cE3IhRz06I,I Have A Surprise..,2025-09-20T04:15:00Z,27232,1996,18
O_z_PAbf674,I Learned My Fortune..,2025-09-19T03:15:03Z,33452,2211,10
Qd81gWRKBv4,This Is The BEST Outfit Competition Yet..,2025-09-19T02:39:15Z,6565,561,41
cUKByymz33g,Michi's First Time On Pixel Canvas!,2025-09-18T06:30:25Z,4845,460,10
xIYXmnsfvj4,I Told My Mom That Ironmouse Is Short..,2025-09-18T03:15:13Z,224257,12995,92
GTUm34i71rI,Michi Reacts To Nintendo Direct!,2025-09-17T06:38:16Z,6987,456,45
MAkqqI-_yoQ,The Doctor Told Me To Scan My Brain..,2025-09-17T03:15:05Z,46025,3706,31
djnJ4_n_Cho,My Cutest Model Yet..,2025-09-16T05:33:20Z,16052,1604,70
KreA8ZmilHI,Michi Learns About Pen Island..,2025-09-16T03:15:01Z,34978,2734,19
Ga4KA6mM8h0,We Thought This Would Be Easy..,2025-09-15T07:06:24Z,28491,1532,8
T65qJ2w1asM,Michi & Numi Watch EPC The Musical!,2025-09-14T22:58:45Z,35453,1867,101
WZ_JD2QnBYs,Thank You For Watching The Subathon!,2025-09-14T02:15:01Z,4914,761,41
P-LqBQLIp28,What Did I Just Listen To..,2025-09-13T22:00:02Z,16534,1175,5
7Wt_nPf0_Bk,Michi Visits Indonesian Rice Fields!,2025-09-13T06:22:02Z,21146,1422,114
PWas-pu5_W0,Jorts Should Be A Sin..,2025-09-13T02:10:16Z,11841,773,8
eSbyG6h8g5k,This Is All My Fault..,2025-09-12T09:01:07Z,17458,931,3
o9wMCqsZma0,Michi Shows Off Her Craziest Model of All Time!,2025-09-12T08:13:44Z,7732,807,40
PNYUZTcjHVw,"Michi Plays The ""Worst"" Resident Evil..",2025-09-10T03:55:08Z,3273,357,33
fd8WT2DSeds,Numi Made Me The BEST Gift..,2025-09-09T04:19:18Z,28470,2569,42
BUE-z8iNpJo,The Dentist Hates Me..,2025-09-09T04:15:45Z,4455,527,25
lEr7ElosfW4,What Did She Say..,2025-09-08T06:51:16Z,17821,1597,26
0x81mvTLUb0,"We Rated My Viewers ""Hear Me Out's""..",2025-09-08T06:28:59Z,6938,617,36
Vi_2KyAeJkg,"Say The Wrong Word, YOU DIE!! | Cursed Companions",2025-09-07T05:20:31Z,3101,357,7
37Axv7IVdHo,99% Of Gamblers Quit Before Their Biggest Win!,2025-09-06T05:33:21Z,59268,2167,15
kPw_G62mHPE,We Tried To Hunt Ghost..,2025-09-06T04:21:18Z,8779,797,28
zvE9ulZlCyA,Our Friendship Was Tested By This Game..,2025-09-05T06:43:54Z,7266,727,67
FTCdelSVEcg,I Deserve My Compliment..,2025-09-04T05:18:33Z,21516,1745,14
7mN1C5WeH78,She's Perfect For Me..,2025-09-04T05:17:54Z,20003,2037,133
H4jRi4E-dvA,Kill V. Maim - Michi Mochievee & Camila (COVER),2025-09-02T16:00:06Z,416031,17168,581
fZiaPRL3KDo,He Tried Leading Me To My Death..,2025-09-02T05:14:00Z,24546,1765,8
3XVrVOqYr9Q,My Dog Eats Better Than Me..,2025-09-01T06:54:31Z,29732,2150,34
cgPcqyBAjhM,My Chat Hates Me..,2025-08-31T04:44:20Z,22736,1816,19
LDl6aELHlj0,Michi & Mouse Try Climbing To The PEAK!,2025-08-31T04:42:30Z,5627,575,12
awMcvaaz_EY,Michi Plays The Funniest Wizard Game!,2025-08-30T21:56:46Z,2684,343,4
Qowl-fA386k,This Might Be My Best Model Yet..,2025-08-30T06:30:11Z,13508,1503,65
pATFBgSPSCM,Michi Plays Resident Evil 5 For The First Time!,2025-08-30T02:15:09Z,2725,317,24
JoGijWb0osY,Michi Feeds A Tiger At The Bali Zoo!,2025-08-29T23:34:51Z,24070,1659,15
kgeuTBj42ZQ,Michi Had No Remorse..,2025-08-29T06:43:25Z,27431,1899,27
Z-UAfRHaPVM,Michi Goes To The Bali Zoo!,2025-08-29T06:39:24Z,9339,736,27
qsq2JEsHk54,I Rated My Chat's Outfits With Saiiren..,2025-08-28T07:32:29Z,4735,485,19
NgMHa5YIh5M,Mouse Looked So Delicious..,2025-08-27T06:51:45Z,37674,2233,21
uIhXb-pJeGY,The Drama Never Ends..,2025-08-27T06:51:20Z,67564,4636,161
rOxZDGrgY_E,What Did Mouse Just Do..,2025-08-26T04:05:20Z,31766,1859,22
diYNI_1urgg,The Best PEAK Group Yet..,2025-08-24T06:58:58Z,18154,1203,5
2wPkCYRq10k,The Best Show On Youtube Is On..,2025-08-24T06:41:24Z,24154,2283,161
O3pblNpgLXA,I Can't Believe I Witnessed This..,2025-08-23T06:58:17Z,9554,762,11
SB6axvpHNwo,Just Friends... or Something More?,2025-08-23T06:58:14Z,30502,2669,173
galRD6jK27Y,Money Is Serious..,2025-08-23T00:27:32Z,20629,1604,15
NSRh9vAwObY,This Video Has Me DYING..,2025-08-22T04:52:30Z,24233,1529,14
ZWwvLOvsvBU,Henya Singing Is Beautiful..,2025-08-21T06:30:41Z,93248,5246,37
RqxXjhpCwBs,Drunk Talks w/ My Wife..,2025-08-21T06:30:37Z,18760,1811,109
sGAOep0DMLo,I Have The Worst Luck of All Time..,2025-08-20T10:32:23Z,26784,1867,30
4ye_YzxIxAo,Usan & Michi Raise A Baby Together..,2025-08-19T22:46:51Z,5852,586,13
mfLHw-1ztOQ,I Did NOT Expect This..,2025-08-19T22:22:32Z,41369,2918,37
Jpk-nzSExyU,The Best Update of All Time!,2025-08-19T06:15:00Z,35955,1916,18
p7ElAFRWLQk,Michi Shows Off Her New Model To Her Crush..,2025-08-18T23:17:42Z,31592,2573,103
S_CLFZoOkFw,My New Model Is Something Else..,2025-08-18T06:18:58Z,50149,2628,27
8TBpAWzgHGs,Designing a V-Tuber World with Numi!,2025-08-17T20:44:24Z,5243,494,12
j-Qu2N8yvgU,My Chat Hates Me..,2025-08-17T04:25:51Z,22785,1589,25
OizQsSbhONI,OniGiri & I Rated Your Fridges..,2025-08-17T01:23:16Z,6755,565,21
Xor4yE8X7zg,Michi Goes On A Tour of Japan!,2025-08-15T23:38:38Z,6953,529,12
yrg2zWEbB4s,What Did I Just Watch..,2025-08-15T09:51:15Z,16778,1056,23
kJtM3Ni3Jj0,I Played Minecraft With My Crush..,2025-08-14T22:57:47Z,7611,737,46
v57bf1HlBOw,Ollie Is Out of Pocket..,2025-08-14T11:15:11Z,18593,1534,11
j8dX5kGhQP0,Henya Is The Funniest To Troll..,2025-08-14T08:48:45Z,151820,5299,31
cE1a5v0QxTQ,Michi Plays GTA V For The First Time!,2025-08-13T22:15:41Z,9801,751,41
vAR9vhbL5ow,Ollie Has Officially Lost It..,2025-08-13T13:15:20Z,19215,1583,31
lI1FR1ShqYk,I'm Sorry Henya..,2025-08-13T09:22:12Z,112098,5044,45
ltGo55SwV8k,Peak Actually Might Be Hard..,2025-08-12T06:01:05Z,20568,1285,9
jbonilf8zJU,Michi Reacts To Daily Dose of Internet! #2,2025-08-12T03:03:05Z,11956,923,25
ec6Y6iigsW8,Rest In Peace Henya..,2025-08-12T02:15:06Z,55227,2065,16
Pd3uZ9LgYco,I Became a Professional Power Washer!,2025-08-11T02:14:20Z,3977,390,22
Ba2vQqcCXyE,How To Open A Coconut In Peak..,2025-08-10T03:35:33Z,75141,3071,19
LtbW7E9Z4TE,I Have No Words For This..,2025-08-10T03:34:25Z,109240,4763,56
U5Z99OCSicA,Michi Has No Chill..,2025-08-09T13:15:05Z,16368,1365,18
HqHQwmKozpU,Michi Reacts To Daily Dose of Internet!,2025-08-09T01:08:17Z,36727,1985,54
aakc6Br8yhM,The New Ironmouse Teaser Is INSANE..,2025-08-07T23:46:02Z,29110,1925,16
t9xH_mYWjY0,I Became The World's Strongest Mage (Mage Arena),2025-08-07T23:45:18Z,9301,624,16
kmLr3lO2Zx8,I Can't Wait For The Next Ironmouse MV..,2025-08-07T06:45:03Z,10801,1056,8
duv3m9-3lAw,This Is The BEST Beabadoobee Song..,2025-08-07T05:12:02Z,16047,2066,8
fFWh5IxL9PE,Michi Experiences Absolute Cinema..,2025-08-06T01:15:06Z,21003,2176,37
rV467MzziHo,I Played The Most Unhinged Game With My Viewers..,2025-08-05T23:10:13Z,9798,600,31
rmVN0Rs51xc,The Haters Won..,2025-08-05T03:15:05Z,20458,1747,25
yIeChPOXoGc,I Caught Numi Kissing Bao..,2025-08-05T01:15:04Z,14247,1305,17
E4zFmiayAbY,We Reacted To Our Viewers Steam Profiles..,2025-08-04T23:12:02Z,36915,1631,93
y4SH8s-rC8M,Michi Reacts To Old People Using Gen Z Slang..,2025-08-04T16:01:30Z,5556,552,18
gbRweAvQXlI,When Your Indonesian Accent Slips Out..,2025-08-04T04:11:41Z,146876,6694,64
fwUYSGPzKOw,Michi Reacts To Shylily’s Lore..,2025-08-03T21:17:28Z,11754,940,35
_glA46Wpy64,Now This Is PEAK..,2025-08-03T16:15:04Z,11786,818,32
R_cJyovcVSw,Everything I Wanted - Cover by Michi Mochievee,2025-08-03T07:45:06Z,205764,11528,503
IRwGB7F_WpM,Michi New Song With Bari Is Pure Cinema..,2025-08-03T02:18:09Z,18498,1816,17
3gGQIMSIWDg,When The Anime Is So Bad You Can't Stop Watching..,2025-08-02T21:16:44Z,30043,1898,106
r7nr7YQ5Y4s,VShojo Strikes Again..,2025-08-02T16:15:05Z,76755,4049,116
-7QiucKNK7Y,Michi Reacts To Suki-Suki Diesuki Cho AyeShiteru By Marine!,2025-08-02T01:17:12Z,18503,1675,10
p37GeZ0NRAI,Amalee's New Song Is Pure Cinema..,2025-08-01T20:30:08Z,19443,1745,14
mT-thiB-i10,Michi Debuts Her New Model!,2025-08-01T19:51:20Z,46580,3205,81
A9MUBG3lv0U,DEJA VU OFFICIAL MV - Michi Mochievee x K9 Kuro,2025-08-01T06:00:06Z,80850,9801,294
VS0yLoBv1dw,My Weakness Is Hot Woman..,2025-08-01T00:00:17Z,10945,1133,18
iFGIX7L258M,Michi Reacts To Boom by Evil Neuro!,2025-07-30T20:42:52Z,11850,1200,9
4RWlKmo4zkk,Michi finds Easter Egg on Date EVERYTHING!,2025-07-28T22:11:19Z,15233,1512,15
i9Qg0sKmHX8,I Can't Stop Dating Everything..,2025-07-26T22:00:42Z,7695,615,32
RPKHWY9130M,Michi Reacts To Ironmouse's Newest Song!,2025-07-24T19:00:32Z,19155,1634,18
AuQVcl_QSPY,I Sang Every Song My Chat Asked For..,2025-07-24T14:00:18Z,24401,2090,99
FvrQnWgY8Lw,Michi Reacts To U-San's New Song!,2025-07-23T23:00:30Z,11997,1134,10
4k6NUvGfUfo,I Reacted To The Newest V-Tuber Songs!,2025-07-23T19:25:34Z,25619,2247,112
T-blwfMg0Sw,I left VShojo..,2025-07-22T16:43:28Z,366251,30884,1581
jyADP2wKShg,we fell in love in october - girl in red 「 Michi Mochievee Ukulele Cover 」,2025-06-08T02:00:42Z,50581,5496,272
MjLoQzVpEpM,寄り酔い (Tipsy) - 和ぬか 「  Cover by Michi Mochievee 」,2025-04-26T17:00:23Z,94751,4514,213
ot8y3CxZeDM,Ekspektasi - Kunto Aji 3D ver. 「 Cover by Michi Mochievee 」,2025-04-24T17:01:08Z,23917,2484,95
DYHJoyN7TzQ,Flesh without Blood - Grimes 3D ver.「 Cover by Michi Mochievee 」,2025-04-23T17:00:15Z,50819,2719,124
V5CDmngtRZg,マトリョシカ (Matryoshka) - 「 Michi Mochievee x Kureiji Ollie 3D ver. 」,2025-04-22T17:00:37Z,229627,16418,512
AInVzceVdxc,Paparazzi - Lady Gaga 3D ver.「 Cover by Michi Mochievee 」,2025-04-21T17:00:20Z,193792,7420,247
MHxBoI0poko,DEJA VU - Michi Mochievee x K9 Kuro (Acapella ver.),2025-04-21T04:00:19Z,27564,2544,96
slzSvBr8SLk,DEJA VU - Michi Mochievee x K9 Kuro (Original Song 3D ver.),2025-04-20T06:30:34Z,339304,21700,705
GXntqIaiZcU,MY FIRST 3D ANNIVERSARY CONCERT !! 🎉🥳,2025-04-20T06:27:40Z,82366,8399,205
mYSg2u29Op8,"shrimp miku - Michi Mochievee, Isaa Corva, SixteenInMono & Note Phantom Ver.",2025-03-31T17:00:47Z,52020,4591,216
5wZPAinYUEY,THIS VTUBER 𝑵𝑬𝑬𝑫𝑺 TO STOP. ⛔️,2025-02-22T17:00:07Z,67547,5217,151
FV2QAtpVqrI,I FINALLY HAVE A GIRLFRIEND..?! 🥺🥀,2025-02-13T22:00:19Z,20283,1641,42
WGh4sgwW-eM,OPENING THE BEST RESTAURANT WITH HOLOLIVE GIRLS!,2025-01-27T15:30:17Z,27354,2531,48
gx2QE8JKCnM,MICHI MOCHIEVEE HAS TOO MANY OUTFITS!!,2025-01-07T15:15:04Z,16499,1585,58
Ta6Q7rxQQX0,Medicine - Daughter ( Cover by Michi Mochievee ),2025-01-04T17:00:07Z,324239,14938,821
085TvatI2ms,愛猫 (Love cat) - biz×ZERA feat LOLUET 「 Cover by Michi Mochievee ft. Maiko 」,2024-12-28T17:00:08Z,106256,5961,238
rbzHUOMWLVk,"HOLOLIVE, PLEASE DON'T KILL ME..!! KYAAA...",2024-12-16T15:01:02Z,47804,3655,94
x6bCbfFCJqg,SURVIVING WITH HIME..,2024-11-14T15:01:06Z,9390,627,12
RquvxRjapgc,"I know you guys love Valorant, so Henya and I are gonna play it!",2024-11-12T15:00:29Z,9939,777,25
SXLOAQotUZI,RANKING ALL VSHOJO MEMBERS WITH HARUKA,2024-11-07T15:00:35Z,45813,2116,87
lp5wDwT2TBQ,"Playing Mario Party with Bettel, Kuro, and Shoto… Our Friendship Might Not Survive!",2024-11-05T15:00:56Z,11893,828,20
wXK_VLXe1Ys,How Kson Took ALL my MONEY ..!! 💸💀,2024-11-02T15:01:14Z,9332,695,16
Qxd7gJu7CUw,IT WAS A MISTAKE TO RANK MY VIEWER'S ROOMS...,2024-11-01T15:00:35Z,79612,3168,72
IRYrXY2Y3DY,THIS GAMESHOW PROFITS FROM YOUR DEATH?!  - 7 Minutes in Hell,2024-10-30T15:00:31Z,5303,453,6
IUSBLRn_08s,THE UNTIL DAWN REMAKE WAS INSANE!! w/ K9Kuro,2024-10-17T16:00:27Z,24788,1094,55
AE6Z3DHWR9k,Trying Out Character.ai was a mistake..,2024-10-11T15:15:02Z,26684,1433,62
9xUw488-nlA,My 𝙁𝙞𝙧𝙨𝙩 𝙏𝙞𝙢𝙚 Playing Pokémon...,2024-10-03T15:00:17Z,50459,3116,190
21gjLQYFfXM,THE 𝑯𝑬𝑵𝑻𝑨𝑰 TAG TIER LIST. 🔞,2024-09-28T00:00:29Z,41348,2950,166
ntm-FJvc260,"I CALLED THE VSHOJO MEMBERS FOR ""ADVICE"" AND...",2024-09-26T15:01:00Z,41817,2114,76
Fssd9lC0nqM,MY 𝙁𝙄𝙍𝙎𝙏 NEW OUTFIT DEBUT WAS...,2024-09-23T00:00:12Z,34456,2720,113
d9ATrnhPzsY,Every Baby Needs A Da Da Daddy - Marilyn Monroe 「 Cover by Michi Mochievee 」,2024-09-21T14:00:07Z,103141,8341,353
V6P7BYp-hyE,"READING YOUR CONFESSIONS WITH THE PUREST PERSON EVER, BAO THE WHALE",2024-09-19T23:45:01Z,151659,5561,291
H9qfHfXqktg,Don't lump Michi in with those other VTubers who don't shower regularly,2024-09-13T23:45:02Z,14230,946,90
qpggY7kV5HQ,Jared and The Purple Girl,2024-09-12T00:15:04Z,17246,1311,90
jO9jNkrd9vs,OH NO.. SHE'S BACK! I mean.. YAY...!!!,2024-09-09T00:00:31Z,20396,1471,115
-ByqHnzMca0,I AM COMING BACK SOON!! - My FINAL Message for YOU!,2024-09-03T12:15:00Z,18407,2871,330
zy855WkXIXs,THIS FACT WILL MAKE ME SOUND INSANE!! 😃👍,2024-09-02T00:15:04Z,11565,1658,129
ULKpAVPoWcg,i think i wrote this down because i was hungry...,2024-09-01T00:15:02Z,12603,1717,91
blLkYnxZWeA,TODAY'S FUN FACT IS...!🎉,2024-08-31T00:15:05Z,16448,2442,110
W-Wn-XDZvJo,FUN FACT: DURIAN IS CANCELLED! :(,2024-08-30T00:15:01Z,12687,1679,85
zFvnKLdctgo,DID YOU KNOW THAT...!🤓☝️,2024-08-27T00:15:02Z,12160,1784,110
nTxGM905Vak,Michi Mochievee has an existential crisis!! 😃😃,2024-08-26T00:15:04Z,12636,1865,81
7cy2GXhxDQA,𝐃𝐎𝐍'𝐓 WATCH THIS VIDEO BEFORE BED !!😱,2024-08-25T00:15:00Z,12370,1711,116
zTm8XZD5cAU,"ARE ""VTUBERS"" TECHNICALLY 𝐑𝐄𝐀𝐋?",2024-08-24T00:15:03Z,11005,1543,110
FxBFxCILCDE,FUN FACTS TO 𝑩𝑼𝑮 YOUR FRIENDS WITH! 🤓,2024-08-23T00:15:00Z,10820,1608,111
Z47c82Q5J74,ERM.. AKSHUALLY! TODAY'S FUN FACT! ISH MORE PERSONAL IT SHEEMS!🤓,2024-08-20T00:15:02Z,14268,1853,65
kX8bCOi92X4,THANK YOU TWITTER FOR TELLING ME THIS SECRET...,2024-08-19T00:15:02Z,14670,1696,72
H0H7ZTPumD4,THIS IS WHY I 𝙃𝘼𝙏𝙀 ENGLISH.,2024-08-18T00:15:01Z,25121,2850,139
sv69ypM-bPU,MY FAVORITE FUN FACT SO FAR! ( ˶°ㅁ°) !!,2024-08-16T00:15:05Z,15111,1917,67
N9-vUOlnDUA,𝘿𝙊𝙉'𝙏 𝙀𝘼𝙏 𝙏𝙃𝙄𝙎!!,2024-08-14T00:15:02Z,20664,2525,146
eE6j3BAkki0,IS MICHI MOCHIEVEE GONE? 😱,2024-08-13T00:15:01Z,58629,5952,298
U9sQpts-mcw,Michi Learns the Bro Code and Instantly Regrets It,2024-08-11T00:15:01Z,332755,15759,1574
27aia74Ux0w,Michi Can't Speak Any Language Fluently...,2024-08-10T00:00:01Z,25770,1577,129
cGJ7iaTPcCE,Michi is Brainrotting Everyone.. Gedagedigedagedago,2024-08-08T00:15:01Z,33561,2246,187
J3wTtB5v_DY,Chat Knows Where Michi Lives,2024-08-05T00:15:01Z,27303,1796,128
854cHFj7ka0,Michi realizes that maybe she is Uncle Roger's niece,2024-08-03T00:15:00Z,784768,30536,1047
nxKyFgmliJQ,Your Package is Finally Here !,2024-08-01T00:15:02Z,50508,2369,112
Sc_Z0OWvOkk,Took a Moral Alignment Test and Found Out,2024-07-29T00:15:02Z,40658,2299,196
rZdwsL5DVAk,Put These Two Girls in same Place and see what happens,2024-07-28T00:15:04Z,75586,3243,155
PIbuzwP3KP8,IM GONNA DO MY BEST TODAY!!! 🎉🎉 - KARAOKE CHARITY RELAY!【Melodi and Harmony】,2024-07-27T17:01:27Z,21755,2467,47
iv-sELAYTkk,PLAY DRAWY WITH CHAT WAS A MISTAKE,2024-07-26T00:15:02Z,15949,1287,40
KvEtMHYfj-c,"CHAINED TOGETHER WITH SHOTO, U-SAN & DACCA",2024-07-25T00:15:00Z,21889,1693,47
vf2tYL95qzQ,MY BROTHER IS HERE !,2024-07-23T00:15:01Z,54678,3388,122
8HFhEuhVOqc,𝙀𝙓𝙋𝙊𝙎𝙄𝙉𝙂 MICHI MOCHIEVEE WHEN SHE'S MEDICATED.,2024-07-22T00:15:00Z,23665,1224,58
PEIU1uqlQxY,𝐃𝐎𝐍'𝐓 LET THESE GIRLS IN THE SAME ROOM TOGETHER OR ELSE...,2024-07-21T00:15:00Z,55609,2604,180
8bgVRlJT_1U,MICHI 𝙎𝘾𝘼𝙍𝙀𝘿 ZENTREYA WITH HER HOT TAKES !!,2024-07-20T00:15:00Z,60793,2789,129
GVutQwKocUQ,MICHI 𝙁𝙄𝙉𝘼𝙇𝙇𝙔 MEETS BANZOIN HAKKA,2024-07-13T00:15:00Z,34265,2396,86
DXiHmMV1YYk,GREEDY VTUBER USES COMPANY CREDIT CARD,2024-07-10T00:15:00Z,44259,2086,129
QjYvdLSGgSo,𝙏𝙃𝙄𝙎 𝙂𝙄𝙍𝙇 𝘾𝘼𝙉'𝙏 𝘽𝙀 𝙎𝙀𝙍𝙄𝙊𝙐𝙎...😨,2024-07-09T00:15:01Z,37634,2420,195
IOg4y1peKZw,WELCOME TO ELDEN RING 🤡 #shorts,2024-07-08T23:00:06Z,40538,4724,76
iy5BFWvkNhc,𝘿𝙊𝙉'𝙏 LET THESE GIRLS ROLEPLAY AGAIN !!,2024-07-07T00:15:03Z,29851,1830,35
6H054XRZekU,CHAT 𝐁𝐑𝐎𝐊𝐄 ME !! - YOU LAUGH YOU LOOSE CHALLANGE,2024-07-03T00:15:00Z,156840,6621,225
meyT01nMKOM,MAIDENLESS VTUBER FACES KARMA #shorts,2024-07-01T23:00:21Z,25145,2919,32
-7UUrjbzyCM,MY MOM EXPOSED ME ON STREAM!!,2024-07-01T00:30:00Z,51054,3717,95
K8Cf8zgmOE8,YOU WILL BE EDGED. #shorts,2024-06-30T23:00:09Z,28840,3459,48
q3DkkBIOFf8,THEY HELPED ME CHEAT THIS SCARY HORROR GAME !!,2024-06-30T00:30:25Z,13415,1198,27
STMX_eG5LMM,MICHI VS 4 HOLOLIVE GIRLS IN DEAD BY DAYLIGHT !!,2024-06-29T00:15:00Z,37561,2953,78
BywWlebSN94,I HAVE SOMETHING TO SAY...,2024-06-26T09:25:06Z,62472,5005,28
DEoHUkBGnLw,Must've been the wind... #shorts,2024-06-20T23:00:07Z,30948,3447,20
5K4gmfiry9E,THIS VTUBER FAILED GEOGRAPHY #shorts,2024-06-19T23:00:03Z,161755,15720,246
mcnp0TRKNWE,VTUBER DISCOVERS SPACE #shorts,2024-06-15T12:00:08Z,21779,2522,46
W42FKbET6V8,Michi Mochievee calls her Mod 𝓭𝓪𝓭𝓭𝔂  #shorts,2024-06-13T23:00:15Z,17495,2202,14
eLiNNn6lNUs,ANGLES MATTER!! #animated #shorts,2024-06-10T03:27:15Z,29861,4067,32
MqkUSxl-UNY,THIS IS HOW YOU RIZZ PEOPLE! #shorts,2024-06-06T07:19:49Z,19279,2497,35
vI1iXbN4MBo,𝘾𝙊𝙇𝙊𝙍𝘽𝙇𝙄𝙉𝘿 VTUBERS FAIL MOMENTS,2024-05-28T23:00:24Z,63841,4055,102
K-GnW5menQo,ł ⱠØVɆ ɎØɄ... #animated #vtuber #shorts,2024-05-27T23:00:09Z,25784,3996,75
LTkI6qcB1AQ,Michi Mochievee ROASTS herself regularly #shorts,2024-05-23T23:00:19Z,17896,2212,71
s-4Xsra16Hw,Michi experiences INSTANT KARMA #shorts,2024-05-20T23:00:32Z,57803,6095,43
TTaXkDZuCHc,𝐎 𝐁 𝐋 𝐈 𝐕 𝐈 𝐎 𝐍,2024-05-19T09:15:07Z,243281,11160,800
fb1ur81x4Gw,UNO but we're 𝐂𝐎𝐋𝐎𝐑𝐁𝐋𝐈𝐍𝐃 #shorts,2024-05-16T00:30:19Z,62144,7278,56
NtBi2I_fk0w,TIPS FROM MICHI MOCHIEVEE #2 !!!! #shorts,2024-05-15T00:30:10Z,169570,25828,206
c6HC8Rf-EjY,Know your place...... #animated #shorts,2024-05-14T00:30:13Z,26821,4216,53
hQLzSuOpIQA,CRINGE PARTY INCOMING LOL,2024-05-09T17:21:20Z,46644,4062,32
fPQGMZfFqPQ,"your phone, NOW. #animated #shorts",2024-05-09T12:30:27Z,151166,19635,117
2qdEzeBAOmc,🌞 #shorts,2024-05-08T19:10:18Z,32547,5695,213
C81uhFYtoPQ,VTUBER COMMITS ARSON!! #shorts,2024-05-06T12:30:07Z,29527,3994,52
cmLLBbT1EKY,THIS IS TOO SCARY...,2024-05-05T12:30:31Z,22083,2025,47
Tx5xRNy9hMU,ESL Moment 🤓 #shorts,2024-05-04T12:30:17Z,646049,79283,1006
5yGqRIx3JNE,TIPS FROM MICHI MOCHIEVEE!! #shorts,2024-05-03T00:30:03Z,96835,13730,150
GfFGVIeghuU,Matara & Geega gets 𝐓𝐑𝐀𝐔𝐌𝐀𝐓𝐈𝐙𝐄𝐃 by Michi,2024-05-02T12:30:07Z,143321,8219,108
d84tskraA1Q,IS THAT MY NEIGHBOR?? | That's not my Neighbor,2024-05-01T12:30:26Z,15290,1159,22
rwkhEwkX-N8,STOP THIS HAUNTED TRAIN. | Shinkansen 0,2024-04-30T12:30:35Z,9956,1047,43
8bqY8I6HGZ0,HOW THE NEWEST VSHOJO MEMBER 𝙍𝙐𝙄𝙉𝙀𝘿 HER FIRST IMPRESSION😱,2024-04-29T12:30:05Z,40308,3789,131
kVujfvjDRDc,Left or Right? 👀 #shorts #animation,2024-04-28T12:30:23Z,30588,3662,90
Gm2_-BqRLhk,BIGGEST KUREIJI OLLIE SIMP PLAYS DAYS WITH OLLIE !!- FIRST REACTION 😍,2024-04-25T17:52:14Z,91414,8142,93
uYYXM42t_8I,🔴 HI YOUTUBE!! ദ്ദി(˵ •̀ ᴗ - ˵ ) ✧ - CHILLING ABIT AFTER THE SONG COVER PREMIERE!!,2024-04-23T17:34:38Z,43770,4085,42
q8pHdwcxT7g,Aishite Aishite Aishite / 愛して愛して愛して - Kikuo 「 Cover by Michi Mochievee 」,2024-04-23T13:00:07Z,1568822,71077,1080
K6BCs9-f0Qc,"🔴 WHAT SHALL WE CALL OURSELVES? ♡ Figuring out names, tags and all that good stuff !!",2024-04-22T09:32:33Z,45922,4387,94
dY2ghGVjxZ4,Michi Mochievee || Lore Video,2024-04-21T12:30:32Z,78549,8315,381
aS7jLXq0JYU,DEBUT STREAM ♡ NEW VSHOJO MEMBER - MICHI MOCHIEVEE !!,2024-04-21T11:00:07Z,102360,9405,484
pa0PHq9rgqY,Michi Mochievee Live Stream,2024-04-18T20:43:08Z,0,6,0
