id,title,publishedAt,viewCount,likeCount,commentCount
_ked24UxFy0,Bao's Dad Struggles With English,2025-12-12T20:00:00Z,47832,4278,59
jf4JexH2w3c,We Smash or Pass D&D Monsters,2025-12-11T20:00:42Z,41143,3981,250
GT9VKILm0KM,Bao Tells a Joke to her Dad,2025-12-10T20:00:15Z,61859,5911,71
0adHeV5tLIE,Corndogs in Canadian is called WHAT!?,2025-12-08T20:00:01Z,160233,8551,158
jWcO4xUnCE8,"""How It's Done"" - KPOP DEMON HUNTERS - Bao x Monii x Nerissa",2025-12-06T20:00:06Z,153280,17697,453
udGJf6cnjrM,Bao's way of Relaxing,2025-12-05T20:00:56Z,80047,6859,63
97pHtX8ws54,Bao's Sleep ASMR,2025-12-03T20:00:08Z,45116,5244,71
hrZMj4zIFIU,Will Bao Choose Vampire or Purple Worm?,2025-12-01T20:00:47Z,68577,4463,49
aF1PfwjtJP0,He Tried to Prove I'm a Furry,2025-11-30T20:00:00Z,37171,3722,207
sGF5V0axhMU,Bao & Camilla Got Proposed by a Fan on Stream,2025-11-28T20:00:49Z,40535,3113,23
j2cjSekOWGY,Numi & Vienna Sings Happy Birthday to Bao,2025-11-26T20:00:51Z,23545,2299,33
C6sYGTMRf6I,HE'S USING HEAT SUPPRESSANTS,2025-11-24T20:00:18Z,43656,3554,94
bbqd5mxiNh0,Bao Finally Goes Insane,2025-11-21T20:00:39Z,32383,2633,42
LbDhXjDkJjs,Are you Mezmerized yet?,2025-11-19T20:00:30Z,32515,4189,55
s1-GSZ8sE4k,"I'm sorry, I have Problems",2025-11-17T20:00:44Z,37755,4034,80
y8Pnlb0zyyE,Bao speaks her Truth,2025-11-14T21:01:23Z,70207,8365,200
JGZoRrSZ1_I,Bao Became a ROCKSTAR,2025-11-12T20:00:30Z,25776,2234,96
tyGL2Ng4Y10,Bao Slips Up...,2025-11-07T19:01:19Z,147764,13241,148
9Pofk_d2Eu4,Bao Is Suffering From Success,2025-11-05T19:00:18Z,77190,6274,114
MPtnUqik-Zc,Never Give Bao Whiskey...,2025-11-03T19:00:19Z,151419,14343,235
_ay6I4iei2M,Bao Vented To An Uber Driver,2025-10-31T19:00:45Z,43468,3600,49
D0HC_sz5Mf8,Bao's UNHINGED Compilation,2025-10-29T19:00:22Z,81427,6555,254
IJMf3KH8yZ4,From Idol to Rockstar,2025-10-29T19:00:19Z,67845,6580,112
asaHQ7G201A,Bao Got a Viral Sound Alert,2025-10-27T19:00:02Z,141881,13901,258
sD-nWPdcZLQ,I USED TO PRAY FOR TIMES LIKE THESE,2025-10-24T19:01:01Z,53678,4919,306
71VYB6OfO7E,Bao's Rockstar Model will RUIN your Life,2025-10-20T19:00:07Z,149364,11094,248
wkHkRpqs0So,The Silence was SO LOUD,2025-10-16T20:00:50Z,303323,26197,248
xP28pAprT-s,What Happened to Yuzu?,2025-10-15T20:00:48Z,47283,3833,38
QiGmtw2Qohw,Bao got CAUGHT,2025-10-14T20:00:20Z,51612,5252,78
L3utmE0lfo0,Bao went Gorilla Mode,2025-10-12T20:00:11Z,59676,4144,50
N8mLO_yu5Gk,Bao The Whale - VTuber Lore Animation (Rockstar Bao Model Debut),2025-10-11T23:00:29Z,43677,4015,174
p6aUJ8s3cL4,Which Vtuber Would Bao Marry and Why,2025-10-09T22:00:58Z,85041,7626,93
ZiviKc_uSjo,Bao's Bookmarks are CURSED,2025-10-07T20:00:33Z,61360,3351,48
vKUy_HNFc_o,Bao Learns Something in PEAK,2025-10-06T21:00:56Z,50622,4135,51
S9tOa__GEmE,"My Cover of ""FREE"" - KPOP DEMON HUNTERS (Rumi x Jinu) with Johnny Ray is Out Now!",2025-10-05T19:00:31Z,37231,2561,45
Vmpl0gzeHqA,"""Free"" (feat. @Johnnyray) - KPOP DEMON HUNTERS - Bao The Whale (Rumi x Jinu)",2025-10-05T19:00:07Z,347457,16144,529
sSSRwNazWxU,How to eat Pizza in Italy,2025-10-04T20:00:39Z,54848,3744,117
viXYhBThN1c,"Bao did a ""Cool"" thing",2025-10-03T20:00:46Z,56163,4489,87
7x_Mmd2UkbQ,Is Bao The Whale okay 🥀,2025-10-02T20:00:06Z,101217,11305,233
i95HLStk0r8,This Model is Aesthetic,2025-10-01T20:00:39Z,290802,21489,250
LnaJKo1gQXw,Filian Invited Me to her Stream IRL,2025-10-01T20:00:17Z,71804,5273,141
kmURkYLGdFE,It is Freak O' Clock,2025-09-29T20:00:36Z,58598,5355,70
iGQUcshp8zQ,Bao Reading Italian,2025-09-28T21:00:44Z,45376,4707,132
lHXga2g5w2w,Bao Became Famous on the Ship,2025-09-27T20:00:23Z,308079,27051,190
DSKAr-np-ck,PLEASE LAUGH,2025-09-26T20:00:21Z,58102,4359,41
QPcCfeNhYpc,I went to a Shooting Range... Huge Mistake,2025-09-25T20:00:32Z,251989,17968,916
HLZzYpVrgUY,Bao joins in Umamusume,2025-09-25T20:00:12Z,51059,4060,65
8EGtCA_YtCs,Bao's New 3D Outfit looks ADORABLE,2025-09-24T21:00:12Z,39889,3575,60
kyxZOLbxTGU,Bao shows Lucy her Brainrot Videos,2025-09-23T20:00:37Z,34100,2701,34
stUfMcSZg2E,Why Ramen gives you Migraines,2025-09-22T20:00:45Z,148847,9870,240
ZX-wEu_sgks,Bao The Whale x Ririsya - Pixel Lover (Original Song),2025-09-20T23:00:42Z,80591,5231,210
j90Pwq3RutI,Bao Shows her Sourdough,2025-09-20T20:00:23Z,160115,8772,138
oURESbhipNg,Bao is SO IN,2025-09-19T20:00:28Z,99064,7635,70
8n9cEbftBsQ,Bao Needs to Stop Talking,2025-09-18T20:00:10Z,176917,7984,91
zXsCAEGXAJQ,Bao Hates Running,2025-09-17T20:01:00Z,111900,8649,127
6Tp8a6WXN14,Life Lessons with Bao,2025-09-16T20:00:09Z,66866,4600,56
uXSVw50JvWI,Bao's New 3D Outfit is Expressive,2025-09-15T20:00:41Z,96993,9248,72
e81B3GpF-JM,We Smash or Pass the Most CURSED Monsters,2025-09-14T20:00:19Z,72220,5972,220
pGAPFjx0qyo,Bao Got Scammed with Labubus,2025-09-14T19:00:43Z,149648,10204,169
GoNTZJWUHJk,Bao gets Touched by a Monster,2025-09-13T20:00:20Z,47676,4234,54
shNS63BXppQ,Can Bao Eat Crayons?,2025-09-12T20:00:48Z,56481,4984,65
j6ZuMjCM5NM,Love Finds a Way,2025-09-11T20:00:42Z,177801,10661,194
Cpx0ybY5ln0,Bao & Filian do the Pogo Stick Challenge,2025-09-10T20:00:10Z,32906,2580,37
BkYSdq2a0FE,Bao & Filian's Biggest Flashbang yet,2025-09-09T20:00:17Z,108522,6489,56
vRQowUxAjzM,"If Evil, Why Hot?!",2025-09-09T19:00:53Z,25453,1599,43
FKklHUp4Nz4,People think Numi & Bao are a Couple,2025-09-08T20:00:10Z,146564,11318,155
8WA7Ohe7_5c,Bao tries a Revolver,2025-09-07T20:00:08Z,60822,3494,75
l7CtuxXGTEg,A Fan Made A Model For Bao,2025-09-06T20:00:36Z,177875,23689,206
Y4alzu-IOII,Bao Takes Out Filian,2025-09-05T20:01:06Z,66089,3919,33
ulal9KU8xzE,Bao Tries a 50 Cal Sniper Rifle,2025-09-04T20:00:42Z,1055678,60171,860
pYs8qrJePws,Headshot 🎯,2025-09-02T20:00:46Z,91042,6069,76
sHgzv4ZCLHg,Bao plays the Bongos,2025-09-02T20:00:44Z,134286,7493,40
1ycO4qk2BUI,Bao Aura Farming 🔥,2025-09-01T20:00:01Z,235968,18754,647
0Z8Gbdv5tuk,Ojousama Turns 3D!,2025-08-31T20:00:03Z,42933,3726,155
nKeh9qHjoeQ,A Normal Sized Piano For Bao,2025-08-31T19:00:43Z,107938,5896,73
915OmC5DAGI,I did not Survive this,2025-08-30T20:00:06Z,147040,8974,82
_VSq9wjoj7c,This Guy Scares Me...,2025-08-29T20:00:34Z,702038,38583,178
MZiGGkYZR2g,Bao Used Distraction!,2025-08-28T20:00:30Z,384971,17535,132
trYDMNQodYY,Baocore Memes,2025-08-27T20:00:38Z,58119,4305,28
NztkHyYOLxE,Neuro Runs Over Bao,2025-08-26T20:00:14Z,92189,6987,129
whlggkhxykg,Bao & Filian Hits the Targets,2025-08-25T20:00:40Z,59476,3513,32
h7wmuBZ6loc,I Harassed (Interviewed) A Bunch Of Mad Scientists at Open Sauce,2025-08-24T20:00:32Z,94595,8774,313
pdCuGkmGVVs,Bao has had Enough of Filian,2025-08-23T22:00:49Z,177359,12657,82
aBm1fXb13hE,Bao & Numi Kissed On Stage,2025-08-22T21:00:01Z,60885,5315,74
NSMeZS55gJ0,Bao & AmaLee Voice Acts in the same Anime Show,2025-08-21T22:00:22Z,851623,57968,288
pQdrI85wKGA,Bao's Hidden Talent,2025-08-20T20:00:40Z,258749,10640,92
497lK5zzXWY,Bao & Neuro Runs Over Their Fans,2025-08-19T21:00:05Z,107716,6727,76
qhmeWiZg3cA,Bao x Neuro-Sama | Mesmerizer (English Cover),2025-08-19T19:40:19Z,719046,35908,1120
Bv-HG1Ax2ps,Bao & Neuro Runs Over Vedal,2025-08-18T20:00:16Z,203154,11489,0
Al_wyMe-3Os,Bao Lets an AI Drive her Around,2025-08-17T20:00:06Z,161287,10556,112
toZn5htNGPE,Neuro Doesn't Listen to Bao,2025-08-16T20:00:36Z,162096,10439,113
QjZk8MFK2cc,Bao teaches Neuro Driver Safety,2025-08-15T20:00:17Z,386502,22504,227
fGqYMsEqrJA,We made an AI Supercar,2025-08-14T21:02:11Z,217581,21382,1099
MDN_Dq-ocfM,Neuro Car Incoming!,2025-08-13T20:00:13Z,153452,9392,180
0ZStD3t8P3g,Same person btw 🥀,2025-08-12T20:00:04Z,172040,18455,612
D38M25NvyPA,Bao Finally Bans Herself,2025-08-11T20:00:10Z,62702,4468,42
lxjQ-9MboIM,Bao VS Filian Push Ups,2025-08-10T20:00:26Z,80213,4431,65
8QpG8WoNm80,Bao The Whale - Ojousama (Original Song) prod. Overspace,2025-08-10T00:30:07Z,205615,13522,502
e4PKcIZNhqQ,Bao's Baker Arms,2025-08-09T20:00:31Z,499382,25190,543
ZXGK7diLdNo,Bao is Strong,2025-08-08T20:00:23Z,213605,13704,149
2hwii1kEwAg,Bao Yeets Filian,2025-08-07T20:00:05Z,204757,16470,143
kmuhi_qIP6w,Bao Knows Filian's Age,2025-08-06T20:00:38Z,270832,12924,61
RWxrV65mJWk,This is How You Farm Clips,2025-08-05T20:00:14Z,66538,4843,96
HL4yuwsx9mc,Sourdough Dysmorphia,2025-08-04T20:00:11Z,254248,14304,237
14rMYOu0Uvk,Bao makes a Sound Alert for Limes,2025-08-03T20:00:02Z,436668,40486,126
WUMyCyTE5ko,I only want ONE Thing in ZZZ,2025-08-02T20:00:17Z,58417,4293,132
87qLZhs78o8,Therapists After Finding a Bao Fan,2025-08-01T20:00:10Z,216885,19840,232
_ylz6sJLb0k,Bao has Such a Way with Words,2025-07-31T20:00:33Z,327818,30235,309
TxccESjrAwQ,Bao Comes Out??,2025-07-30T20:00:16Z,826701,39068,488
F09KB8jF64k,I React to My Out of Context Voice Audios,2025-07-29T20:00:10Z,275175,17931,579
LmatYswNcgM,Camila Asks for a SCREAMING Sound Alert from Bao,2025-07-28T20:00:13Z,596788,56309,195
n_R3JDNCylg,Bao would Smash his Dad??,2025-07-26T20:00:25Z,170187,8197,56
f9SXIFE1cbc,My First time Going on a Date with a Furry,2025-07-22T21:01:20Z,63016,3808,211
kF-A5kXrV34,Bao Made an Infomercial Sound Alert for Numi,2025-07-21T20:00:35Z,445515,33743,114
EJlpqfxueEI,Why Wario Lookin kinda,2025-07-20T20:00:07Z,74780,4406,69
qBTgnGVgYa8,Yuzu is Right with this One,2025-07-19T20:00:27Z,86463,4782,62
j4GP2q1YDOk,Bao is at it AGAIN,2025-07-18T20:00:35Z,66459,4019,90
0RYdbWkto_E,Bao's New Favorite Producer,2025-07-17T20:00:03Z,71917,4314,69
zGW81bc9ImI,"Oh brother, this guy STINKS",2025-07-16T20:00:42Z,100893,6398,73
UhQEsYLeIm0,Bao is a Professional Gamer,2025-07-15T20:00:31Z,79388,5255,71
5PPzYSA-exM,I Rank Your Oshi if they would Survive in a Horror Movie (Tier List),2025-07-15T20:00:07Z,126183,8383,691
KbScg4oDUCg,Bao has Googly Eyes,2025-07-14T20:00:12Z,193365,12706,69
sEeEiDqgNPk,Bao makes a WILD Sound Alert for Lucy,2025-07-13T21:00:59Z,84282,8699,44
AukElGKAMvE,Bao makes a NOSTALGIC Sound Alert for Ray,2025-07-12T20:00:10Z,920247,57783,253
M3AwqYePmYY,GOLD SHIP IS THE GOAT Uma Musume,2025-07-11T21:00:33Z,148524,7921,112
gzyt-ZUTLAA,Bao went to Special ED,2025-07-10T20:00:29Z,575216,32349,200
VbD9RNplADc,I LOSE IT & SCREAM FOR REAL IN PEAK,2025-07-08T20:00:23Z,92192,5580,146
kXJARapqZl4,Bao Celebrates 1 Million Subscribers and This Happens,2025-07-07T20:00:27Z,99913,7065,62
7WFH5kG-2pE,Numi Calls Out Bao,2025-07-04T20:00:06Z,63677,3656,68
x9wedvfXhfk,Stellar Blade is Game of the Year,2025-07-02T21:01:22Z,76000,3973,74
QnkpnL7mCq8,I am SUING my Friends,2025-07-01T20:00:27Z,120831,7930,182
Il8ShnkgyGQ,Bao FALLS in the most Dramatic way in PEAK! 😭,2025-06-30T20:00:14Z,220642,17082,172
qYfawvta4GI,Toma was so done with Bao,2025-06-28T20:00:35Z,67378,3704,18
W6Um7hNrOL0,The Fanfic is Getting Out of Control,2025-06-26T20:00:32Z,74669,3151,27
ZRsuT_piTEw,I Made CURSED Custom Sound Alerts for Vtubers,2025-06-24T20:00:21Z,343490,25043,955
PxiyJEovO-4,Bao Finds a Rat in her House,2025-06-23T20:00:18Z,92468,5219,63
rk3Zts89NZE,Bao tries to be Supportive,2025-06-21T20:00:30Z,262752,16161,138
9IVrgKgg7Pc,Bao playing this as Intended,2025-06-20T03:18:51Z,86874,5925,154
IeKyo-rXtCc,Bao makes a CURSED Sound Alert for Nagzz,2025-06-18T20:00:18Z,360593,22222,96
0nsY2fS8DkA,I Found a RAT During My Cooking Stream,2025-06-17T20:00:01Z,83009,5334,220
a2QJ56eTlKc,Chibidoki gets a Sound Alert From Bao,2025-06-16T21:00:00Z,1073293,64622,148
4i85PbIScjA,Bao speaking the Truth,2025-06-14T20:00:03Z,75974,5502,166
mRRNr6rbs7Q,Chat Caught Me Lackin,2025-06-12T20:00:36Z,131102,7697,196
K0AVFYUu22s,Bao's Best Song Yet!,2025-06-09T21:00:31Z,112734,6789,39
T6aa345QBr0,Bao Went To Feed a Cow,2025-06-07T21:00:25Z,132359,9224,62
sCPqinWb3Y4,Bao had a Wilder Imagination,2025-06-05T21:00:59Z,55444,3582,83
7mIXxPxcucM,I React To MEMES About Me Sent by Chat,2025-06-03T20:01:35Z,375715,19080,319
uPZWwitaWUc,Average Marriage with Lucy Pyre,2025-06-02T22:00:57Z,85834,6095,38
Do97pKK25nA,Bao is gonna be sick,2025-05-31T20:00:13Z,66289,4287,73
Awp2T-4umaI,Bao finds a Treasure,2025-05-29T20:00:15Z,154179,9072,170
azTvWIukxRA,We Convinced Dokibird to Smash Pokemons,2025-05-27T20:00:03Z,477736,26102,784
CU8mV080QL0,A Happy Couple 🤰 🐀,2025-05-26T20:00:07Z,84067,5390,50
thxrrAdaJ2A,Bao Got Baited,2025-05-24T20:00:28Z,133874,9402,59
RKPdhDy2Rlw,We SMASH or PASS the WILDEST Digimons,2025-05-21T20:00:31Z,199833,12306,593
01e8DHyfIt0,Bao Gasses up Numi,2025-05-19T20:00:00Z,223403,15671,109
KcIm_CvR3hM,Bao is Womanmaxxing,2025-05-17T20:00:12Z,68142,4451,97
afepfpSr9cg,Bao Saw A Hawk in her Garden,2025-05-15T20:00:01Z,148444,9491,214
Yd_oLc4jLDA,Chat Exposes Me and I review them AGAIN 😭🤡,2025-05-13T20:00:20Z,129508,7787,173
rpZxvgX1ZKA,You Can't Convince Me Otherwise,2025-05-12T20:00:37Z,72501,4114,139
hGRr8f8Kdjk,Bao Crashing Out About Tech,2025-05-10T20:00:22Z,231130,18790,419
YP8U2PiSy98,Let's have a Sh*t Off,2025-05-08T20:00:20Z,87120,4569,49
IbJKYzbnuDo,Baking Cinnamon Rolls While Baked,2025-05-07T20:00:17Z,124833,7664,241
uE2onRqTsd0,Numi's Aura is Crazy,2025-05-05T21:00:58Z,71409,5426,56
cUC_NuNlj4A,Why is it Shaped Like That!?,2025-05-03T21:00:36Z,177421,10372,127
VG0DpKvhi0w,Pokemon Lores are CURSED,2025-05-01T20:00:16Z,312173,22017,226
ELt17L1cVe8,Bao might have a Point here,2025-04-26T20:00:06Z,183562,20255,480
i4NgSk-tl1M,Me when I Gaslight,2025-04-24T20:00:33Z,141800,7274,34
fvttW6jG9Q0,We were Diagnosed by Our Viewers,2025-04-22T20:00:35Z,125540,6636,170
dFZFpqH055o,Bao does a Pistol Squat,2025-04-21T20:00:29Z,414093,32534,464
R5y_p88jzbw,What if Bao is a Souls Boss,2025-04-19T20:00:13Z,62338,3997,63
vem5_PXWBxc,Connor got Baoberried,2025-04-16T20:00:44Z,84169,5111,35
M89tZ9AFUCQ,I Review Your NASTIEST Rooms,2025-04-15T20:01:34Z,99268,5839,126
qutVi5BRJGM,Bao Calls Out Numi,2025-04-14T20:00:41Z,308020,24394,274
zK0lD7QART0,The Most Unhinged Way to Eat a Pizza,2025-04-12T20:00:28Z,68731,4733,75
u77Z9Er7IzI,Bao Accidentally drops her Mic on the Ground,2025-04-10T20:00:30Z,787909,38395,263
axJH3r3eujQ,I AM IN FRONT OF THE LINE 😍 | Girls' Frontline 2: Exilium | Aphelion Event,2025-04-07T20:00:06Z,26765,1522,54
QxPi6i2hC2c,Bao doesn't know what a Carpenter is,2025-04-05T20:00:11Z,287265,22991,488
eWsHfY4giS4,Bao finds a New Werewolf,2025-04-03T20:00:21Z,82743,8734,180
9rz6jZkgduE,Caught my Friends Talking Sh*t About Me,2025-04-01T20:00:06Z,364521,16564,354
wd8z8409FIw,These Girls ALWAYS Fight,2025-03-30T20:00:33Z,108851,8014,36
Drddv8AAkFE,THAT DOESN'T EVEN LOOK LIKE ME,2025-03-29T20:00:05Z,53069,4084,37
kx57iwIO--U,The Master Gaslighter,2025-03-28T20:00:34Z,164431,19285,116
J7WFDCpoN68,We Absolve Your Sins,2025-03-27T20:00:10Z,122535,7902,193
EY3gRzcmjyM,AMEN 🙏,2025-03-27T20:00:07Z,174321,20241,160
OdDk65fIw9o,Bao is Very Careful,2025-03-26T20:00:19Z,56230,4669,24
llH7vCIHLt8,Bao's Editor lives like this,2025-03-25T20:00:23Z,103426,10867,45
WIruWbg6JFg,Bao Would still Smash,2025-03-24T20:00:24Z,46647,4733,74
mSUAVA_HjXs,Bao's Aim is INSANE,2025-03-23T20:00:32Z,65659,7162,100
jwBPIcsuq2I,Bao can't Catch a Break,2025-03-22T20:00:22Z,48399,6243,103
chRvL77JcKY,Bao shows off her Brownies,2025-03-21T22:00:32Z,108255,10623,221
5hHx7M-r52U,Bao turns her Friends Into Furries,2025-03-20T20:00:03Z,49014,5928,40
7_43Ciy5x44,What kind of OSHI Bao likes,2025-03-19T20:00:04Z,40569,4221,47
KsYqCVNUAHo,Oh No… I’m Someone’s OSHI?!,2025-03-18T20:00:14Z,138533,8746,228
LMP9l7gG190,Sinder's Mom thinks Bao is a Furry,2025-03-18T20:00:11Z,40590,5925,99
OMgXH4BoGRE,Don't Make Fun of my Cooking!,2025-03-17T20:00:12Z,177794,16337,272
G0Tue7WjexM,Don't Mess with Doodle Bao,2025-03-16T20:00:06Z,140294,19672,212
cesM0geAM-0,Who said Nutsicle!?,2025-03-15T20:00:28Z,93717,14765,142
R7HumZ_WNtk,Bao has the Wildest Imagination,2025-03-14T20:00:25Z,134673,19948,266
Bk4pFxVu-NI,"2020 Bao is still here, Save Her",2025-03-13T20:00:06Z,190167,26283,289
ThF_fBqJP48,Bao has Infinite Wisdom,2025-03-12T21:00:31Z,79369,9906,159
B_G9ErwawGY,Bao Exposes her IRL Physique,2025-03-11T21:00:15Z,57994,5647,41
iZDqyCsNuH0,We Smash or Pass League of Legends But with a Twist,2025-03-11T20:00:24Z,109822,6205,158
orNgKmA9ba8,Bao's IRL Idle Animation,2025-03-10T20:00:28Z,983449,68647,776
emHIysGX0A0,Bao knows her Sister too well,2025-03-09T20:00:17Z,64510,7505,99
LC_p2MWzhuE,Men Should Lactate,2025-03-08T20:00:10Z,41547,4674,99
K-wwKeeAhjc,Bao tries to measure 12 inches,2025-03-07T20:00:20Z,424976,29775,531
xE-YrKTBPY8,I will never recover from this...,2025-03-06T20:00:30Z,185032,27590,193
-lGlxfIfzyY,Bao shows off her Cats,2025-03-05T20:00:00Z,389250,38487,517
9VI-kR4xpZI,Bao is a Freak,2025-03-04T20:00:06Z,167278,19287,202
f_BdAxcdIl0,Bao's Christmas Confession,2025-03-03T22:00:34Z,33692,4346,23
jb4ytysvoAk,Bao threw a Rock at Numi,2025-03-02T21:00:26Z,42767,6047,45
1_-c2P4dRXE,Bao tries Vegemite for the First Time,2025-03-01T21:00:00Z,106907,10747,197
tTsWmQ6h4x0,Chat shoots their shot with Bao,2025-02-28T20:00:39Z,37739,4509,69
__zXeHPSzM8,Bao needs to Change Her Pants,2025-02-27T20:00:19Z,34341,4291,30
Nv1Dm6kr1Eo,Bao Finds The P*nis Pond,2025-02-26T20:00:14Z,76138,8429,73
_DUgoWpf3XY,Someone Cosplayed Bao & The Bikini Bottoms,2025-02-25T20:00:16Z,33785,4292,30
-swTfDLEGeo,This Actually Happened,2025-02-24T20:00:00Z,32394,3717,35
rJbWC5OzRxo,I Made Brownies That Will Make You Lactate,2025-02-23T20:00:26Z,222355,13390,660
PYG7rh-zcrI,Bao was Expecting Tongue,2025-02-22T20:00:14Z,42684,5154,23
2HYCpmG86CE,Bao is in a Game!?,2025-02-21T20:00:03Z,34293,3967,49
Li-VzbS96t8,Bao tries to Rizz Chat,2025-02-20T20:00:23Z,32464,3843,45
kohfiSeD7M8,"Best place to keep the ""Toys""",2025-02-19T20:00:26Z,32828,4498,37
Ix05p4p4Wkw,Bao's Fitness Wisdom,2025-02-18T20:00:19Z,40045,4753,73
3iX5tVWpzek,Put the Fries in the Bag Lil Bro,2025-02-17T20:00:01Z,31758,3858,35
iudL1rTkrUk,Bao Learns what Shortstack Means,2025-02-16T20:00:17Z,41360,5788,91
6fAtfsaZdRI,Bao's Scooby Doo Laugh,2025-02-15T20:00:05Z,29298,3834,21
sloSJ7YCsKQ,Bao got Trolled By The Cops,2025-02-14T20:00:37Z,36429,5016,32
J1hW3cf9_jA,Bao Pulls her Vcard,2025-02-13T21:00:14Z,31891,4317,43
_a2pKvoIf_c,Faker Can Spectate Us,2025-02-12T20:00:34Z,55005,6729,48
JwXHz6q9JxU,We Read The Most Unhinged Overreactions on Reddit,2025-02-11T20:00:11Z,127817,7029,167
GiB6OvbrFfA,Bao Has The Wildest Imagination,2025-02-09T20:00:09Z,29843,4155,33
LJPsd-YqqjI,Bao's CRAZIEST Pull YET! Double Pilgrim!,2025-02-08T20:00:09Z,88657,13503,194
IBsJGPFY_AY,Bao Ruined the Moment,2025-02-07T20:00:10Z,95999,12866,48
BjsDQzyY9dk,Is that a messed up thing to say?,2025-02-06T20:00:08Z,123714,15721,92
1-neB9lMavw,Bao Harasses Her Co-Workers,2025-02-05T20:00:00Z,28941,3748,27
_kcdEV61Kuw,Bao's Friends Know her so Well,2025-02-04T20:00:18Z,34996,3951,22
JIMXjO8Esvs,Bao Teaches Her How to Bark,2025-02-03T20:00:28Z,23666,3504,63
m852GV9V_iI,YANDERE BAO RETURNS (MiSide Full Game Playthrough),2025-02-02T20:00:31Z,35022,1923,87
uP8Z2OLWXCQ,"Sorry, I'm The Problem",2025-01-31T20:00:35Z,31772,4217,71
Mojj1fL8K6c,I Accidentally Raided My Hater,2025-01-29T20:00:13Z,69837,9923,46
ahMpYvlgTaM,We Read Chat's Confessions,2025-01-27T20:00:01Z,338196,17342,465
em6YdsrbQxs,She Can Fix Her,2025-01-27T19:00:33Z,111973,14495,155
VzZnn_lYtiI,Hair Doesn't Bother Me,2025-01-24T20:00:22Z,248309,31545,206
tHkCKw0w7G0,What would Bao be if it was Opposite Day?,2025-01-22T20:00:35Z,108076,16679,234
z8jnUVQgYvY,Bao Is Not Beating The Allegations,2025-01-20T20:00:34Z,253920,31669,330
jHy1dpQwnlo,I Rank Vtubers that I would likely Show to Normies,2025-01-19T20:00:23Z,208975,10789,359
sHXk2lMleqc,Bao chose the Right Mushroom,2025-01-17T20:00:35Z,356722,46140,250
JErls2SPilk,Bao Accidentally Meets a Fan IRL,2025-01-15T20:00:14Z,549711,60349,437
crTp_LgrJwk,Filian Tells The Truth About Bao's Content,2025-01-13T20:00:20Z,3690828,211863,852
t5zFwl1hIw8,Rob Brought Me Into a “Toy” Store in Japan,2025-01-12T20:00:25Z,89662,5242,161
aOhdr65NGyI,Chat Roasts Bao's Outfit,2025-01-10T20:00:01Z,271991,30119,372
mk8X6TfxCLo,Rapi has a TRAGIC story #NIKKE #NIKKENewYear #DearRapi,2025-01-09T20:00:19Z,44097,4843,54
o_oqA0GjpZA,Bao is Into Armpits,2025-01-06T20:00:33Z,59230,7379,133
tN9MzUh7vEE,Would you Smash Bao?,2025-01-03T20:00:26Z,2058307,136279,2192
1z5Ts3b_ZBQ,Best of Bao 2024,2024-12-30T20:00:32Z,234139,11964,278
a5xThzS2gJg,Camila VS Bao #clips #shorts #fyp,2024-12-25T20:00:01Z,57856,6185,26
Ibocwv0zsm0,Look what MSI sent me!,2024-12-23T20:00:08Z,103263,9078,93
LjxhAgXRYEg,Our Kayaking Experience was Crazy,2024-12-22T20:00:07Z,50718,3969,181
SuiZSx9Fsto,Bao Knows What You Watch #shorts #fyp #clips,2024-12-18T20:00:13Z,54501,7161,55
k51LsKXo2eE,My Editor is Spreading FAKE NEWS #shorts #fyp #clips,2024-12-16T20:00:31Z,148789,16223,80
WmpVUFZjxUA,We Found A Real Life Orca,2024-12-15T20:00:11Z,71230,5184,267
611jVhvpuUw,Bao plays with Dogs #shorts #fyp #clips,2024-12-13T20:00:02Z,68102,6534,59
be4YvJ2vy5s,Bao's Baokshots #shorts #fyp #clips,2024-12-11T20:00:26Z,60796,7515,113
WkK5WBMRXsE,We Explored Pike Place Market in Seattle. It was Insane,2024-12-08T22:00:16Z,92532,6990,539
YFHn9LiIYWk,He will Definitely go to Prison,2024-12-06T20:00:28Z,64711,5594,29
FoGRoremv2k,Where is Bao? #clips #shorts #fyp,2024-12-02T20:00:06Z,49798,4360,154
dWEZsb-YlEU,We found the DEADLIEST Mushroom,2024-12-01T21:00:31Z,312031,18225,998
d9393UipyVY,Bao Found Her Place #shorts #fyp #clips,2024-11-30T20:00:15Z,105766,8297,59
-J13aNYYqSA,Bao would be fighting for her life #shorts #fyp #clips,2024-11-28T20:00:01Z,54898,5783,34
SxLQle-YLUk,Bao's Shylily Cosplay is CURSED #shorts #fyp #clips,2024-11-26T20:00:13Z,164544,17807,223
7GsR5wLaGzE,We caught Bigfoot on CAMERA,2024-11-24T20:00:03Z,106951,8098,471
ZsXcP3_JRN4,Bao LOSES it #shorts #fyp #clips,2024-11-23T20:07:01Z,106894,12782,78
S5CkeisDdlk,Neuro made Bao Speechless #shorts #fyp #clips,2024-11-21T21:00:18Z,349693,36754,327
vv3__NrpIy4,Bao is the Foreskin Fairy #shorts #fyp #clips,2024-11-19T20:00:25Z,61246,7594,90
qnn1Weros3U,We React To Our CRINGE Clips,2024-11-18T20:00:32Z,441680,19119,346
k0SHeDu5bEo,Bao's BIGGEST ROAST Yet #shorts #fyp #clips,2024-11-16T20:00:14Z,57848,8399,79
Q9ILd-fpf6Q,Squ eats Bao's... #shorts #fyp #clips,2024-11-14T20:00:18Z,59383,6207,39
Iyxbdpioaes,Bao gets Timed Out #shorts #fyp #clips,2024-11-12T20:00:13Z,476238,55073,239
_MKFgcZAyiQ,I Review My UNHINGED Tweets,2024-11-10T20:00:23Z,309935,14221,264
zPkjijIHRI4,Bao's the only one getting Roasted #shorts #fyp #clips,2024-11-09T20:00:24Z,49186,6102,20
BUZ7reuNcVE,Bao's Ideal Date in 3 Words #shorts #fyp #clips,2024-11-07T20:00:08Z,45814,5653,73
oXXxtsBsjVc,Bao was Speechless #shorts #fyp #clips,2024-11-05T20:53:40Z,50591,7552,85
RZaWlNOj1oM,"Bao x Numi x Sinder - ""She Wolf"" Shakira Cover",2024-11-01T19:00:24Z,2623581,65472,2047
S5w-RmHH8hw,Bao Exposes her Little Sister...,2024-11-01T19:00:14Z,50817,6708,90
0PaJz_KCc-0,Bao's First Message to Michi #clips #shorts #fyp,2024-10-31T19:00:02Z,43069,5479,25
4vvwdfsPKo0,Bao Exposes Chat #clips #fyp #shorts,2024-10-30T19:00:05Z,38112,5195,59
EGTGDcYZSXI,Filian Roasts Bao's Height #shorts #fyp #clips,2024-10-29T19:00:15Z,1314680,84622,667
03EXPORNSb4,WHAT IS BAO WEARING!? #shorts #fyp #clips,2024-10-28T19:00:00Z,171684,16646,107
ywA5Kg7gpX0,"Boogiepop and Others OP - ""Shadowgraph"" Cover | Bao x Girldm x vally.exe",2024-10-27T19:00:35Z,75888,3386,71
gVwjQJ118zk,Amalee is Smarter than Bao #shorts #fyp #clips,2024-10-27T19:00:19Z,302132,34609,286
nbodsXks9Rk,PirateSoftware gave Bao Vegemite #shorts #fyp #clips,2024-10-26T19:00:31Z,41461,5658,101
XMqd8fR0q7Q,Bao's Accidental Flash #shorts #fyp #clips,2024-10-25T19:00:31Z,313766,37122,277
h0pqodDDd0I,BAO OUT OF CONTEXT #1,2024-10-25T19:00:24Z,105373,7515,259
7x-rkpoy8mc,Bao's Cats are so CUTE! #shorts #fyp #clips,2024-10-24T19:00:06Z,42456,5786,70
6_nBqdHARBc,This was too much... #shorts #fyp #clips,2024-10-23T19:00:04Z,37483,5666,47
Hx-bPogG4wk,Bao's AFK is Horrifying #shorts #fyp #clips,2024-10-22T19:00:18Z,73278,9736,110
QEXLjwIUVIU,"Overlord III OP - ""Voracity"" Cover | Bao x Miori x Shiki",2024-10-21T20:01:36Z,266257,11857,296
ezMPPGegXwo,They WHAT to our Voices!? #shorts #fyp #clips,2024-10-20T19:00:28Z,55832,7240,86
6Cth1lXqR14,Men's Funny Button #shorts #clips #fyp,2024-10-17T19:00:04Z,53957,6899,158
U-7NMDBiwDo,Chat Made Me Wear This...,2024-10-16T19:00:17Z,79557,5035,358
Ju6W6hVvsnQ,This game has a Horse Thirst Trap!? #shorts #fyp #clips,2024-10-15T19:00:16Z,39540,4569,61
UosY77NLD-Q,Cotton destroyed Bao #shorts #fyp #clips,2024-10-13T19:00:23Z,54983,6956,69
EIF18w6kGvM,"Bao The Whale - ""Fukurou"" Kokia (Cover)",2024-10-13T19:00:13Z,128134,6952,256
R00Wwo-jQQI,Max0r roasts Bao #shorts #fyp #twitch,2024-10-10T19:00:12Z,335780,37570,160
TkUaTJAy2N4,Max0r couldn't Handle Us,2024-10-08T20:15:00Z,274272,16753,250
RkhBbQk51EM,Cursed Bao Card #vtuber #vtuberen #twitch,2024-10-08T19:00:14Z,242539,25524,383
s96uALOYpJE,Bao Finds her Tail #clips #shorts #twitch,2024-10-06T19:00:24Z,61651,6000,46
uVyH99Xpiv4,"Bao The Whale - ""Queen"" Kanaria (Cover)",2024-10-05T19:00:27Z,190580,8860,168
yRbKfUWU1_M,He's DRIPPED! #shorts #fyp #twitch,2024-10-03T19:00:37Z,87001,9356,52
WPkzFDKgoLc,We got Absolutely Roasted by our Fans,2024-10-03T19:00:23Z,776397,32048,1214
K8hagYWmcMA,That wasn't in the Story... #vtuber #vtuberen #twitch,2024-10-01T19:00:11Z,86959,9497,60
getBw_wWJvM,Bao is Vaxmaxxing #shorts #fyp #clips,2024-09-29T19:00:23Z,46288,6097,112
OoPiRV4R2bc,"Bao The Whale - ""MIRA"" Kanaria (Cover)",2024-09-28T19:00:10Z,78945,3985,125
M2-IqyDfGqs,What does Lucy smell like? #vtuber #vtuberen #twitch,2024-09-26T19:00:10Z,38681,3833,30
5iknVm3mApc,Too soon? #vtuber #vtuberen #twitch,2024-09-22T19:00:04Z,42502,4687,50
CX9TIGZMaaY,Why did they make a Horse Thirst Trap in this game!?,2024-09-20T19:00:11Z,67422,2902,104
yRUC1Dk14pU,Bao gets Ghosted #vtuber #vtuberen #twitch,2024-09-19T19:00:39Z,83006,9054,161
