id,title,publishedAt,viewCount,likeCount,commentCount
H842TrejdCw,Weirdest place Bao tickled her pickle #vtuber #vtuberen #twitch,2024-01-07T20:00:11Z,321529,42562,337
RvgehrBAXNU,Bao's Roast beef Allegations #vtuber #vtuberen #twitch,2024-01-06T20:00:09Z,52743,6448,58
TMWI1quPzu8,Bao almost got banned #vtuber #vtuberen #twitch,2024-01-05T20:00:16Z,54583,6009,39
HKk3ARaO6X8,Bao's Trade Offer #vtuber #vtuberen #twitch,2024-01-04T20:00:06Z,676785,76177,427
2xlUPZq9qd8,Bao is down bad again #vtuber #vtuberen #twitch,2024-01-03T20:00:02Z,262829,26198,412
lOmcu4qMeFk,Bao has Excellent Driving Skills #vtuber #vtuberen #callofduty,2024-01-02T20:00:15Z,46418,4721,37
ncHqJYIDRW8,PLAP PLAP GET POSSESSED #vtuber #vtuberen #shorts,2024-01-01T20:00:18Z,245392,25280,301
BY_MOX-M4W0,YouTube Rewind 2023: Bao The Whale Edition,2023-12-31T20:00:10Z,70304,6391,312
2pli6VS988o,He walked in front of me! #vtuber #vtuberen #callofduty,2023-12-31T20:00:03Z,98348,9916,55
aiuAUP8AYJI,It is Chat's fault! #vtuber #vtuberen #shorts,2023-12-30T20:00:03Z,152180,16652,66
gVFk2tY9Vgc,Nailed it! #vtuber #vtuberen #phasmophobia,2023-12-29T20:00:17Z,211357,26113,64
_qKuVp9espk,Bao learns about Echidnas #vtuber #vtuberen #shorts,2023-12-28T20:00:17Z,419012,39526,325
6ehsst5HLOM,Bao is too lonely #vtuber #vtuberen #twitch,2023-12-27T20:00:06Z,84788,10457,110
e9k8bKElifI,What is Bao doing!? #vtuber #vtuberen #twitch,2023-12-26T20:00:14Z,93473,9936,104
4v5V8bE19-c,This game is EASY #vtuber #vtuberen #twitch,2023-12-25T20:00:01Z,50639,5143,33
BPmNzUbr9oo,Bao has 3 Wolves... #vtuber #vtuberen #twitch,2023-12-24T20:00:05Z,65269,8615,113
GU4fH1sriyg,Do Vtubers wash their hands? #vtuber #vtuberen #twitch,2023-12-23T20:00:04Z,337074,36903,267
95m_sGxVUwA,The Game knows me too well... 😨 #vtuber #vtuberen #twitch,2023-12-22T20:00:04Z,207267,26910,168
xLyEnlUjkHY,Bao Explodes #vtuber #vtuberen #callofduty,2023-12-21T20:00:28Z,94406,11409,96
OalcFZ9505I,I'm sorry Numi's Dad #vtuber #vtuberen #twitch,2023-12-20T20:00:10Z,1327480,134864,532
e2nSsCLvz9k,Bao went a bit too hard #vtuber #vtuberen #twitch,2023-12-19T20:00:26Z,45518,4880,74
_niDNspaffc,Chat Exposes Me and I review them 😭🤡,2023-12-19T20:00:12Z,313985,15002,382
246rcbsHMkk,Sleep Paralysis Demon is afraid of Bao #vtuber #vtuberen #twitch,2023-12-18T20:00:01Z,296581,41567,773
O4keP_xcgyg,Does Bao Poop? #vtuber #vtuberen #twitch,2023-12-17T20:00:13Z,77083,9468,46
Ato6qxm55qM,Bao & Yuzu getting Freaky on Stream #vtuber #vtuberen #twitch,2023-12-16T20:00:04Z,54053,6226,100
xcbho2aOYw0,Bao is the Most Tactical Vtuber #vtuber #vtuberen #twitch,2023-12-15T20:00:24Z,114514,11986,108
OCTBuT23KxM,Bao The Whale - Noblesse - Maplestory M Adele OST M Cover #sponsored,2023-12-15T04:50:55Z,42230,2476,179
rrwqhmIBR7Y,Bao left Lucy speechless with this... #vtuber #vtuberen #twitch,2023-12-14T20:00:21Z,351988,39303,272
gWhAVMomKZQ,Bao has no Standards #vtuber #vtuberen #twitch,2023-12-13T20:00:25Z,467223,47693,270
uyqvAHwv-kA,Bao has a New Crush #vtuber #vtuberen #twitch,2023-12-12T20:00:22Z,51031,6418,95
oOPO7YSDyKM,Bao Exposes Giri #vtuber #vtuberen #twitch,2023-12-11T20:00:31Z,104353,13329,45
hWlB8Mobxvs,Bao just wants to be a Princess #vtuber #vtuberen #shorts,2023-12-10T20:00:26Z,423039,46686,522
Fb22LAxWDuI,Trolling Friends in Lethal Company,2023-12-10T20:00:06Z,102642,6799,216
WPPPwjvE6Oc,IT'S THE MEME! #vtuber #vtuberen #twitch,2023-12-09T20:00:15Z,47020,5570,25
BgUC2rjhsdo,Would Bao Screw a Robot? #vtuber #vtuberen #twitch,2023-12-08T20:00:05Z,756422,71601,925
IAhNIQ3ThlA,Bao gets Rickrolled by her Editor #vtuber #vtuberen #shorts,2023-12-07T20:00:07Z,202328,25470,100
6DiRd3QtRBE,These Fart Allegations are Killing Me #vtuber #vtuberen #lethalcompany,2023-12-06T20:00:03Z,83634,9163,30
18pYfPz7WpU,Bao doesn't trust Vienna #vtuber #vtuberen #lethalcompany,2023-12-05T20:00:00Z,40445,4847,29
4RzenX5pYAw,I'm sorry you had to find out this way Numi #vtuber #vtuberen #twitch,2023-12-04T20:00:02Z,50129,5986,41
6PHJ0dLViDM,"Answering the Worst ""Would you rather"" Questions feat. @juniperactiasofficial",2023-12-03T20:00:02Z,210355,12860,521
14ZE_tSDPgo,Numi Catching Strays #vtuber #vtuberen #twitch,2023-12-03T20:00:00Z,50141,5483,43
HkZK4nhQXTs,Bao being a Menace... Again... #vtuber #vtuberen #twitch,2023-12-02T20:00:08Z,75811,7091,68
iKKwCxZBKR0,If Bao were a Pokemon #vtuber #vtuberen #twitch,2023-12-01T20:00:30Z,51788,5355,24
EYOeEo6kppM,Bao doesn't aim 🎯 #vtuber #vtuberen #twitch,2023-11-30T20:00:06Z,252382,22220,420
oe-pH22B_3E,Bao reacts to AI Bao #vtuber #vtuberen #twitch,2023-11-29T20:00:24Z,764864,80693,464
C9QW4phcDyc,Editors should stay in the basement forever #vtuber #vtuberen #twitch,2023-11-28T20:00:05Z,1192109,137634,379
8qGoPogEwDE,Did Bao Survive NNN? #vtuber #vtuberen #twitch,2023-11-27T20:00:04Z,62493,7739,109
xFWpHocb46A,Bao is a true patriot 🦅🦅 #vtuber #vtuberen #twitch,2023-11-26T20:00:22Z,186934,19836,132
zhzyS44r91I,Bao The Whale - CHU CHU LOVELY | CHAINSAW MAN 137 x MAXIMUM THE HORMONE Cover feat. @obkatiekat,2023-11-26T20:00:10Z,784574,31590,561
FdUTVbhCfrE,SUS Vietnamese lessons with Bao #vtuber #vtuberen #twitch,2023-11-24T20:00:07Z,62547,5950,57
uGiBvNYuHus,You heard that too right? 😂😂 #vtuber #vtuberen #twitch,2023-11-23T20:00:30Z,344773,42851,247
J-Eo2Is49a0,He's so FOUL for this 💀 #vtuber #vtuberen #shxtou #akumanihmune,2023-11-22T20:00:07Z,44275,4114,31
vu3TVfN0M9g,Another Beautiful day without using sin cos tan #vtuber #vtuberen #twitch,2023-11-21T20:00:25Z,113142,12109,196
K8VcGV-_vc0,this is fire!!!! 🙏🏻🙌🏻🔥 on mute 🔇🔇🔇 #vtuber #vtuberen #twitch,2023-11-20T20:00:16Z,285148,28638,212
LcoSzBbEEsw,How did she NOT notice? 💀 #vtuber #vtuberen #twitch,2023-11-19T20:00:13Z,131619,12687,49
Jb5fG_vd0KY,I checked your F*cked up fridges with @viennavtuber,2023-11-19T20:00:06Z,135270,7544,254
jLMESdGXMTM,Popular vtuber faces Allegations #vtuber #vtuberen,2023-11-18T20:00:24Z,68032,5876,53
rS2ve-IpsNM,Bao unleashed Something Horrific #vtuber #twitchstreamer,2023-11-17T20:00:23Z,386452,45309,434
qI7dWlrYiAc,Bao shows Vedal The Blueberry #vtuber #vtuberen,2023-11-16T20:00:31Z,47819,5389,79
mkFA6uvzNbI,What goes on in Bao's Mind? #vtuber #vtuberen #callofduty,2023-11-15T20:00:19Z,131790,13577,87
nK99CrZln44,My Parents Lost the 50-50 #vtuber #vtuberen #genshinimpact,2023-11-14T20:00:26Z,528199,65434,509
A2mU6RMoSeg,Bao cancelling herself Speedrun #vtuber #vtuberen,2023-11-13T20:00:03Z,41930,4642,56
_yAveAz_O6E,Giri banned me 😠 #vtuber #vtuberen,2023-11-12T20:00:12Z,132477,16471,63
GZacKyeEoQQ,"You Donate, we do a group feeding stream 💵🍼",2023-11-12T20:00:06Z,74172,4661,55
hmDV2mEycmc,Bao's Hardest Decision #vtuber #vtuberen,2023-11-11T20:00:24Z,69629,7358,36
-f7rvZjkEEU,Bao exposes herself again.. #vtuber #vtuberen,2023-11-10T20:00:00Z,921041,84688,368
tyfxGCO9QA4,Bao wants some Milkies 🐱 #vtuber #vtuberen,2023-11-09T20:00:30Z,47775,6422,67
3gtf2sIZUKQ,Bao had one Job #vtuber #vtuberen #faiththeunholytrinity,2023-11-08T20:00:01Z,87466,8377,44
bEoMw3iK8Rw,Why is he kinda... Hmm #vtuber #vtuberen #genshinimpact,2023-11-07T20:00:24Z,41583,4358,37
u3r5krthCPo,Bao reads your F*P Stories with @CottontailVA,2023-11-06T20:00:26Z,962518,51275,571
4TOZkfBjfzQ,Bao is a Menace #vtuber #vtuberen #callofduty,2023-11-06T20:00:01Z,172539,18421,277
ydrBhkw044E,I'm an artist ahead of my time #vtuber #vtuberen #faiththeunholytrinity,2023-11-05T22:00:26Z,302033,32499,161
RVhS7aoHANw,She actually checked his... 😳 #vtuber #vtuberen,2023-11-04T20:00:10Z,655020,67642,260
pWt8pkkghzw,Bao shows off her Coding Skills #vtuber #vtuberen,2023-11-03T20:00:16Z,1265808,126494,456
GRWx6HYQmW4,I love my Gamer Girl Dog Bed 🐶🦴 #vtuber #vtuberen,2023-11-02T22:00:08Z,194746,21774,181
V7igWObcJ7I,I can fix him... #vtuber #vtuberen,2023-11-01T20:00:18Z,587494,50741,546
Akbb3Z2-ic0,Please ban all Jumpscares 💀 #vtuber #vtuberen #parasocial #chillasart,2023-10-31T22:00:05Z,141924,14957,89
9QuFLFbHkk4,Chat Chooses My SUS Sound Alerts 🎵💀,2023-10-31T20:00:04Z,143729,9060,103
qSy1EnIJQbQ,"Ah, Eto... Bleh! #juniperactias #vtuber #vtuberen",2023-10-28T20:00:21Z,58314,6402,31
VyAhMC7gMII,How I Lost all my Fans #vtuber #vtuberen,2023-10-26T20:00:07Z,366453,39032,592
t8DUGMrwv5c,Bao vs. The Voices #vtuber #vtuberen,2023-10-24T20:00:25Z,129623,16269,194
bTBaCYLI-f8,I hired Max0r to edit this video,2023-10-22T20:00:11Z,262769,18524,428
w2WWRf4U9Yo,Finally breaking my silence #vtuber #vtuberen,2023-10-20T20:00:16Z,262850,31332,180
ZR2HKw5IVOo,Vtubers closet tour! #vtuber #vtuberen,2023-10-18T20:00:09Z,284367,38880,392
M6J3i5TVbpw,Is this what Fame tastes like? 🤩 #vtuber #vtuberen #asmongold,2023-10-16T20:00:05Z,40332,5017,59
RopneGzen4M,Bao & Giri Tries The MOST CURSED food,2023-10-15T20:00:10Z,137590,8139,564
TD55yNbKnVk,I wrote a song for a Vtuber #vtuber #vtuberen,2023-10-14T20:00:09Z,209269,25644,281
fhWnu9T_pHQ,I'm just an eepy Girl 😴💤#vtuber #vtuberen,2023-10-12T20:00:11Z,658683,72594,287
zmflOgfpaQw,Vtuber breaks NDA #vtuber #vtuberen,2023-10-10T20:00:16Z,345133,42118,288
eS7zHkQXUlY,Bao - girls like me don't cry (cover),2023-10-09T20:00:07Z,586404,18493,532
UyffVMNjj04,She fixed my DENT 😏 #vtuber #vtuberen,2023-10-07T20:00:05Z,44321,5054,57
VBhIpvWtr9s,Bao vs Bot.. Who will Win? #vtuber #vtuberen,2023-10-05T20:00:10Z,257010,21963,141
A_ZCsSEC9jM,My whole brand in a Nutshell #vtuber #vtuberen,2023-10-03T20:00:03Z,42633,4760,33
YWcMf7x4SZY,Bao & Lucy Drool over the Sexiest Food Mascots (Tier List),2023-10-02T17:00:16Z,513761,23318,1056
Zz4Kt3SbEeQ,We tried to cheer up Uki 🥺 #vtuber #vtuberen,2023-09-30T21:00:16Z,109116,11614,43
m5GBCxGt0pc,I got flamed by an AI 💀 #vtuber #vtuberen #neurosama,2023-09-28T21:00:33Z,125982,14485,122
yKgPOUsHizo,PLEASE DON'T GET HANDSY #vtuber #vtuberen #totk #tearsofthekingdom,2023-09-26T19:00:33Z,46021,4674,125
5-NocguQUYY,The Blueberry Lore #vtuber #vtuberen,2023-09-23T19:00:03Z,37731,3791,32
RCImE6wSeUQ,Virginbonding with my friends ❤️ #shxtou #akumanihmune #nihmune #vtuber #vtuberen,2023-09-21T19:00:11Z,31322,4208,42
vq0FQWwhY7M,I HATE BENNETT SO MUCH #genshinimpact #genshinshorts #vtuber #vtuberen,2023-09-19T18:00:23Z,33162,3620,26
EegBAORkvkA,Bao's experience with a STALKER,2023-09-17T18:00:08Z,60230,4212,104
UuqUCzT4RvU,Bao schizoposting #vtuber #vtuberen,2023-09-15T18:00:15Z,42083,4795,111
38arQamK1S0,I didn't meant to I swear 💀 #vtuber #vtuberen,2023-09-13T18:00:01Z,78967,8683,75
YBz2zocnWvM,Bao and Tricky Judge Chat’s REAL School Confessions (UH OH),2023-09-12T18:00:22Z,143843,8188,140
L1nKQqha9gs,Everyone say sorry Manager-san #vtuber #vtuberen,2023-09-11T18:00:12Z,39433,3447,15
WFVMUBOYVYQ,Sorry I was really hungry #vtuber #vtuberen,2023-09-08T18:00:12Z,127137,13858,190
a2in_N8NyTY,I declare WAR against Shoto #vtuber #vtuberen #shxtou,2023-09-06T18:00:01Z,177971,16585,106
3q9e8iDMXSA,Bao's New Outfit (IT'S NOT WHAT YOU THINK),2023-09-03T18:00:02Z,66545,4615,119
iraNL8Rq6u4,My Tagalog could use some work 💀 #vtuber #vtuberen,2023-09-02T18:00:25Z,70571,5644,84
NjqbjRpzRng,I would join the army for him 🥵 #vtuber #vtuberen #callofduty #cod,2023-08-30T18:00:09Z,216662,23373,173
tg4cajVzc9w,I covered Get Up by @NewJeans_official #newjeans #newjeans_getup #kpop #cover #vtuber #vtuberen,2023-08-26T17:00:26Z,44861,5400,90
HFWc2D_3Ia0,'Get Up' NewJeans (뉴진스) - Bao The Whale Cover (Extended ver.),2023-08-26T17:00:09Z,115974,4897,150
65flPjEZ0cs,We shared a hotel room 😳 #vtuber #vtuberen,2023-08-25T17:00:03Z,44677,6333,70
rY1QEPYC8Ho,The perfect clip doesn't exist-  #vtuber #vtuberen,2023-08-23T17:00:35Z,42620,5038,20
OD12F8GxaV0,Why do balls have a stitch line? #bao #vtuber,2023-08-21T17:00:23Z,554114,41537,390
wKEpAaDw_h0,My cover is live on all streaming platforms! #kamisamakiss #kamisamahajimemashita #vtuber #vtuberen,2023-08-18T17:22:12Z,77369,8152,100
scajlUpinhk,Bao The Whale - Kamisama Hajimemashita Cover (Kamisama Kiss OP),2023-08-18T17:00:06Z,177078,7065,187
RPJcM6EHd5s,Manifesting Link to do this to me 😍 #vtuber #vtuberen,2023-08-17T17:00:14Z,116885,11055,84
oydMu5e93nA,Bao and Tricky React to 𝓨𝓐𝓞𝓘 #vtuber #vtuberen,2023-08-16T17:00:27Z,43078,3058,19
t5Z7x7PWH4U,Bao Drinks the Among Us Potion at 3AM *IMPOSTER* #vtuber #bao,2023-08-15T16:00:42Z,97865,8317,42
QMEl_9yag7M,Bao's Thoughts on Lewdtubers #vtuber #bao,2023-08-14T16:00:27Z,47849,5321,35
M8cwCgPBDDE,Bao's Hairline Is Worse Than Asmongold's #vtuber #bao,2023-08-13T16:00:25Z,1013612,68068,275
Su5WBsO9a78,Bao Reviews Numi's Bedroom  #vtuber #bao,2023-08-12T16:00:30Z,169477,13872,51
oWPQjSpd33w,Bao Is a Yandere #vtuber  #bao,2023-08-11T16:00:42Z,1596435,131058,1789
OZFNoYAo23s,Bao Puts the Leash On YOU 🫵,2023-08-11T16:00:31Z,72180,5336,179
ZKgPZ_WIFBo,Filian Tossed a Salad in Front of Bao #vtuber #bao,2023-08-10T16:00:22Z,3011768,262112,1176
gMhO5RRM0AI,Bao HATES Women Confirmed #vtuber #bao,2023-08-09T16:00:36Z,41393,4963,52
aYfVSbxeZiE,Bao Is Truly a Pillow Princess #vtuber #bao,2023-08-08T16:00:01Z,367311,18492,83
GKS1IB9vi6E,Bao Wants to Horse Around #vtuber #bao,2023-08-07T16:00:10Z,94767,8106,50
VFc9MAa4giU,Bao Is A Femboy Link Enjoyer #vtuber #bao,2023-08-06T16:00:15Z,38901,4284,45
-SJtcqWiJLs,Bao's Dent Origin Story #vtuber #bao,2023-08-05T16:00:00Z,33717,3188,19
7GA_-ZGeBAw,Bao and Filian Review CURSED Powerpoints,2023-08-04T16:00:11Z,253735,14451,185
CQ7RxzJJSlE,Bao Finally Apologizes... #vtuber #bao,2023-08-04T16:00:08Z,157361,16292,117
KSyyKpF52rY,Bao's Shameless Plug GOES WRONG #vtuber #bao,2023-08-03T16:00:14Z,53846,6313,46
AGHpqSSMaik,Bao Gets 𝓛𝓮𝔀𝓭 Fanart of Her And ? #vtuber #bao,2023-08-02T16:00:10Z,35438,3779,45
9gtiahJjN9A,Bao's Unholy Cover Was Truly Unholy #vtuber #bao,2023-08-01T16:00:10Z,31603,3086,84
43-SMtcFjt4,Bao's Dent Got BIGGER #vtuber #bao,2023-07-31T16:00:05Z,92220,8832,60
jS-BTCYJd4k,Bao EXPOSES Yuzu #vtuber #bao,2023-07-30T16:00:25Z,29589,3193,25
UZFosXxwcKo,Bao LOSES IT When She Meets Sidon #vtuber #bao,2023-07-29T16:00:31Z,110707,14868,223
kYoMVu3f9fU,Bao Is Exactly What's Wrong With VTubers #vtuber #bao,2023-07-28T16:00:37Z,85521,10042,128
4DW9RtpYTbo,Bao's Weirdest Turn Ons and Turn Offs,2023-07-28T16:00:03Z,264326,15635,325
8qhlJ4DUzVE,Bao is THIRSTY for Sidon #vtuber #bao,2023-07-27T16:00:09Z,34093,3755,54
8_UxW_V4GMQ,Bao's Toilet Reveal #vtuber #bao,2023-07-26T16:00:11Z,117781,9405,18
nqVENAD5Pg4,Bao is BANNED for Korok Abuse #vtuber #bao,2023-07-25T16:00:40Z,27312,3940,45
tZX6A-d-aM0,Bao Can't Be This Dumb #vtuber #bao,2023-07-24T16:00:47Z,582692,61580,303
tRVcVz8YJts,Bao's Big British 𝓢𝓾𝓬𝓬 Off #vtuber #bao,2023-07-23T16:00:39Z,29205,2735,26
XJ0-BI5BHtI,The Baohio City Council Has Denied Your Application #vtuber #bao,2023-07-22T16:00:32Z,634942,59245,214
E3lR43mmPwI,Bao's Most Controversial Emote #vtuber #bao,2023-07-21T16:00:18Z,469077,46645,121
2bpN3o3SE6g,Thirsty Vtubers Rate Your RIZZ,2023-07-21T16:00:04Z,189309,11229,205
6Fm5q0ZsK9I,Bao Is Shorter Than 7th Graders??? #vtuber #bao,2023-07-20T16:00:04Z,341276,37916,413
yFta9GywYUs,Bao Is BANNED From the Movies #vtuber #bao,2023-07-19T16:00:49Z,337484,37750,160
tYBgdik8_Wk,Karen Bao Meets Her MATCH #vtuber #bao,2023-07-18T16:00:44Z,19660,2433,24
M_5F-7ggUxU,"If Bao Makes These Expressions, RUN #vtuber #bao",2023-07-17T16:00:17Z,82463,11341,95
1MdqFkXlVeQ,I made a citypop version of dreamy night by LilyPichu ☁ #vtuber #bao,2023-07-16T16:00:01Z,15592,1752,19
ZFZMoEK9SGI,Conspiracy Theories With Bao #vtuber #bao,2023-07-15T16:00:33Z,57799,5086,39
dSVLHbGc5_Q,Bao The Whale - dreamy night ♫ Japanese Citypop Cover (LilyPichu),2023-07-15T16:00:33Z,146362,5772,164
LDKA6hAWuDc,Bao's Expert Plays in Zelda TotK #vtuber #bao,2023-07-14T16:00:21Z,21667,2581,21
5f3mhjpfswg,Bao's Feet Domination Story #vtuber #bao,2023-07-13T16:00:07Z,25949,2955,56
qhduenP9OiU,"Bao The Whale ""Aqua Terrarium"" Cover (Nagi no Asukara ED)",2023-06-25T16:00:38Z,83056,3868,149
JZZ-jTElKig,Bao The Whale - Lemon Cover (Kenshi Yonezu),2023-05-26T16:00:18Z,149500,7019,250
6Z0dm3SqSV0,Bao The Whale - Get Your Wish Japanese Cover (Porter Robinson),2023-05-19T16:10:00Z,109980,4665,151
esY5swfkjS8,Spring Bao Lore,2023-05-17T19:27:25Z,17045,1777,55
3Mj9FF_piGQ,Bao The Whale - Love Me Not (Original Song) prod. @Overspace,2023-05-06T03:00:01Z,762516,20949,528
j1T3GEqnkKs,Spring Bao Debut Teaser,2023-04-30T22:02:26Z,17624,1552,54
naBtMxAlD1g,"Bao The Whale 1st Cover Album ""Citrus Love: Slice of Life"" Teaser",2023-04-14T03:03:52Z,17768,1833,106
p092fVkOmtg,I Rated Your STINKIEST Poops 💩,2023-04-02T17:00:32Z,52127,3778,114
b1Z1QEhVOH4,I CRINGED to Your ?!#$! Stories with Cottontail,2023-03-27T03:12:52Z,354741,18768,234
FsOf6IEiraU,I was the SUSSIEST Whale in 3D,2023-03-19T17:00:08Z,49416,3185,67
tY2waL6oA20,"Rating Your Tinder 🥵 Profiles ft. Vienna, Numi, Tricky & Yuzu",2023-03-12T17:00:37Z,179137,10697,156
_xiEb34XHMM,A.I. Bao Reads Bao's UNHINGED Tweets Part 2 #vtuber #bao,2023-03-09T20:00:16Z,48189,3550,30
tD3grE5BMNA,AI Bao Reads Bao's UNHINGED Tweets #vtuber #bao,2023-03-08T01:03:56Z,32716,3100,40
H6p4G0sS56c,I Became a Space Mechanic,2023-03-04T18:00:14Z,46821,3623,88
7gI9J7AxyDc,"I was exposed as YANDERE with the Girls (Ft. Numi, Vienna, Yuzu)",2023-02-25T21:42:10Z,194781,11560,167
NLAnWuYEzXo,Biden & The Gang Meets VTubers #vtuber #bao,2023-02-25T20:52:11Z,147978,11848,170
V8WU7j_974w,We Voice Act Bao x Numi Fanfiction (𝓨𝓤𝓡𝓘) ❤️,2023-02-14T20:00:11Z,77528,5311,110
SGdzftoIKVo,I Tried the Most CURSED Chip Flavors,2023-02-11T18:00:15Z,181075,10723,268
QQo7fzipIA0,Bao Reacts to Your CRAZY Gift Ideas,2023-02-04T17:00:17Z,53648,5699,97
QPYNktmG8VA,The Best of Bao 2022,2022-12-31T21:00:09Z,361908,18287,356
iRgFVxk8RO0,Merry Chrimbus #vtuber #bao,2022-12-24T22:50:09Z,34912,4673,256
ONB5a8QqFx8,Bao Draws Cursed Art of Vtubers,2022-12-18T17:00:21Z,54730,3840,114
vNBYX3jNZQQ,"Bao Gives Numi B**bs ?! ft. Numi, Yuzu, Vienna & Nemu",2022-12-10T17:00:29Z,63938,5154,89
RdDRqIJGBxA,Bao is FORCED to Get a W**B TATTOO on STREAM,2022-12-04T17:00:13Z,129893,8515,132
_yL66x5bbMs,Bao LOSES IT with Jump King,2022-11-26T17:00:32Z,64188,4720,62
_dXD8cVbzrw,Bao is LOOKING for LOVE,2022-11-19T17:00:30Z,140747,10461,161
YpMCeD6EaY0,I wrote a fanfiction for YOU 😳,2022-11-05T17:00:30Z,47181,3884,133
TYVAP0oDrQk,I BANNED my chat for WHAT?!,2022-10-26T21:15:48Z,96119,6925,141
wCPXQjR1t9w,Bao goes on HOT DATES with VTubers 🥵,2022-10-19T23:06:32Z,169853,11722,219
ZylMjlvSyNw,Bao's JUICY new model reveal!! 🍋,2022-09-28T19:00:21Z,239572,17633,331
krqAtSmmIac,I Tried to Start a HOT Podcast 🥵🩳,2022-09-24T00:00:14Z,163566,11787,346
YAX4Xu0_dsM,I was BULLIED by my 400K Subscribers 😭,2022-09-14T19:00:11Z,146477,10600,169
xSsWP2DPSQU,Bao The Whale - Citrus Love (Original Song) prod. @Overspace,2022-09-04T19:47:17Z,1859444,53986,1102
hNPw9b43yfo,Lemon Bao Lore,2022-09-04T02:00:09Z,83416,8509,239
1KBbEgeYYtI,My Sister FORCES ME To Date You 🔪🥴,2022-08-31T19:00:00Z,249602,14482,241
i095mA666Yg,I got ARRESTED for my cringe 😭,2022-08-24T19:00:12Z,123164,7733,108
usBZtUzzNNk,I Lost It with these HOT Takes 🥵🔥,2022-08-17T19:00:31Z,559423,30298,555
gVPU0iG60Cg,I’m the CRINGE Police 😩,2022-08-10T19:00:30Z,159686,10702,171
RrGhCDQ_8ZQ,I FINALLY Take a Bath 🛁🐳,2022-08-03T19:00:17Z,86503,5248,102
HD6Y3uvz1jc,I FORCE Vtubers to Play a Game With Me,2022-07-28T19:00:12Z,102995,6303,108
y_-QJIOVLeA,Vtubers Find Their New Crush 😳,2022-07-20T19:00:24Z,263733,15878,245
8xbVHkSHEmc,I Judged You with my Vtuber Sister 🚩🚩,2022-07-13T19:00:03Z,417948,23791,338
HSvxxKDv3Oc,【Self-introduction】Vtuber Q&A self intro w/ Bao The Whale,2022-07-04T18:24:57Z,330352,18196,461
mwKM055soc0,My True Nature Is Exposed 🛏️,2022-06-29T19:00:29Z,394730,21552,381
a-atksJCfhU,Vtubers Rate You 😉,2022-06-22T19:00:00Z,203924,16223,257
du0IukRLG4k,I Hunted Ghost Vtubers,2022-06-15T19:00:21Z,69399,4092,115
bvyDadgYfrc,Vtubers Find You a Girlfriend,2022-06-08T19:00:20Z,367572,23440,488
y4paNs7URtk,I got ROASTED by Vtubers,2022-06-01T19:00:31Z,787308,36725,628
MlwowTL_I20,"I went CRAZY with kson, Shylily & Pikamee",2022-05-22T19:00:05Z,143049,9164,147
CwBSyz8G4jM,Vtubers Attempt To Use Their Brains,2022-05-07T18:00:02Z,86784,4925,91
bAV5EVeN6lg,I'm Actually A Genius,2022-04-30T18:00:10Z,79569,5111,78
xfJbLnUbPRw,This Game is Giving Me EMOTIONAL DAMAGE,2022-04-23T18:00:22Z,115171,6654,109
gMQ7pxRDksY,Bao Gets Attacked By TENTACLES,2022-04-16T18:00:11Z,85160,5413,108
kwbxHw_tDAo,My New Model Reveal!,2022-04-09T18:00:12Z,186853,12445,176
JjOfIIAxfMY,He's INSIDE ME??,2022-04-02T18:00:05Z,117229,7252,105
FhOpyPhQYOk,I'm Kinda Toxic...,2022-03-26T18:00:10Z,119741,7227,131
AewxmnEPd24,What if We Went on a Date? 😳,2022-03-19T18:00:03Z,125538,8402,198
Quh_JAjMYA4,Mommy? Sorry.,2022-03-12T19:15:00Z,90391,5055,117
GHzc2mLSPy4,This Made Me Go CRAZY,2022-03-05T19:00:04Z,80803,5054,185
Pq_1n7HtD1U,I Wore This Outfit For You ❤️,2022-02-26T19:00:06Z,193058,13386,449
rVGyI5zm2-Q,This Was My First Time...,2022-02-19T19:00:28Z,180300,9805,468
mc4bzSJjOsE,This Was Too SCARY,2022-02-12T19:00:25Z,248609,14878,300
e85e9kAvLfY,I Tried to Survive in the Outside World,2022-02-05T19:00:25Z,187625,9719,340
ig0Xsw4MfDU,The WEIRDEST Fan Fiction,2022-01-29T19:19:50Z,74312,4534,74
r5D_wHTXZOc,I'm Literally CRACKED,2022-01-22T19:15:01Z,154610,9135,137
pZBQ35LoFxM,Vienna is TOO Competitive,2022-01-15T19:00:29Z,195445,10360,181
xPCvCx8L7PQ,I Should NOT Be This Scared of the Ocean...,2022-01-08T19:00:16Z,156328,9687,198
oM0dUp-Y5vQ,Chibi Scares Me...,2022-01-01T19:00:30Z,180748,11400,187
zsoALDnwGPs,The Best of Bao 2021,2021-12-29T19:00:14Z,408296,17501,269
fvQ4cQ8yFsk,This got WEIRD,2021-12-25T19:00:11Z,61002,3793,51
DWoHUPa0xX0,Vienna Trolled Me,2021-12-22T19:00:03Z,167038,9168,176
amin2GRjaoI,Don't Put Me Behind the Wheel,2021-12-18T19:00:01Z,195775,10988,284
3r5oX0z7yIc,"How I Lost $100,000",2021-12-16T19:00:03Z,126010,7018,88
jT6ztofW_KY,I Have a Present for You,2021-12-11T19:00:21Z,78290,4846,82
pTqRIV1mkHI,I'm falling for you,2021-12-08T19:00:27Z,106308,6681,113
2JvuYXwOCfk,My Friends Wanted it Hard 😳,2021-12-04T19:00:01Z,74611,4498,100
lSgq4dlWVWk,The SCARIEST Game to Play With Friends,2021-12-01T19:00:17Z,69018,4063,126
AwhPgnrQHZ4,The BIGGEST Vtuber Collab Ever!!! (Part 2),2021-11-27T19:00:03Z,49571,2961,42
mrnswChlJlM,I Had Nightmares For Weeks,2021-11-24T19:00:12Z,119557,7427,224
4lpZ8GoKTZg,I Was On Kitchen Nightmares With Amatsuka Uto,2021-11-22T18:00:01Z,45526,3892,83
Z1H_9hfhi1E,The BIGGEST VTuber Collab In HISTORY!!!,2021-11-19T19:00:19Z,139261,8493,231
suSPhV4lxeI,Bao Gets A L*WD Surprise In Deltarune,2021-11-17T18:00:11Z,56033,3581,86
PX29Ht95dU8,Bao's Sage Walls Are PENETRATED,2021-11-15T18:00:11Z,60909,4078,94
Ylgf-Oejf4w,Bao Is Into YURI?!,2021-11-10T18:00:12Z,171951,11371,267
Fxbk8CYWVHA,You're Invited To Bao's Birthday Party!,2021-11-09T04:52:05Z,28001,2829,170
NvSETtUklZE,Bao Wants A Naughty Birthday Present,2021-11-08T18:00:11Z,460690,27062,655
MQaegjtGtNE,HU TAO?! MOMMY? SORRY???? #genshinimpact #genshin #vtuber #vtuberen #hutao,2021-11-06T17:00:23Z,217732,18781,195
FgRAn-loWi4,Bao is NEVER Getting Over It,2021-11-05T17:00:10Z,185631,10889,270
QDejhTdJRgI,Vtubers React To Creeper-Chan,2021-11-02T16:00:13Z,64950,3996,63
SzIbbAUw8wo,BAO VTUBER MERCH OFFICIAL LAUNCH,2021-10-31T23:10:00Z,15264,1518,79
QMzfzycZlX8,Bao Is Down Bad In Deltarune,2021-10-26T16:00:11Z,68877,4757,128
GmYplDhSfhQ,BAO NEW VTUBER OUTFIT REVEAL,2021-08-21T16:00:15Z,40715,2301,73
lH1Lc_HOqmw,Finana Gets Taught A Naughty Lesson,2021-08-05T16:00:12Z,264688,12639,176
VVPutQuOgDA,Bao Dominates Artemis of the Blue,2021-07-29T18:56:08Z,90096,5647,72
84rjBjaRUFU,Artemis Gets A Teeth Inspection From Bao,2021-07-22T16:00:12Z,115412,6969,108
akQezaxchZ0,Vtubers Play Sweaty Valorant,2021-07-07T18:00:09Z,127237,6908,94
ldiObg51KSM,Please Stop Bonking Me 😭,2021-07-01T20:23:09Z,85597,4420,77
qJxtP1R2M8w,She Spanked WHO???,2021-06-27T21:05:09Z,93611,5070,81
LWRDpXOldMI,I Do Like Punishments 🥺👉👈,2021-06-17T19:31:08Z,244469,13542,277
y3tsJ4r54PA,Bao Fangirls A Little Too Hard,2021-06-10T19:00:22Z,89710,5741,169
gXgleQY9GsE,Bao and Uto Climb To Apex Predator,2021-06-03T20:00:08Z,51782,3583,129
Z1kSvajNhak,This VTuber Should Be BANNED From Apex Legends #vtuber #bao,2021-05-30T20:57:18Z,119199,9982,179
BW_Swq0-Akw,She Is The WORST Employee!,2021-05-27T19:00:04Z,82605,6371,0
7XOGR3JFJwo,Bao The Blob Has Some Wisdom For You #vtuber #bao,2021-04-13T00:27:49Z,83991,7443,124
pCjdDOJm_5Y,When You're A Girl And A VTuber #vtuber #bao,2021-03-10T01:42:07Z,290252,23786,475
L4DRrP0eNdQ,Bao Plays Mad Father Remake BLIND,2021-03-07T01:28:29Z,55711,2678,62
rORcVY925Yc,NEW SMASH LEAK: WHALE VTUBER???,2021-02-27T19:08:28Z,56203,4372,124
NjKR3Lf1-Vk,This Anime Quiz Made Me Lose It ALL,2021-02-25T22:00:06Z,229398,13331,305
xaH86YEFAFI,Are You Lactose Intolerant #vtuber #bao,2021-02-23T22:00:27Z,200687,16711,444
-GYOAjJVXMk,"Bao The Whale - Police Piccadilly ""Rumor"" English Cover",2020-12-31T22:49:04Z,178584,7003,233
at2ggoE8kl0,Wholesome VTuber Minecraft Moments,2020-12-17T20:00:10Z,62586,3569,63
m-MvbWTHX2I,Bao Plays Phasmophobia With Friends,2020-12-17T02:38:35Z,40138,2395,60
NbHD50edwpc,"Bao The Whale - Nana Ouyang ""The Best For You"" Cover ft. redza",2020-12-11T19:18:06Z,420066,14646,358
8KtHNfuvebs,You're Already Under My Genjutsu,2020-12-09T03:58:38Z,66593,5487,291
Lui_HDVbads,"Bao The Whale - DATEKEN ""Honeymoon Un Deux Trois"" English Cover 蜜月アン・ドゥ・トロワ",2020-11-26T20:00:09Z,763060,23726,394
