id,title,publishedAt,viewCount,likeCount,commentCount
OXyVNyVNRh4,📛02 Clair Obscur: Expedition 33 DAYO! 【First time playing】,2025-12-14T05:00:02Z,0,57,28
lFishqzK6ZQ,Henya reacts to Megaman Dual Override,2025-12-13T12:01:35Z,28490,3672,180
s0-bZAxTZUM,📛01 Clair Obscur: Expedition 33 DAYO! 【First time playing】,2025-12-13T05:31:07Z,35672,3425,86
ctwVdT7g0TM,Henya's Secret Message to Michi,2025-12-12T12:01:17Z,27273,3679,67
AhVDK63auF4,📛GAME AWARD 2025 DAYO!,2025-12-12T04:37:42Z,33278,3036,45
Jqrq3nEzj9w,Henya's Mom keeps on being based,2025-12-11T12:00:46Z,36271,4756,118
PFua6kgnyZY,Look at Henya's Chicken,2025-12-10T12:00:52Z,12552,1612,94
CJitg6RaxnE,📛LIVE STREAM DAYO!,2025-12-10T03:14:54Z,15690,2160,21
HBF4KY2zrvs,Henya harrasses kson with Chiikawa,2025-12-09T12:00:38Z,25430,3984,120
g6lCoRRUQBU,Henya being unhinged for 2 minutes,2025-12-08T12:01:33Z,93497,13684,200
z3ntAVtuneA,📛I'm on Observation Duty 8 (Again)  DAYO!,2025-12-08T03:25:03Z,15711,2329,19
z0u5oU86J_U,Henya desperately yells for her friends,2025-12-07T12:01:51Z,86626,8021,70
tXjrbY_GmVQ,📛I'm on Observation Duty 8 DAYO!,2025-12-07T03:18:26Z,16997,2329,22
vCxGvL_eJmc,Partying with a Random Flute player in Arc Raiders,2025-12-06T12:01:56Z,20391,2444,60
y29IVsTJAUo,📛Arc Raiders DAYO!,2025-12-06T03:14:19Z,16080,2287,21
HhegkIzCS-8,Henya the T Rex Typer,2025-12-05T12:00:39Z,51490,6305,151
kxBFaSsqh5I,📛TOKYO COMIC CON WALK AROUND with @Arielle-VT  DAYO!,2025-12-05T07:39:25Z,31952,3090,26
PSiWUxL8d8I,📛【SCHEDULE DAYO】スケジュール,2025-12-04T06:25:46Z,0,179,0
tlW6YV5hLeU,Henya goes crazy in Solo Leveling: ARISE OVERDRIVE!,2025-12-03T12:01:54Z,39435,4293,107
8o5a2HLlzjA,📛LIVE STREAM DAYO!,2025-12-03T03:23:21Z,22587,3213,36
vNVPAYfTMcU,【LETS TRY AGAIN DAYO】YouTube streaming Test 配信テスト【リベンジ】,2025-12-02T06:29:08Z,44983,6394,70
Kea9FNcDyt0,Henya reaction to NTR on Dispatch,2025-11-30T12:00:41Z,28889,3237,151
fQjjnxN52gE,Henya and her mom went shopping,2025-11-29T12:01:26Z,45717,4883,91
bSmiFNw4EQ0,Suprise cat appearance,2025-11-28T12:01:23Z,56701,7349,103
Z86-jxpgM0E,John Woo Directed this,2025-11-27T12:01:08Z,85652,8581,151
wd-V1dSa8Hc,Henya on ice,2025-11-26T12:02:01Z,178941,13452,249
9LnZ0jGoBKc,BIG HAPPY NEWS DAYO!,2025-11-25T06:35:51Z,71648,6554,324
Lyw4grmgU3M,This is how Vtubers sorts food,2025-11-24T12:00:45Z,81680,6153,103
79kYJ5JtVv0,Henya Plays Dispatch For The First Time!,2025-11-24T07:42:34Z,10230,924,50
JyotH1cRZfw,These VTubers are a menace in REPO!!,2025-11-23T12:00:43Z,106435,12392,97
S5ZB1EUs-yA,This games' proximity chat is amazing!,2025-11-22T12:00:58Z,86969,6465,70
EXmIYi7yzVM,"Say my name, you god damn right....!",2025-11-21T12:00:27Z,423154,28567,246
XcLghmCF0ro,"If We Stop Talking, We Die..",2025-11-20T22:22:34Z,14900,1366,88
vdG25V-PqK8,Henya appreciates everyone for their love and support,2025-11-20T12:01:50Z,22694,3176,104
5w_iCFpdNdM,Henya travels all over the world...,2025-11-19T12:00:11Z,46679,6379,115
shFmw24oOmM,Henya's American Dad apologies to her fans,2025-11-18T12:01:51Z,53008,6846,170
UMRvP010vQ8,Where are all the customers!?,2025-11-17T12:00:55Z,55139,4780,75
APftGVshfKo,Ari cant stop talking about her favorite Henya clip,2025-11-16T12:00:31Z,54184,6680,92
eVKMXCTgKKQ,The intrusive thoughts won....,2025-11-15T12:01:20Z,59432,4941,87
rZhodZP63C4,Henya Reacts To Sony State Of Play Japan..,2025-11-15T07:37:18Z,5888,516,26
yAITOHJkd1g,Henya plays a beautiful song for her friend,2025-11-14T12:02:16Z,26993,3230,50
-Za_2R-0n-M,Celebrated too soon.....,2025-11-13T12:00:00Z,61147,4644,56
lmDf2Nw_OJ8,Henya is ruthless about her friends relationship,2025-11-12T12:01:39Z,137116,14047,256
1UPZ7iVMuRI,Henya the tech genius helps her Mom,2025-11-11T12:00:03Z,94307,11055,401
56ixJM_P7Kw,Henya shows off her Taxi driving skills,2025-11-10T12:00:10Z,44607,4483,118
XIAu2REmoBU,Henya Plays The Forgotten City..,2025-11-10T07:40:35Z,4287,545,24
IOywuVmeUzc,She WON Mario Party With THIS Move!,2025-11-09T13:00:36Z,116843,9916,101
ZqJq3ua0kFg,I Have A Surprise For You..,2025-11-08T07:44:06Z,21209,2422,135
3SUu6gPvzfI,How Henya's mom flex to Henya,2025-11-07T12:00:11Z,41576,4695,129
1dB3-0pe4y0,Zombies got skill issues,2025-11-06T12:30:01Z,105916,6922,130
OqmYSptMVqs,Henya Plays Luigi Mansion!,2025-11-06T03:47:25Z,13494,1252,46
OVwGkXpoHWU,Tenma immidietely regrets what she has done,2025-11-04T12:00:49Z,111254,8092,121
jVdUHOray7o,This is what happens to VTubers when they drink water,2025-11-03T12:01:29Z,59974,4434,47
0x9lG9e6H7w,Can 4 vtubers drive a car?,2025-11-02T12:00:02Z,31146,3689,101
KoBkFdRsanc,They didn't tell me there is more to clean?!,2025-11-01T12:00:42Z,45875,4709,102
zMLCwOAP87E,Can henya Say Irish Wristwatch,2025-10-31T12:02:09Z,53633,5425,107
ECI_rot-sfo,Henya founds Ironmouse at Twitch Con,2025-10-30T12:00:24Z,44406,4812,67
Bu00mdRAtew,Worst time for a Glitch,2025-10-29T12:00:25Z,33266,3122,40
NIGQEInit2U,I'm A Good Driver..,2025-10-29T06:51:31Z,15326,1563,138
fPsnlheRy2c,Henya Becomes A Professional Power Washer..,2025-10-28T06:49:59Z,8643,911,49
g7BxzrZHPk8,The Pregnant Megaman invasion is imminent,2025-10-26T12:01:21Z,33128,4157,76
4B7e4sFEeOQ,Henya Plays Tales Beyond The Tomb: Route 86!,2025-10-26T07:00:08Z,5408,655,24
b6sWMlbk5s0,Seems like Henya has a stalker situation...,2025-10-25T12:01:14Z,44439,4631,63
WPbUQyAhEaU,"Henya calls Tenma the ""O"" word",2025-10-24T12:01:11Z,55296,5517,104
ZWUAk1IBuLc,Henya and Tenma Collab gets off to a good start,2025-10-23T12:01:16Z,64167,7640,135
fcrMxSKZstc,Henya Plays True Nightmare: Roadside Сafe!,2025-10-23T06:43:36Z,6429,750,24
Scme9V_wV3E,Henya said what to Ari!?,2025-10-21T12:01:01Z,38982,3763,54
GqwHNk5Pzlg,Henya & Tenma Play Bloody Trapland 2!,2025-10-21T04:34:56Z,9640,1100,46
OaNEFTjHD1M,AmaLee almost became princess WHAT!?,2025-10-20T12:00:45Z,856404,76005,483
OrhZfUNnW7Y,Henya & Friends Go To TwitchCon!,2025-10-20T06:49:09Z,11726,1017,81
HGQQn0Szw1U,Henya dreams to be a meme lord,2025-10-19T12:00:30Z,49913,6171,130
ZFYUW67UK8U,Henya fights with her own Echo,2025-10-18T12:33:09Z,87020,11523,278
WvD_zKCifpc,My Dream Place..,2025-10-18T06:46:33Z,7607,872,64
ZmTI2blm91o,Henya Plays Monster Hunter Wilds x FINAL FANTASY XIV!,2025-10-17T06:31:39Z,6865,759,32
dPydyGTb5Y4,Henya does voice acting on get to work!,2025-10-16T12:01:16Z,63697,7606,121
yv2ZWzssrAY,Henya Reacts To Being An Animator In Japan!,2025-10-16T06:11:42Z,5801,797,35
Pvm5QHclJ_8,Geega and Henya secretly take a picture of each other,2025-10-15T12:01:02Z,42270,4353,41
ZVNX0LiKUaQ,We Played Little Nightmares 3!!,2025-10-15T00:53:48Z,7056,795,27
8fRoCpJt7qI,What Are The Chances..,2025-10-15T00:53:00Z,60669,4856,112
jjl551lvHGs,Geega and Henya are Chuunibyou sisters now!,2025-10-14T13:01:38Z,50460,5495,89
7tUe-V3lk5A,Stranded In The Ocean For 100 Days..,2025-10-14T05:49:18Z,9048,958,31
kyh3fTD9Pcw,Henya's mom is BASED!,2025-10-12T12:01:27Z,17933,2487,53
jO2cTAH8miU,MY FAVORITE HOLIDAY IS ALMOST HERE..,2025-10-12T02:34:49Z,7388,972,58
97BMoyZ-vog,This Is What Apple Fans Are REALLY Like!,2025-10-11T12:00:17Z,45853,5161,142
wpd2UeJWSL4,I Finally Played Little Nightmares!,2025-10-11T06:39:20Z,15734,1558,51
67-a7TILq_0,Kendrick and Drake Wholesome Beefing,2025-10-10T05:15:01Z,29085,3186,123
0tU6YP-yuqI,I Never Thought I’d Want to Go Here…,2025-10-10T03:07:09Z,8595,1035,81
KuONwDUr96g,Where is my SEXY DAYO,2025-10-09T06:03:07Z,24952,3451,78
Cn_qwmX73lI,MY NEW HALLOWEEN OUTFIT..,2025-10-09T06:02:56Z,8498,1338,115
2W9p4AhakYQ,My Chat Keeps Bullying Me..,2025-10-08T13:15:00Z,24030,2272,164
q9HAGaRuoms,Henya Tries Reading In English..,2025-10-08T06:55:44Z,25086,1994,53
iqmXiNnMJgk,I FINALLY BEAT SILENT HILL F!,2025-10-07T13:15:06Z,3952,529,25
vyP-gX5yXDY,Highgai and Cammys picture pose,2025-10-06T12:01:50Z,25962,2218,36
GhoctFErOy0,Henya Shows a Sneak Peak of Her Halloween Outfit!,2025-10-06T06:31:55Z,4746,762,41
T3zBD4Bi5P0,Henya becomes Canadian,2025-10-05T12:00:49Z,150702,12675,226
KZdD5ZxLjqY,Henya's Mamanya's number one priority.,2025-10-04T12:43:13Z,25220,2952,55
618XsIGOvrs,My Worst Experiences..,2025-10-03T01:21:45Z,20976,1952,144
-zxbaQ3Dyis,Henya gets confused for a child in the US,2025-10-02T12:00:01Z,154513,10159,238
4p9LfG2PlUU,Henya gives permission to sit on her.,2025-10-01T12:00:17Z,125730,10609,198
tUZ-XzMzd1w,Silent Hill f Is My New Favorite Game..,2025-10-01T06:54:52Z,8209,889,37
amjNqsXTJ-w,Mamanya listens to Kendrick Lamar,2025-09-30T12:00:07Z,82130,9362,175
hMXEzIIHGsA,I Died In The Worst Way..,2025-09-29T16:15:04Z,32741,2455,44
PkLYhxkBtGg,Can you understand Henya's Japanese?,2025-09-29T13:00:58Z,156870,10465,90
8WDNPRfibuM,Henya Plays Silent Hill f For The First Time!,2025-09-29T04:54:13Z,13967,1185,51
IQJl-PG8Oa0,What Is Type S**t?,2025-09-28T07:01:02Z,41144,3027,63
F87_x7QFYe8,Henya & Ironmouse Go To The Tokyo Game Show!,2025-09-27T06:42:11Z,15025,1373,48
XJj5HBCzyZc,Say Cheese!,2025-09-27T00:17:16Z,20811,2122,29
1qBjiAMESr4,Henya Reacts To Playstation State of Play!,2025-09-26T05:58:05Z,13065,967,59
h1WJKdC_k0Q,OBEY YOUR MUSTARD!,2025-09-25T12:01:27Z,22542,2071,77
1Kehionrts4,Henya Plays Dying Light: The Beast!,2025-09-25T06:30:25Z,16531,1432,71
2cuJDilE10U,We met AmaLee at the convention!,2025-09-24T12:00:04Z,51873,5397,61
tSmTEe4J5iw,What 9 months of CHIIKAWA does to you.,2025-09-23T12:01:50Z,104961,8331,183
WL9Nl6IROtc,"Henya Plays No, I'm Not a Human!",2025-09-23T05:35:44Z,12666,1171,44
TYpP-99ZQ64,Henya shows a new feature to her model.,2025-09-22T12:00:55Z,27131,2777,66
sHYq0jwnBLI,Henya Plays Resident Evil 2 For The First Time!,2025-09-22T00:01:03Z,16510,1382,83
w2rrohLYR2w,Henya's dad said marriage is horrible.,2025-09-21T12:01:43Z,130684,10470,130
6G8otM4v6Oc,"Henya Tours A $70,000,000 Dubai Billionaire Mansion..",2025-09-21T06:33:54Z,15243,1072,160
RnnRpqg09ys,What Do HENYA Fans Call Themselves?,2025-09-20T13:01:01Z,36772,4290,79
9uFMdH-6iQA,I'm Older Than Your MOM!,2025-09-20T06:41:11Z,84170,5674,102
TId6xx-cFTw,Henya Reacts To The Impossible Pancake Challenge!,2025-09-20T05:45:01Z,12205,1057,54
CoP4NGmUrv8,I Thought I Leaked My Outfit..,2025-09-19T03:15:03Z,89962,6306,55
siOEwgP-fds,Henya & Camila Have a Tea Party!,2025-09-19T01:33:52Z,12330,1482,71
mS9VFZtDeQ8,Henya Reacts To The Worst Hotels of All Time..,2025-09-18T06:30:27Z,26953,1753,177
ED8rX0GmAzc,Can You Survive The Craziest Game Ever?,2025-09-17T13:00:33Z,31396,2991,76
yntMzQfirtY,I Asked ChatGPT For Help..,2025-09-17T06:41:33Z,37753,2605,60
wBRPiyTmKQQ,Henya Reacts To The Toughest Eating Challenge of All Time!,2025-09-17T06:38:46Z,24161,1688,109
C-vV9gRYvXo,I'M OBSESSED WITH CHIKAWA!,2025-09-16T06:30:05Z,25630,1613,18
rkw9YTtgbtM,I Debuted My Birthday Model!,2025-09-16T06:07:17Z,15965,2557,209
HXGKUiLXwqk,I Reacted To FireDepartmentChronicles's Most Viral Shorts..,2025-09-15T06:48:48Z,82779,5715,183
xFsGgCXYW10,My Chat Has The Worst Jokes..,2025-09-14T02:15:08Z,48069,3573,44
Kxcm95JpKl8,Welcome To The Toilet Water Park..,2025-09-14T00:00:32Z,42342,2867,47
by1wfn84GqM,Henya Reacts To Daily Dose of Internet!,2025-09-13T22:01:49Z,47454,3069,99
PweLjWbi9CA,Henya Goes To Anime Impulse!,2025-09-13T03:15:01Z,12694,1081,39
HSyA9nugvPM,Henya did not expect Megaman 2 to be this easy,2025-09-11T13:00:30Z,39207,3916,354
Ujr-mt6H9_Q,Henya is Family Friendly DAYO!,2025-09-08T13:01:12Z,52004,5153,118
AI-272vRWmk,Henya Tries To Climb PEAK!,2025-09-08T06:56:29Z,12274,1632,59
396-i7EpwEc,Henya & AmaLee Return To The Best Co-op Game Ever Made!,2025-09-06T06:15:01Z,7145,935,29
Gd2sDVeQnXg,I Played Caylus's New Waterpark Simulator..,2025-09-04T23:49:18Z,10431,1361,78
fy5bSGfZdzY,Henya explains Chiikawa to Camila,2025-09-04T12:01:20Z,568035,47975,510
k1CHIAlJ35w,This Bunny Moment Made Everyone Lose It,2025-09-03T12:01:22Z,1591297,115906,591
-AizmnrOfv4,Henya Called Dooby Senpai and she freaked out!,2025-08-19T13:00:00Z,90306,7622,61
qDEOQSqbmuk,Henya is a what?!,2025-08-14T12:01:28Z,276742,22489,195
xgfQFQSW-Eg,When You Laugh But You're Actually Crying Inside,2025-08-12T12:02:00Z,47898,5636,181
G941Nugh7-Q,I Tried This Game and Instantly Regretted It!,2025-08-10T12:00:32Z,38608,3945,162
uMk3c4O95cI,Henya simping respectfully for Lady Dimitrescu【Resident Evil 8 Highlights】,2025-08-08T13:27:10Z,20242,2238,97
SnjIzTBKE64,Henya rages at the bald man,2025-08-05T12:30:38Z,22873,2040,47
mz23vNnw13c,Can Henya Survive Resident Evil 7 Without Freaking Out?,2025-08-01T13:01:35Z,27630,3210,171
J6SKceTtEps,Is Mega Man Actually Impossible?,2025-07-30T15:40:15Z,39193,4004,115
Wbb3E7A3nw8,I LEFT VSHOJO / VSHOJOを脱退しました,2025-07-23T01:41:07Z,211964,25205,2099
cnYFIqoaZTQ,Henya the Genius のライブ配信,2025-07-22T22:31:59Z,0,1,0
fQSCNZLE8o4,Henya Finally Has Jiggle Physics!!!【Henya Bunny-versary outfit reveal】,2025-07-18T12:01:31Z,44069,4714,243
WnoVTWRmgvg,Henya Being a Menace in Oblivion for 11 Minutes Straight,2025-07-11T12:01:06Z,23778,2278,89
N_eUXF2vE0g,Henya & AmaLee Play the Best Co-op Game Ever Made? | Split Fiction,2025-07-05T12:00:44Z,13422,1287,56
CI8M2RaVsS4,Henya’s Emotional Rollercoaster ft. Hot Mommies? | Duet Night Abyss,2025-06-27T12:00:22Z,11027,1085,38
7-v4eGBovSc,Roblox: Henya and Dooby Win Squid Game 2!,2025-06-06T13:00:13Z,12870,1329,38
vEmRfEjEN3Y,Underestimating Donkey Kong Country Returns Destroyed Henya,2025-05-16T12:01:42Z,55223,4103,250
1YA-Q_zyw9k,Henya’s Most INSANE Megaman Crash Out,2025-05-09T13:00:03Z,161275,10197,1083
mpUiIrHfa1I,Henya Lost Her Mind Playing a Rage Game for 5 Days (Get to Work),2025-05-02T13:01:32Z,65795,4071,161
R_qKCO8fT2s,Henya's new AI girlfriend is a murderer!,2025-04-18T13:00:52Z,16788,1828,79
myyC-0bkrBw,"Surviving playing ‘At Tony’s’ and ‘Bloodwash’!""",2025-04-14T13:01:22Z,10938,1197,52
1gxQ19QgJ94,Henya gets stuck in a cabin with a killer! | Fears To Fathom: Woodbury Getaway,2025-04-11T13:00:07Z,11809,1256,44
jK8dz2hXVdA,Henya & VShojo & Friends play Lethal Company | Funny Moments,2025-04-07T13:01:12Z,18180,1950,72
QYMFR6Dlt3M,Henya plays the  First Berserker for the FIRST TIME! #ad,2025-04-04T12:00:39Z,27497,2165,29
3RxlBZTgfC0,"I’m the Best Employee Dayo! - Zort ft. @GEEGA, @Zentreya and @HarukaKaribu",2025-03-22T13:00:08Z,17175,1567,46
AjIuuaHDfWI,Our Battle Will Be Legendary!! ft. @MichiMochievee,2025-03-06T12:00:13Z,17600,1797,49
idsr-MsJQa8,Henya Joins the Most Chaotic VShojo Collab - Lethal Company,2025-02-25T12:01:05Z,12020,1345,35
YCg8xuOdt2o,MINE IN ABYSS with @dooby3d #04,2025-02-10T10:00:39Z,5754,616,27
L46sl94STyM,MINE IN ABYSS with @dooby3d #03,2025-02-07T13:00:25Z,3382,498,7
iIjyvbQKREI,MINE IN ABYSS with @dooby3d #02,2025-02-07T12:01:06Z,2817,437,10
Iuxduq21pxE,MINE IN ABYSS with @dooby3d #01,2025-02-07T07:00:09Z,8908,852,30
j97xCFt8j7k,bad hide and seek #vtuber #henyathegenius #VShojo #poppyplaytime,2025-02-06T13:01:02Z,24266,1787,15
MzhSr1OD3dY,Dont ask Google dayo #vtuber #henyathegenius #VShojo #vtuberclips,2025-02-05T13:00:26Z,22442,2518,48
5jWBfTatwto,Never dig straight down dayo #vtuber #henyathegenius #Vshojo #dooby,2025-02-03T13:00:06Z,30576,2593,35
vH2Zt4ukC8o,Miside,2025-02-03T11:01:21Z,16958,1266,55
ivsKtC8r7YI,ANYWAY #poppplaytime #Vtuber #henyathegenius #VShojo,2025-02-02T13:00:48Z,15454,1727,51
pOP6kEJbtIA,呪われたデジカメ Cursed Digicam,2025-01-12T11:48:41Z,17813,1388,93
2A8uB-rg-t4,Adding milk to your cereal is GROSS #vshojo #henyathegenius #vtuber,2024-12-21T13:00:04Z,29137,2632,206
yDJxhvj2h0k,Henya is still struggling with this #vshojo #henyathegenius #vtuber,2024-12-19T13:01:13Z,124318,13019,157
9yr6aB0YVy8,Henya's fan made a 20-ft cutout of her! #vshojo #henyathegenius #vtuber,2024-12-17T13:00:20Z,22010,2727,49
YDZYQdeWLng,Henya spots an interesting overseas bro... #vshojo #henyathegenius #vtuber,2024-12-15T13:00:37Z,17445,2115,50
y1U1H-5ETXo,I Can't Believe It... - Silent Hill 3,2024-12-14T13:01:09Z,10827,1201,32
jk2CAH4yR8I,Henya Accidentally Equips the 𝓦𝓡𝓞𝓝𝓖 Outfit #vshojo #henyathegenius #vtuber,2024-12-12T13:00:57Z,47507,6969,116
ppSzvTRePSY,Henya worked at a cursed bathhouse | The Bathhouse 地獄銭湯:RE,2024-12-10T14:00:47Z,14783,1365,46
eveFvIx4IwQ,Henya's boss had an unexpected reaction to her quitting #vshojo #henyathegenius #vtuber,2024-12-09T18:41:05Z,13664,1697,33
ZF22sTzXL2E,Henya's Kung-fu outfit reveal,2024-12-06T14:00:34Z,11509,1612,101
wDPnHnKDcE4,I can take care of her - Silent Hill 2 (PS2),2024-11-26T11:01:06Z,11433,1231,49
HhXFnBs1eVk,Did I get the bad ending? - Silent Hill 1,2024-11-22T13:00:30Z,9204,1205,47
wR0FV5ugn9c,Henya's summer outfit reveal!!,2024-11-20T13:01:17Z,40638,5279,325
lIwEkTtf35A,Henya plays Zenless Zone Zero for the first time!!,2024-11-16T13:00:55Z,36484,2958,106
p-dorFQZoII,Babysitting is SO HARD!!,2024-11-15T13:01:05Z,18150,1995,102
qsSbHV6AVEI,Henya is close to becoming #1 big b00ba #vshojo #henyathegenius #vtuber,2024-10-26T13:01:05Z,16615,1909,63
sC3W8Ma25Ow,Henya talks about her fetish #vshojo #henyathegenius #vtuber,2024-10-23T13:01:07Z,17103,2078,80
1ECiCMix6J0,Instagram gives Henya PTSD #vshojo #henyathegenius #vtuber,2024-10-12T13:00:01Z,17246,2652,52
Va1jOp8RZAw,Henya's mom told her she will go BLIND if... #vshojo #henyathegenius #vtuber,2024-10-09T13:00:39Z,27955,4125,101
jua-3N_bWTI,I DON'T NEED THE ELDEN RING!!!,2024-09-24T13:00:49Z,46508,4968,218
Rvrv_gh84Fc,WE WERE BETRAYED! - Dark and Darker ft. Ironmouse & Zentreya,2024-09-17T14:00:23Z,34035,3463,141
4wqExlMSSNo,GOING VIRAL WITH @NinomaeInanis & @MoriCalliope,2024-08-30T14:00:04Z,41309,4312,137
wLbgwz6k1qc,"""This Will Be a Disaster...""",2024-08-26T14:25:59Z,31969,3528,114
b2vtuwwh6jc,POPPY PLAYTIME - CHAPTER 1,2024-08-15T14:00:29Z,18323,2328,90
xQcNUvSCdyk,LETS'S HAVE A FUN SUMMER TIME DAYO! feat @HarukaKaribu,2024-07-10T13:01:05Z,30692,1485,65
s4v91JCbYEE,Getting Hot in Space,2024-07-03T14:01:00Z,24585,2609,106
7SnY-6c9TKk,【歌ってみた】光／へにゃ・ざ・じーにあす,2024-06-23T02:16:33Z,121251,8430,411
1wjq3gwHNkI,【オリジナル曲】Umbrella／へにゃ・ざ・じーにあす & ハルカ・カリブ【踊ってみた】,2024-06-16T01:00:01Z,44737,5048,186
LDgiEMyC_6A,HENYA POKEDANCE DAYO  #memes  #vtuber,2024-06-13T13:00:19Z,85539,11824,148
qJY_LjTqBck,【歌ってみた】The Lazy Song／へにゃ・ざ・じーにあす (Cover),2024-06-08T20:51:42Z,81002,9274,336
Eb2cZ16tm1o,【歌ってみた】ディスコミュ星人／へにゃ・ざ・じーにあす(cover),2024-05-26T00:00:05Z,83627,7352,285
4mj-n8vsbpA,MY 3D DEBUT DAYO 3Dお披露目だよ！,2024-05-19T02:05:44Z,133718,11021,768
LHrBWHDCypo,Henya Tries to Explain Alan Wake Lore,2024-05-08T14:00:16Z,13294,1461,66
sZFjvN9pTLQ,Zoomer tries playing Goldeneye from 27 years ago,2024-04-14T14:00:42Z,36466,3498,286
knLgCcePnYE,Henya broke everything playing Ring Fit,2024-03-08T17:00:40Z,66093,4964,158
-MF0C80i0pA,Summoning waifus in Yohane The Parhelion - NUMAZU in the MIRAGE!,2024-02-29T22:00:00Z,14667,1359,55
zUe5nwt9ZZ0,HENYA YOUTOOZ IS NOW AVAILABLE!,2024-02-21T20:00:24Z,20478,2626,178
NrOQVylqmcU,Any last words?,2024-02-18T22:00:15Z,36917,3447,90
yoPBJbBFfNY,HENYA YOUTOOZ GIVEAWAY DAYO!,2024-02-14T07:14:16Z,11091,1643,107
MrIHvsGnyVE,NIKKE NEW YEAR EVENT AND GACHA DAYO!,2024-01-24T07:00:13Z,13121,1378,65
0VKwQZaOnXA,MORE TRAIN DAYO #mocopi #Shorts,2024-01-20T23:00:00Z,83279,8827,113
g1X0HlaD-t8,TRAIN DAYO #mocopi #Shorts,2024-01-20T01:00:19Z,31730,4879,95
daHUiFswyGo,Henya Spooky dayo #mocopi #Shorts,2024-01-19T13:30:27Z,17563,2354,59
fg2XsFSVW9k,PLAY NIKKE WITH HENYA DAYO!,2024-01-09T03:00:19Z,24148,1724,82
cuC3XAr0Drc,Henya realizes she is getting fired after this...,2024-01-05T14:00:26Z,70293,5007,165
FWv_5hroNZA,Henya's longest kettle scream to date...,2023-12-18T17:00:21Z,38692,3578,130
DlQwG2YScjQ,The scream that damaged Henya's ear,2023-11-24T13:00:08Z,37563,3326,135
6yFdZqTmGIA,When a viewer tries to watch Henya with their family,2023-11-10T13:00:09Z,42538,3526,127
g0VES2AK5f0,HENYA DANCE! #shorts #vtuber,2023-11-09T22:00:16Z,34787,3652,81
W59vuv8npNw,forest #shorts #vtuber,2023-11-09T00:44:10Z,34827,4590,96
uqCLLAlafAQ,work out dayo #mocopi #shorts #vtuber,2023-11-06T01:05:45Z,37381,4903,85
lTCg_B2lRBA,Henya finally loses it at twitch chat...,2023-10-20T13:00:45Z,68868,5320,164
Ar4n-LjF9HY,The chat that 𝙗𝙧𝙤𝙠𝙚 Henya,2023-09-29T12:30:05Z,143254,9327,197
lh9BlCjshUU,📛 強風オールバック / Henya the Genius (Cover) 📛,2023-09-24T03:00:08Z,365366,22376,637
2deQFII8I_E,"""Henya finally finds her first waifu but then...""",2023-09-23T17:11:35Z,72707,5347,157
lS-sCpWUcsQ,ILLEGAL SOCCER MOVES,2023-09-12T20:46:22Z,92832,11748,116
N4D6JdTCFc4,HENYA'S BIZARRE ADVENTURE,2023-09-12T05:54:39Z,333182,32183,240
SahA0_LuDKw,Henya's message 𝙨𝙝𝙤𝙘𝙠𝙚𝙙 everyone...,2023-09-08T13:00:19Z,49560,4017,128
dRXgOW1cNHg,WELCOME TO JAPAN!,2023-09-03T19:14:26Z,171643,18858,503
NrX6CBRb6gY,HOW TO HAVE MORE FRIENDS,2023-09-01T13:50:21Z,85052,12598,201
D9Q0JJ6Wjtk,MOM IS WATCHING!,2023-08-30T15:49:25Z,113458,14319,106
S35lX5vhMwc,EXERCISE IS HARD!,2023-08-28T06:32:40Z,26164,4863,71
IKKxP-2wx3Q,CLEAN UP ON ISLE HENYA!,2023-08-23T23:16:45Z,21069,2816,32
5x_Vhe500qY,ZEN IS BANNED!,2023-08-22T21:17:07Z,342521,38741,274
F5ZdwrSRrQk,WRITE THAT DOWN!,2023-08-21T14:57:59Z,62001,9403,99
-9U9vqLo2GE,BOWLING BUDDIES,2023-08-20T06:39:20Z,73753,9064,36
Q3FeZw3Ru7A,Evil Genius VTuber shows her true power...,2023-08-17T13:00:17Z,41516,3684,133
DT3jrIESIL8,hi dayo #henya #vshojo #vtuber,2023-08-15T13:00:10Z,47611,9322,167
60BtAlp0T58,NO DISCORD ALLOWED!,2023-08-14T18:42:45Z,118536,17363,280
fwfAAY1vVCk,SPOILER ALERT!,2023-08-13T18:47:15Z,117784,12789,256
NKvUMic6UyI,WHO IS JEFF?,2023-08-12T17:16:08Z,125387,15351,196
QsNu9zmA2y0,"HELP ME, PAPANYA!",2023-08-11T07:12:51Z,34908,5028,96
oj_0qJ73_7k,OH WORM?,2023-08-10T12:22:29Z,32836,5275,68
c5dD28fl0dI,MARIO GALAXY IS SO EASY!,2023-08-04T04:07:58Z,31851,5268,72
22FqBW15zZA,I GOT MY REESE'S!,2023-08-03T05:15:44Z,59978,8823,135
OahjVNIliCw,Henya finally cracked after only 2 months since debut...,2023-08-01T13:00:30Z,316438,20080,512
7SYGRq2d2PE,WHERE ARE MY REESE'S?,2023-07-28T04:40:57Z,47326,7300,80
e1dfYilVrvI,I KNOW FRENCH!,2023-07-28T04:40:55Z,61191,9585,202
tZSU2yzObTw,ASMR PRACTICE,2023-07-23T14:33:25Z,19403,3165,59
HxOOBT2PBcw,Henya tortures Kson for 9 minutes straight,2023-07-22T13:00:25Z,61259,4033,78
eQn3_2FAX0o,AN UNFORTUNATE TYPO,2023-07-21T08:14:57Z,22333,3730,69
C6fzuS9TDp0,EASY ADDRESS HACK,2023-07-21T08:14:54Z,15806,2305,25
GRBTswmxuK8,Henya forgot who her own boss is and instantly regrets it...,2023-07-15T13:00:10Z,42946,3503,101
2Yct-6SrZIM,Henya makes Ina cry during their collab...,2023-07-08T12:00:10Z,167154,11005,198
j5eqQaZ7QD4,AND I SAY...,2023-07-07T18:45:57Z,21460,3121,66
HdeosDSkN_Q,I'M GETTING REESE'S!?,2023-07-03T06:33:36Z,22171,3400,64
uX5XJ8bCc9M,STAFF IS AWAY?,2023-07-03T06:33:36Z,15650,3014,68
eO-w-vNlqeA,AT LEAST I DIDN'T FALL!,2023-06-25T05:08:08Z,24957,3609,96
JNI7ANvEEYg,I'M AN ASMR EXPERT,2023-06-25T05:08:06Z,14803,2586,57
DEh_O0T6qrs,THIS JOB IS ILLEGAL?,2023-06-21T17:50:40Z,19237,3110,144
E9jHdqln0co,THE TRUTH ABOUT OHIO,2023-06-21T17:50:38Z,17227,2642,53
fitzOHgW_Cc,DON'T GOOGLE IT HENYA!,2023-06-20T11:00:07Z,76456,6110,201
n9gJicIBUQk,NOT SAFE FOR WORK?,2023-06-18T19:43:30Z,16826,2562,45
pwQwF4OsQL8,MY ROOMMATE IS WATCHING!,2023-06-18T19:38:48Z,15062,2677,24
6TrKHfnKE7U,MY FIRST ASMR,2023-06-15T08:59:07Z,15618,2589,93
Td24yy95VJM,AWKWARD SKYRIM MOMENTS,2023-06-11T04:00:13Z,25187,4293,119
5pR4b7cSGVI,"BIG YABAI, INA!",2023-06-10T06:49:47Z,21894,3564,67
zIGjBx_Yb1o,DEMON MOMMY?!,2023-06-09T08:52:40Z,13763,2183,26
ZmmQRZxx9ac,MY ROOMMATE IS A SAVAGE!,2023-06-08T04:00:13Z,14548,2414,38
0Oj12aWu5kU,GREMLIN MODE,2023-06-07T18:37:40Z,19230,3799,89
trgmg8XFCl4,WHO IS THIS?,2023-06-06T22:00:27Z,11598,1703,0
Q5V5PN5OWek,HENYA LOSES IT ON ASHLEY!,2023-06-03T02:24:52Z,92416,7581,250
fCo86N9LVs4,HOW TO RAISE A YOSHI,2023-06-02T02:47:49Z,96148,12871,131
H1pW4b5HBqY,WHO STOLE MY YOGURT?,2023-06-01T04:00:08Z,30596,4521,93
ZjZ-tl41bCI,YOSHI WILL REMEMBER THAT,2023-05-31T04:00:17Z,24972,4092,40
ETg1ztsf2MA,I'M A HEAVY SLEEPER,2023-05-31T04:00:07Z,67254,10242,100
7-EEWfrZcxg,"COMPANION CUBE, MY BELOVED",2023-05-30T04:00:03Z,76052,10622,158
wR7K8-ftCvw,PRINCESS PEACH PROBLEM,2023-05-29T04:00:22Z,20267,3713,51
IW0A0vYGv1s,THINKING WITH PORTALS!,2023-05-28T04:00:07Z,27911,5134,97
th0ithlEkXY,RTX ON?,2023-05-27T07:42:52Z,55491,10543,170
iVVBpcBWXn0,PERFECTLY CUT SCREAM,2023-05-25T07:50:23Z,14811,2259,20
8Z_e2E-LVnU,MISHEARING SPANISH,2023-05-25T07:49:37Z,24484,4144,57
GuN7joZc-r4,WHO NEEDS A WATCH WHEN YOU HAVE THIS,2023-05-25T07:47:03Z,38335,7274,83
AozfPDjcNEs,I WILL BE YOUR YOSHI DAYO,2023-05-24T09:40:57Z,50189,10728,125
OdfkVCP7Bwk,MOST ODD JAPANESE COMMERCIAL,2023-05-24T09:39:45Z,40255,8459,141
RLT4JiIYhGA,HARUKA IS THAT YOU,2023-05-24T09:31:04Z,12275,2385,24
ogjWIp6C4Ls,HERE'S HENYA,2023-05-24T09:31:02Z,15228,3374,30
h1AMmk9vPl0,NOT THE YOSHI,2023-05-24T08:33:17Z,33644,7406,70
qaY8XxNkrgs,GENIUS VTUBER SOLVES RUBIX CUBE,2023-05-23T23:00:17Z,30444,7137,109
ALSbR4FLDMY,【📛DEBUT 初配信】Henya the Genius 【VShojo】,2023-05-14T05:49:05Z,400501,29819,2936
rVMS48hKNvE,【EN】Henya The Genius 【Vshojo】,2023-05-11T06:35:36Z,156977,8642,439
vcgoqO0Dxu8,【JP】へにゃ・ざ・じーにあす【Vshojo】,2023-05-11T06:32:35Z,61959,2837,90
