id,title,publishedAt,viewCount,likeCount,commentCount
HGmQYKhClD8,𝙊𝙤𝙥𝙨𝙞𝙚... Henya are you okay?,2023-12-20T19:59:09Z,39072,5797,62
PFCYN76CwCs,My new form! #debut,2023-12-19T19:15:00Z,13524,2309,78
Sfo0fg6_4tA,Zen tries to name EVERY Europe country...,2023-12-18T21:00:11Z,89194,5546,278
7O_qb5G6ve0,I'm eating a booty...,2023-12-18T19:00:03Z,25372,4038,38
PQw58NCUORY,Is it a fire exit?,2023-12-16T20:28:48Z,32689,4275,28
bkAL42xoK1s,Matara finally lost it at Zen...,2023-12-14T23:00:21Z,64544,5032,83
2ljC6TYi_CA,I fell for this trick...,2023-12-14T19:39:38Z,45547,5933,50
3VO8aZODix4,Zen's most realistic 3D model broke everyone...,2023-12-11T21:00:03Z,281188,20241,580
SVz7Vte4OjQ,How many games do you think Geega hasn't finished?,2023-12-09T17:15:01Z,20722,2639,23
hh60dch8ybY,I didn't mean that!,2023-12-08T17:00:36Z,18882,2439,22
y-WCr-HQprM,The physics are amazing...,2023-12-07T17:07:06Z,25458,4059,37
4bGoBOIEKHk,"this is how you break 10,000 chatters...",2023-12-04T21:00:04Z,68569,6869,140
6kP8W2xJGL4,To infinity and beyond...,2023-12-04T17:00:05Z,17032,2837,40
y9Mz6GoB8bA,Never trust in Lethal Company...,2023-11-30T21:22:41Z,33483,4094,51
zhCSRDZKZgI,A SUPER RANDOM VIDEO,2023-11-29T17:22:46Z,58441,8017,301
JGugKnVkwno,I just discovered this,2023-11-28T21:32:48Z,33842,4976,70
amvV3l6xSCg,My face when...,2023-11-27T20:24:39Z,26833,4053,44
NN0iaPwin64,FACE MY FEARS - Zentreya Cover [ ENGLISH ],2023-11-26T19:00:09Z,209562,11566,358
N00X2pZkijo,Whats that sound?,2023-11-25T21:34:18Z,20637,2891,24
fDzpES3jKEs,GET READY FOR THIS 🔥,2023-11-24T18:10:15Z,62460,5475,191
WQ9TUKue6bY,Great views for today!,2023-11-22T20:54:57Z,27074,4853,76
Y93DdV_LCv0,NEVER TRUST ZEN,2023-11-20T22:00:33Z,58334,5168,133
lqVwQHXvzqM,Giri tries to 𝙧𝙞𝙯𝙯 𝙢𝙚...,2023-11-16T16:45:03Z,21806,2705,26
bov1Nf911NU,The game's dev joins my stream...😨,2023-11-15T18:15:01Z,16801,2635,26
aviP3gB5VPg,𝗜 𝗮𝗰𝗰𝗶𝗱𝗲𝗻𝘁𝗹𝘆 𝗰𝗮𝗹𝗹𝗲𝗱 𝗼𝘂𝘁 𝗮 𝗴𝗮𝗺𝗲 𝗱𝗲𝘃,2023-11-13T22:00:05Z,69909,5421,79
3DQsARKL4Qo,𝙃𝙀𝙉𝙔𝘼𝘼𝘼𝘼𝘼𝘼!,2023-11-13T18:15:00Z,23850,3981,58
0fgOAX8YCoo,Mouse falling with style✨,2023-11-12T17:09:20Z,34808,5431,47
15mQp_b1Vms,Important 🔥 Announcement,2023-11-10T22:17:50Z,25130,2226,197
xzqE-S3jcmM,They need to try harder!,2023-11-10T16:31:35Z,35096,5147,45
Gcz22ofcxLA,Where is my face?,2023-11-09T21:53:46Z,17786,2903,53
Pd0M6VlSTkg,Zen finally broke Henya...,2023-11-08T23:00:23Z,114133,7591,149
k3BQUv39xQo,LOOK CLOSER....,2023-11-08T00:15:20Z,57495,7530,230
CoDYFxen7oY,I can't take that seriously!,2023-11-06T19:54:59Z,16326,3079,40
P1uwMc6sS7s,Didn't last 5 minutes,2023-11-04T18:58:46Z,22199,3925,80
0b6_tI5u1dI,Zen and Geega realize their age difference in this scenario...,2023-11-03T23:28:34Z,436819,21119,340
YTrdCqb0EUw,Adios chat! #vshojo #vtuber,2023-11-03T21:21:19Z,17272,2730,29
vsR1RqxplbI,Suck a-,2023-11-01T21:14:09Z,23900,4027,50
w_IaBxeALNM,I get my revenge #vshojo #vtuber,2023-11-01T21:00:29Z,16066,2764,59
lWmJ0UZ8U6g,Zen finally HIT THE GYM...,2023-10-30T21:00:33Z,46697,5878,170
q6PjSPncYpw,Hit me with it,2023-10-30T21:00:22Z,18387,3192,34
IuR0RcfZ0iQ,I already have Melons,2023-10-30T20:02:53Z,15435,2461,23
xQVMUaho9JU,My Haruka impression,2023-10-27T21:00:36Z,32821,4813,34
mhPIPyGju0w,I FOUGHT ONIGIRI USING ONLY CHAT POLLS,2023-10-26T19:00:22Z,58651,4675,130
QgB0PmpdfO8,I GOT NEWS FOR YOU + VSHOJO COLLAB ( ITS A ZEN STREAM! ),2023-10-24T04:29:55Z,43907,3870,34
8N4ADBiKvh0,NEW 3D/4K CYBER ZENTREYA MODEL DEBUT!,2023-10-24T02:47:34Z,0,1,0
HpUAIle89io,NPC moonwalking-,2023-10-22T20:15:00Z,15071,2197,29
Sk5laIQ44ns,HARUKA BROKE ZEN WITH THIS…,2023-10-22T20:07:55Z,109448,7417,186
F3rPHjNFTd8,Spooky toilet,2023-10-20T20:10:27Z,15005,2538,50
kaaj_pG0Eig,FIGHTING MY INNER DEMONS,2023-10-17T22:29:58Z,34480,3505,83
UMts2zYg0zE,"Woof, woof...",2023-10-17T21:41:30Z,24750,4302,63
eUMZKecpOtc,Those combos are insane!,2023-10-13T19:55:01Z,16594,2585,28
2Cm8vTOSe_c,Zen looks like Silver...,2023-10-12T20:15:00Z,28440,4459,84
rYl39VdJhAE,Chat compares Zen's size and hers...,2023-10-11T21:22:44Z,166043,9924,118
Q4p74Cte6y8,Are you here?,2023-10-10T21:57:30Z,18561,2392,23
xxByVQSw0VE,Drop the cheese!,2023-10-09T19:33:23Z,20158,3076,36
r04LmH9_t1Q,Somehow they got even BIGGER...,2023-10-07T19:24:45Z,78805,8507,131
hS6gevwEow4,First impression of Kuro,2023-10-05T18:46:07Z,20600,2840,37
OE-Tyh5AJFY,Zen finally calls out CDawgVA...,2023-10-03T21:00:10Z,73500,4924,77
cLCBMX6eonw,I licked my own s----!,2023-10-03T19:14:24Z,23318,2969,35
ZGN5RSwom_E,Nice sweater!,2023-10-02T22:16:04Z,21800,3590,45
nYj84_u-_Nc,I'm a menace,2023-10-01T19:16:14Z,54031,8684,61
npA4WnQUi6A,ITS THAT TIME OF THE YEAR....,2023-09-30T17:15:19Z,39486,4174,131
tGwGpVpvdH8,I lost my head!,2023-09-28T22:37:18Z,20841,3049,65
VhhAoP2Y-VU,A QUICK QUESTION FOR YOU...,2023-09-27T21:18:21Z,79714,10003,448
XkzdCycDxwU,Wait... they're harmless,2023-09-26T21:28:33Z,18742,2973,39
UEnM6qN3P-E,Zen's body tracking at 𝙁𝙐𝙇𝙇 capacity...,2023-09-25T22:48:24Z,301245,20601,313
cigXRzdLBjc,I can move my feet!,2023-09-25T19:00:15Z,19732,2440,51
z4SdaOXEcEg,You get a hug,2023-09-23T19:15:02Z,41359,8175,150
JKfuL65BkbQ,I Really Want To Stay At Your House - COVER Ver. ZENTREYA,2023-09-22T18:00:08Z,701771,35278,1327
0BaPvLgsapY,Losing vs old guy on Roblox,2023-09-21T18:15:00Z,21119,3055,50
r7gW5isX3Pk,I GOT A QUICK ANNOUNCEMENT FOR YA!,2023-09-20T20:01:39Z,91494,9944,272
_cgp6x03N1s,I'm not a granny!,2023-09-19T20:45:02Z,27662,4554,59
zq4GhFnu42E,SO MY MOST EMBARASSING MOMENT WAS...,2023-09-18T21:00:23Z,62026,5156,167
ONlqbO42ng0,SOMETHING HUGE IS HAPPENING AND ITS NOT MY BO-,2023-09-15T21:30:42Z,70661,7426,324
UOROkY13NEU,THIS IS JUST A SMALL MESSAGE!,2023-09-13T21:27:20Z,242421,21771,748
lKlggX86YP0,Zen's Wide Mouth - Best of Zentreya,2023-09-11T20:00:21Z,81582,7668,113
AazCFccbIJc,Summoning a spirit-,2023-09-10T19:15:00Z,68200,8538,39
3iWo3ENKJj8,What are you looking at,2023-09-10T02:00:01Z,39250,6008,90
kopD0UHlbvA,It's so adorable...,2023-09-09T17:15:01Z,23396,3643,37
zTq9ka5ntds,A Kiss,2023-09-09T02:00:23Z,27290,4052,114
8QoyIObL_DE,"A QUICK MESSAGE FOR YOU, SORT OF...",2023-09-08T19:44:01Z,132084,15252,522
9t_doiaDxuE,Not into that,2023-09-08T10:00:15Z,16801,2471,17
4KhR0cocOGE,Staring at alien b-tt,2023-09-05T20:15:00Z,19700,2446,32
x70YEyQQA30,Armored Core looking sus,2023-09-03T00:02:24Z,29435,3986,32
NUzuSAS4lPA,Zentreya vs Evil Neuro-sama,2023-08-31T18:00:09Z,150631,9103,299
Du4E89FjO1U,Caught in the ACT,2023-08-26T19:15:00Z,24669,2360,18
Kw3euOvPhmM,"""This is Awkward..."" - GMOD PROP HUNT",2023-08-26T00:00:16Z,57626,4252,80
p-IdmFSkS1M,Im really good at-,2023-08-25T15:00:45Z,21890,2868,37
mgrvFU5GrBQ,I got distracted...,2023-08-24T15:45:01Z,18882,2744,30
K-eekKC4Jmg,I'm Henya and I'm stinky!,2023-08-23T20:15:01Z,23917,3144,32
UfBozQP9M-g,3D UPDATE DEBUT,2023-08-23T00:02:08Z,113246,11207,243
BrG7nb1cMJI,We've been in a loop,2023-08-22T20:15:01Z,22182,2858,36
D9xEmPxfQQU,Look at this cake,2023-08-20T18:15:02Z,34390,5397,98
bor69666nkA,I finally pass this game!,2023-08-18T19:15:02Z,23038,3027,24
X-UMGV1EGwo,Needed a Nap #vshojo #vtuber #envtubers,2023-08-18T01:00:10Z,17289,2014,16
cbXvbqlW0gw,You're Trapped here with Me,2023-08-16T21:00:16Z,76165,6463,125
ONhXCz8-31E,The Rizz Queen #vshojo  #vtuber #envtubers,2023-08-16T19:15:00Z,20942,2640,24
UPi2_cBqPoo,New Jump Technique #vshojo #vtuber #envtubers,2023-08-16T01:00:10Z,25128,2774,29
x0kTDzsbebg,How do we get in?  #vshojo #vtuber #envtubers,2023-08-15T19:15:04Z,20438,2527,10
b3jeSX1VHfc,IT'S NOT A PHASE,2023-08-13T18:00:14Z,94555,8823,175
iqb6smGI6p8,Reach for a Women #vshojo #vtuber #envtubers,2023-08-13T01:30:15Z,21717,3302,43
KxtMDgVg81A,The TREMENDOUS luck!,2023-08-11T20:45:00Z,17263,2533,32
yH5hwHylZts,POV you get hit by Zen,2023-08-11T01:00:32Z,64700,10430,115
iV3CcupTwpU,Break test... | Zentreya,2023-08-09T20:00:09Z,16742,2537,27
ZsIXcKld1_0,Everything is Fine,2023-08-09T01:00:25Z,17613,2927,43
lu2u66YPzJA,When Zen tries to end stream,2023-08-07T01:00:15Z,20435,3479,27
Zc7L46hHfig,Complaining about what,2023-08-06T02:00:15Z,24390,3863,24
tajXweVRw-w,PAY FOR YOUR SINS - Gmod Death Run,2023-08-05T18:45:02Z,47860,3617,81
siwAknh6Ksc,Eating My Friends in The Isle,2023-08-02T00:00:22Z,55000,4418,89
mSRhr4mECTM,THAT ONE FRIEND...,2023-07-31T00:16:39Z,45662,5663,144
DHOLmCSeGlg,Zentreya reacts to shower scene...  #vshojo #vtuber,2023-07-29T17:10:34Z,21935,2858,35
qhhH7I2cGug,Zentreya's 3D Malfunction,2023-07-27T18:30:58Z,158187,14479,277
JwMa-NqEbHE,I lost seeing this new Mech AC6 | Armored Core IV #vshojo #vtuber,2023-07-26T16:52:51Z,28074,2750,34
EkYMr8_alko,"Caution, wet floor! | Zentreya",2023-07-24T14:45:00Z,14120,2038,23
Ogki3G6ijLE,Zen is Wendy's girl,2023-07-23T14:00:13Z,18605,3239,46
8XP149KuLd4,Press CTRL+W | Zentreya,2023-07-21T16:02:31Z,32963,3465,53
nois2Gv2ab0,Zen Shoot Off Againts Chat #vtuber #vshojo,2023-07-21T03:15:02Z,44646,5512,40
-iszEAC2iZg,Did I Hurt Your Feelings?,2023-07-17T22:30:00Z,53173,4530,89
r1FTYIPwY40,Your honor... | Zentreya,2023-07-17T19:00:31Z,18941,2898,34
xQM22zqdqOM,Big pepega moment | Zentreya,2023-07-15T19:21:35Z,14522,2181,24
-whxzJF-hpI,Zen's IRL Anime Expo Tour,2023-07-13T19:00:00Z,84405,5516,97
F-h99NMwhT4,How does this look? | Zentreya,2023-07-12T18:48:01Z,19571,3000,48
nN_36jDqR0E,Would You Like to Go on a Date with Me? | Zentreya,2023-07-10T22:33:12Z,21216,4348,257
EqPdsrRC7Ic,They're Not Getting Bigger... - Best of Zentreya,2023-07-10T00:02:04Z,175303,11742,149
uWejnTRF4T4,Zentreya Goes Farming,2023-07-05T23:00:31Z,50988,4858,128
yk4gYxWzTt4,TEXAS ZENTREYA,2023-07-04T18:31:00Z,58750,6224,176
coB7DQG1mBs,You saw me moa... last night | Zentreya,2023-07-03T19:15:01Z,20148,3045,37
OJa_1Oe9Gqs,I'm a furry! | Zentreya,2023-07-01T19:22:26Z,31339,4444,110
QfeTvPAF0Ms,NO PANTS DAY!,2023-06-29T21:00:22Z,67810,7045,155
H8XEg87TdS8,Zentreya Attempts ONLY UP!,2023-06-27T17:00:06Z,24005,2570,59
zDzLbCOks1Q,I can't believe I'm doing this... | Zentreya,2023-06-26T19:15:01Z,36073,4846,70
68MoMcSJNgc,Take off your pants...! | Zentreya,2023-06-23T18:42:59Z,23384,3492,43
rr0iUk1DeH8,"""Your Taste is Delicious..."" - Best of Zentreya",2023-06-22T22:30:08Z,56655,4717,77
CJI29-NBBuk,Do I have a crazy face? | Zentreya #shorts,2023-06-22T18:50:44Z,24870,3579,99
TjmCpVjICFY,"Woof, woof! | Zentreya barking",2023-06-19T17:42:20Z,18730,2508,45
7Y_HPtXOehc,I GOT A SNEAK PEAK AT ARMORED CORE 6,2023-06-14T15:00:05Z,46771,4207,212
-L8p0_-YZQU,WHEN YOUR FRIENDS SEE CAT EARS ON YOU...,2023-06-10T22:42:49Z,99702,11190,181
6yJdXlOFWiw,I am 100% Hispanic! | Zentreya,2023-06-10T16:36:22Z,93381,10049,167
jnhpKyWGDn4,This right here is for you... | Zentreya,2023-06-08T19:47:58Z,19868,2465,45
oUg0jCz1XGE,I tried playing charades with my friends...,2023-06-08T17:00:14Z,67963,5199,103
ccq_bZkiH-8,Instant karma | Zentreya,2023-06-06T19:15:35Z,21067,2737,23
DiYm1vzyhPE,You have caught me! | Zentreya,2023-06-04T17:45:01Z,15264,1836,22
Gt5wTuxSmXQ,VTubers Escape The Backrooms,2023-06-02T19:00:11Z,46583,3780,59
cm1G3pHJjuI,The New Zentreya,2023-05-28T21:00:12Z,68397,6840,220
Z8TgJWmyHqQ,AM I EVIL?,2023-05-25T23:15:00Z,63052,5489,210
4bLtJp9NoPc,I Made Neuro-Sama Leave...,2023-05-19T22:00:07Z,117167,9126,181
YCppmpQIoeE,ZENTREYA YOUTOOZ GIVEAWAY!,2023-05-18T19:00:24Z,13245,1514,74
sqj8gX75P-8,Stop Taking Me Out Of Context!,2023-05-16T19:00:21Z,216591,13112,206
6ROqicHivZg,"""Your Tail Is Getting Fat""",2023-05-12T20:00:02Z,170731,14614,202
2TwVNMt-cK4,Zentreya's lost model,2023-05-05T23:00:01Z,62001,6335,148
gINzJyzq1tY,Zentreya reacts to Armored Core VI Gameplay Trailer,2023-05-02T20:00:09Z,76402,5141,234
vy0IMEq0RNQ,The Misadventures of Chat ft. @GEEGA & @onigirien,2023-04-30T20:00:25Z,67823,5663,159
-4AcYxSgt98,Zen makes Neurosama leave...,2023-04-29T18:10:56Z,53593,6286,37
s1SsLVz6tG4,Could you do me a favor...?,2023-04-25T18:00:19Z,57564,5417,116
p8TeXKjAuhs,I like mine. 😈#reaction #facts #demon,2023-04-20T21:00:32Z,26140,3359,75
szcMvi7uJB4,"THAT'S IMPRESSIVE!! - YOU SMILE, YOU LOSE MONEY / ZENTREYA REACTS",2023-04-19T21:00:31Z,56863,5594,128
01nGYmtJsWA,Don't cancel me...,2023-04-14T16:00:00Z,60998,5836,167
Bl7WyZwyA2M,MY MIRKO COSPLAY ( VTUBER STYLE ),2023-04-12T17:30:01Z,48798,6242,215
8A_eJ5zXnco,The best outfit I've ever had,2023-04-06T20:00:03Z,55458,5197,144
-wa76hPkmmI,VTUBER HOUSE TOUR,2023-04-02T18:00:00Z,51035,3968,105
6sSNjfMaBOg,They're part of my body!,2023-03-25T20:00:01Z,60786,7182,164
vQwErzJdidc,"WHEN YOU HEAR CARAMELLDANSEN, RUN OR ELSE...",2023-03-22T19:36:45Z,112450,15685,381
p0mrncY19hQ,You guys are weird...,2023-03-20T20:04:18Z,49378,4507,109
NN5aujeBe8Q,Zen out of context,2023-03-19T12:00:20Z,79001,9873,138
iNwBlzD1yZ8,POV: Zen chokes you,2023-03-18T19:00:16Z,27844,4319,121
XnAd5KvKYNE,The dragon is back,2023-03-18T18:00:12Z,31576,4414,60
yrBPjmuxQnM,Based tattoo,2023-03-16T03:00:25Z,33524,4264,45
3kQCfqzeKYQ,Wanna play some Apex??,2023-03-15T16:00:02Z,39827,5586,43
VNJjryVF7Vw,City of Regina ft. @HarukaKaribu  & @GEEGA,2023-03-15T05:00:10Z,31223,3211,53
Gq6VckXDg6Y,State of the art technology,2023-03-14T13:00:17Z,27471,3677,46
nAe4IfX9eBk,"""I can't hide them!""",2023-03-14T06:00:27Z,32517,5321,62
GcmgbbszGmc,Chat gets intimate with a demon,2023-03-13T19:00:25Z,19116,2459,22
E_Io0pfdx6o,Getting too intimate with demons...,2023-03-12T22:00:06Z,76858,7332,285
gYSDKw8Nrm8,Please don't leave,2023-03-08T20:30:02Z,72077,6128,140
v4qcrNlYfgM,There's only one way this ends...,2023-03-07T20:30:05Z,46408,4682,89
DfYO37f8vmI,POV: A VTUBER FINDS YOU,2023-03-06T02:04:30Z,57273,8310,416
itY5n3eb5gk,Zen lets her emotions out...,2023-03-02T23:15:01Z,76030,6245,140
pbgee8KJhxU,Zentreya plushie available now!,2023-03-02T00:00:21Z,26497,3536,75
-dznZGsFGPY,THE DRAGON IS BACK,2023-02-28T22:15:00Z,117997,12356,394
7pCJq2AMHUY,DRAGON ZEN COMES HOME TO TWITCH,2023-02-24T20:18:47Z,66766,6637,278
VkiOvlZMxCM,WHEN YOU MEET YOUR PARALLEL UNIVERSE SELF FINALLY,2023-02-21T18:28:46Z,63723,7947,308
uD7k3TrWMA4,ZENTREYA'S LOVE ADVICE,2023-02-20T23:31:09Z,54250,5302,135
jbIIG3zssCI,This looks familiar...,2023-02-18T23:00:31Z,37490,5988,57
MDdNj1nS3UQ,Iconic Jedi ritual,2023-02-17T20:00:07Z,26542,3310,23
0aQi7EJ7BYU,This was a mistake...,2023-02-16T21:00:01Z,63163,5899,138
wsHa74qJFLI,LOOKING FOR A MAID?,2023-02-15T23:14:32Z,34569,5949,222
bWmBRKJI1Ro,this went horribly wrong... - GUILDS & GECKOS,2023-02-12T22:00:11Z,80093,7832,248
W44UTWlzgW4,Zen's brain lag,2023-02-11T22:00:09Z,47243,4314,84
8SyoVgdiDL0,LOOK AT THIS VIDEO TO BE BOOPED,2023-02-10T20:11:11Z,84224,16839,251
zbU_r0pWM8g,DON'T TELL ANYONE I DID THIS- Wait...,2023-02-09T00:49:11Z,62826,8082,268
RoZotq4zcIA,Zen cooks,2023-02-07T05:00:18Z,66626,9952,113
kubDo6pbHVM,"""What's that face I just did?""",2023-02-05T20:00:13Z,99041,9272,141
AghMvNDqxrw,No context...,2023-02-03T11:00:10Z,32607,4891,88
IAgoB4rmvzM,I'M APPROACHING YOUR LOCATION,2023-02-01T19:00:12Z,52530,4712,102
K11PDV3Yo7A,Welcome to the Bar,2023-01-31T19:00:07Z,50700,5112,139
Ekc8_HRwPy4,LET ME BREAK IT DOWN FOR YOU...,2023-01-30T00:30:07Z,206051,14024,399
Ad5RXGFrIII,Chat's next move...,2023-01-29T20:00:03Z,138956,17487,160
4FHbV56JAEE,I am protecting you,2023-01-27T14:00:01Z,37570,5042,127
0SxD9tVQCyI,Getting fooled ft. @GEEGA,2023-01-27T05:55:25Z,242622,30332,105
BU8ycs8T83g,Zentreya's Road Trip!,2023-01-26T03:15:00Z,179108,12513,289
XKFNGGoFUd8,Showing off my feet,2023-01-20T01:07:38Z,66411,5350,153
VQeIsF9yjeM,YOU'RE GOING TO HELL FOR THIS,2023-01-15T23:20:00Z,53689,4670,118
G2WKTjrkjwk,Zentreya First Youtube Stream of 2023,2023-01-15T00:39:59Z,69544,6949,68
1_zHrO2fgVA,I FREAKING LOVE PENGUINS,2023-01-11T19:00:00Z,77989,5780,188
kg7JWLv-w4k,BEST OF ZENTREYA 2022,2023-01-08T00:00:26Z,128335,8099,148
Q7-JvZYYNAc,Just drinking coffee,2023-01-07T03:29:26Z,30563,4579,68
M104XIf3YbY,A Valentine's Day teaser,2023-01-04T01:02:39Z,49811,4799,93
HFiDmLHl7JA,TOO OLD FOR VTUBING?,2023-01-01T02:31:37Z,254188,16627,330
CUns3y5rI7k,All chat wants for christmas...,2022-12-29T18:00:04Z,45428,5709,43
s-6TKltq1Xw,I'M DONE WITH CHRISTMAS,2022-12-25T21:00:15Z,79104,6325,117
N52neL3-D_E,I'm losing it...,2022-12-24T23:15:00Z,69334,6427,143
5Tx_o2N_2Fw,Here is all I want for Christmas...,2022-12-23T23:15:00Z,85527,8578,215
5aY_oVNfMyE,Chat fights back,2022-12-23T00:00:02Z,110745,15149,57
T1xPPizX2fA,I MADE THIS AT 3 AM.,2022-12-21T19:00:08Z,50270,5945,242
bBQlHQRhglY,The Trial of Zentreya,2022-12-20T19:00:10Z,313269,19741,398
avfisgUnGN8,A message to the haters,2022-12-20T02:15:00Z,99076,15159,209
aVz815w4LiI,Digital Dreams - Zentreya Official Background Music,2022-12-19T00:44:36Z,343826,14739,425
rsFq1YrsrrQ,YOU WILL BE JUDGED IF YOU WATCH THIS.,2022-12-17T22:00:15Z,50033,5847,293
l9IYVkxpvkI,WE DON'T TALK ABOUT IT,2022-12-16T22:15:01Z,78167,7082,189
2ST0owOhBzc,YOU WANTED THIS.,2022-12-15T22:00:01Z,96359,8966,160
YfcYr0wsnXQ,CHOO-CHOO CHARLES...,2022-12-14T23:01:45Z,77331,6850,135
1g8THeYG-FE,GET FUNKY! NOT THAT WAY BUT IN A FUNKY WAY.,2022-12-13T22:00:01Z,267863,18471,390
4qLEos4uGlE,My chat is being weird...,2022-12-12T21:00:02Z,106097,7903,170
VYOAr7S_wvw,DROP IT...,2022-12-11T01:02:09Z,502667,37163,766
MwscT-rskss,DON’T PLAY MARIO PARTY #short #crying #vtuber,2022-12-09T18:47:25Z,31600,3772,38
KXBrMfzfU0c,Are you intimidated?,2022-12-08T20:15:00Z,211609,19056,294
A4ZjB4Sz2lU,"""What could possibly go wrong?""",2022-12-07T23:30:01Z,67166,5029,84
ZvkurCkOpic,I know what you want,2022-12-06T09:00:25Z,33679,4351,66
DAed53K7qsQ,Would chat do this?,2022-12-05T09:00:05Z,35536,4718,65
ybCOyGVQk7w,"""EZ Clap""",2022-12-04T09:00:34Z,74775,9711,62
NOEKeV2ng_g,Important reminder from Zen,2022-12-03T09:00:09Z,22518,4202,131
ubyItwwIzJw,When November is over.,2022-12-02T18:15:04Z,102517,10635,237
HJitGCcwDqE,Zen tries to be intimidating...,2022-12-02T09:00:15Z,35714,4579,72
0p73Wxxs_-c,Smash or pass?,2022-12-01T11:00:00Z,27402,3076,35
zY08T-MYW9A,H̷͉͐E̴̮͋L̵̡̀P̴̳̎,2022-11-30T23:00:26Z,34206,4432,55
e4c2tX-WIBk,SHUT UP PLEASE,2022-11-29T18:30:24Z,89226,7349,181
PDZdHzhY5t8,WELL HELLO THERE...,2022-11-28T00:33:06Z,83753,9443,328
pWEHs85nzg4,WORST IGN REVIEWS,2022-11-26T22:00:16Z,88062,6417,229
I1m2bNxT7pE,What to do during a nuclear event,2022-11-25T20:30:00Z,42377,5898,86
Dzh5TvVIP9Q,Making my chat a streamer,2022-11-24T21:00:08Z,43892,4436,31
htLtZbolqCw,SMASH OR PASS,2022-11-23T21:15:02Z,77161,5755,245
zWIr6isUelo,SUPRISE....Sort of...,2022-11-22T18:35:37Z,64693,7954,157
KpaDPmlSHA8,Just passing through your recommended,2022-11-21T17:59:46Z,99112,16226,590
FBskMRgBrPM,SIMP FOR ME,2022-11-20T20:30:02Z,93501,8774,246
at7NYP5V9zE,Zen's rage ends up crashing the stream,2022-11-19T13:30:11Z,281426,24357,156
ctdhrD--d5E,When you finally beat the main villain after 6 seasons,2022-11-16T20:01:51Z,227872,19324,548
L2BZeSN48D0,"""I love my 6 inches""",2022-11-15T23:35:59Z,67340,6421,202
FgihQSKJizU,I tried sleeping on stream... (Horrible idea),2022-11-10T21:46:02Z,129707,9060,330
leNSxk4UyUs,"""Wanna see something...?""",2022-11-09T20:30:06Z,64995,5402,97
ybS7-29hPys,Explaining Froots stream issue..,2022-11-05T19:00:31Z,66439,5875,159
t57_wMKKZA0,The most wholesome Chat War,2022-11-03T02:00:22Z,54653,4404,158
3AwbrTWtiGg,DONT TRY THIS AT HOME,2022-10-27T22:30:02Z,52181,4770,104
Loi9g0ANlNI,I don't know what I'm doing...,2022-10-25T00:30:03Z,53726,4911,92
WTEvwUARPJg,Trying to not get a Darwin Reward...,2022-10-20T18:00:10Z,58354,5089,81
MiKfjh4zojM,My dignity is gone...,2022-10-18T00:00:10Z,206685,17461,356
jugIN-_0N08,Ruining your Childhood,2022-10-15T19:00:28Z,43513,3916,150
ah9QBMuGy1k,Zen has a realization #shorts #vtuber #memes,2022-10-13T12:51:03Z,38078,3337,77
Xm3hJtyW6QI,The MVP of Zaku II,2022-10-12T00:00:11Z,30951,3010,172
HxefNpsrfbw,I am good with balls #shorts #vtuber #memes,2022-10-11T13:43:57Z,55043,4988,55
nUwcIJ94t0M,He's back!,2022-10-08T21:30:06Z,80633,6450,118
2aapr0jX22I,I'm literally just wearing shorts...,2022-10-07T20:45:00Z,351777,25857,423
hPrK9nz2M14,WHEN OCTOBER HITS...,2022-10-05T20:18:16Z,50951,6337,174
7aRj-rsh60A,Let me get in there... - Best of Zentreya,2022-10-03T18:00:02Z,74647,5592,71
o51nYj42QLM,FIGHT ME,2022-10-01T18:00:17Z,103072,7519,200
aDcmt8Dk5uc,Wendy’s. #short #vtuber #vshojo,2022-09-28T21:43:03Z,31089,3127,24
jGiNpDMgJ78,Zentreya gets jumpscared watching scary videos,2022-09-25T22:00:30Z,102808,6250,78
A-Jc3hdQBk8,Zen's most Wholesome stream,2022-09-20T18:00:03Z,89955,7422,141
dOVf7Kjoev0,When chat asks for the Sad Cat Dance...,2022-09-18T19:12:41Z,530356,37768,443
qq6_emCN9qw,I CAN'T BELIEVE THIS JUST HAPPENED...,2022-09-18T00:30:09Z,55819,4763,72
VSd6KPiOUTo,"""Professional Ghost Hunters"" - ft. SeaNanners, Bruce & Haruka",2022-09-16T18:00:10Z,39176,3283,96
gftgoeMDPDs,Public restrooms suck. #vtuber #shorts #memes,2022-09-16T00:49:29Z,148934,13212,94
t4oOHCm8zjs,I'm addicted...,2022-09-15T01:00:10Z,52556,4184,75
mL-4WrA_rGI,Zentreya Luck #vtuber #vshojo #zentreya #shorts,2022-09-14T17:32:11Z,91206,8807,68
IuXlmpsHSVs,THEY ARE HERE... - VTuber Let's Play,2022-09-12T19:00:07Z,47880,4169,125
qWkQpKaPjEo,YLYL: Hot Sauce Wheel Of Pain,2022-09-10T23:00:15Z,121589,7613,233
ACaAqZD8SD0,Size checking my friends..,2022-09-08T20:00:02Z,50788,3595,54
KUKVFVgAA-g,I didn't know I could do this...,2022-09-07T18:00:11Z,142765,9378,166
VVGx_X77sNg,I'm losing my mind...,2022-09-05T21:00:12Z,125787,8324,206
93pRlgdlJn0,TWITCH CHAT CIVIL WAR,2022-09-04T20:32:06Z,37576,3585,126
d0ikR6jaQrQ,Surely nothing bad will happen... - PART 1 (VTuber Let's Play),2022-09-02T18:16:18Z,64686,5644,161
DAseFJ20x1c,We are NOT talking about that!,2022-09-02T00:00:06Z,176466,14335,226
bIPax8BCEJc,ESCAPE THE BACKROOMS...  PART 1 ( Vtuber Lets Play ),2022-09-01T01:58:43Z,81665,8509,486
lpEC1_VjS1w,This will get me cancelled...,2022-08-29T19:30:03Z,76622,6303,143
tSvIgolFFVY,WHEN THE SONG GOES HARD,2022-08-28T17:38:40Z,73685,7982,206
Znn5K8QBPgU,DON'T LOOK PLEASE!!,2022-08-27T00:09:08Z,60303,6550,178
RLq2FM1xC6E,Why are you calling me Daddy?,2022-08-24T18:00:15Z,82687,6746,121
KMrUu0VIpoU,HELLO THERE!,2022-08-18T17:17:24Z,107904,11736,555
I49B2ewEuEg,HALLOWEEN DESIGN SNEAK PEAK,2022-08-15T18:00:06Z,51078,4690,121
IaZo1oGbywI,"That's really gross, dude",2022-08-10T18:00:15Z,117034,9372,262
QOEtIY8a-NM,BURY THE LIGHT DEEEEEEEEEEEEEEEEEEEEEEEEEEEEEP WITHIN!!!!!!!!!!!,2022-08-09T16:57:27Z,334643,28941,539
ov6_R2oHxA8,3D IS HERE!,2022-08-05T18:00:19Z,190181,16389,306
Gy3gegBExZg,Want to see something really amazing...?,2022-08-04T18:33:26Z,70440,8414,380
jYDQ9V7Nqhk,Hi :),2022-08-02T22:41:50Z,136225,15888,502
W2xn2KAI6bA,My mods banned me...,2022-07-30T21:00:10Z,103466,7033,111
lxwT3eIxKV0,"""You have a Train Announcer voice""",2022-07-28T18:00:21Z,39529,3310,61
gdpKwcdeOII,3D IS BACK!,2022-07-27T17:21:18Z,39292,3553,134
UpFaQmqfzMk,Another uneducated swine...,2022-07-21T18:00:19Z,44390,3879,76
77IB-w1278Q,I'M SO CLOSE,2022-07-20T20:00:01Z,72568,4925,108
RnOC-vszKZQ,"""Keep your tongue in your mouth""",2022-07-14T18:00:08Z,200100,12863,144
c4ssGezEj_U,Eye Contact Practice with a Vtuber ( 4 Minutes ),2022-07-12T16:30:21Z,58162,5040,480
cOfZopbq8Sg,I'm in your walls...,2022-07-11T19:00:10Z,140730,10861,359
GsyjIsTzuiA,I tried playing this with Shylily...,2022-07-10T18:00:06Z,161759,11325,137
foAadsrHatY,"What is ""Soaking""?",2022-07-09T18:00:11Z,86553,6950,182
kCKsBua7F_k,Are they soft or hard...?,2022-06-30T20:00:09Z,452430,27958,368
XV0aKS_SgwM,The new gecko look,2022-06-29T20:00:12Z,44700,3789,71
nVWuZyh-gQQ,I am so confused...,2022-06-21T19:00:17Z,143569,10272,168
1fpOvab_zJA,Hi,2022-06-16T16:06:05Z,57474,6789,264
TzfzrYdLbig,"If I laugh, I lose money...",2022-06-15T17:00:27Z,217327,12011,181
ALqel5diB-Y,I challenged my chat to a game of chess...,2022-06-08T16:00:08Z,71554,5060,99
SzJ3nEHmvUk,Oh no...what have I done...,2022-06-03T16:20:09Z,89981,7551,160
zdstbdX0XHY,Wanna see something cool?...,2022-05-31T20:09:48Z,75721,7873,241
oiO7ghUyl3I,What is happening... - Zentreya Reacts to Unusual Memes,2022-05-29T19:17:37Z,128080,9222,152
iN56k8WNqdM,"So...basically, I'm Zen.",2022-05-25T17:13:03Z,252360,15952,463
-cW5gfEMpK8,Zentreya Official Song : BACK FROM THE DEAD,2022-05-21T15:41:48Z,229259,10701,252
eIaZjsGq1Lg,Project Zen Official VSHOJO Lore,2022-05-20T19:18:43Z,462192,36275,1850
otgEjICYayE,You wanna see something special?...,2022-05-18T20:18:59Z,160512,13970,603
zsK_4r-CaIY,See you there,2022-05-15T00:44:34Z,101909,6835,259
ZnHI72ttBmg,now we can play a fun little game... - Best of Zentreya,2022-05-11T19:30:09Z,72136,5153,95
V4VFwMnfv2Q,We don't talk about that here...,2022-05-08T17:13:39Z,79398,5465,137
vDoaZmN0hTE,I woke up in my dog's bed today...,2022-05-04T23:45:01Z,79805,6098,86
yZ75AMHws3Y,This is why I don't smile...,2022-04-30T20:56:34Z,97178,7885,250
e2_ozSbdsWM,Testing how lewd my chat is...,2022-04-25T00:21:58Z,76539,5959,110
Ty4Zw3j_Ilo,You'd like a sip of my drink?,2022-04-19T17:59:25Z,92613,6700,114
Sdy26JYHu3I,Do I sell my body fluids? ft. Shylily,2022-04-17T18:00:03Z,90845,6545,148
OCwxVLs5vc4,"""Punish me...?"" - Zentreya Out of Context #5",2022-04-12T17:31:37Z,57097,5065,124
hO1SCnNpbUk,I'M GOING TO DESTROY SHYLILY,2022-04-11T18:01:42Z,220204,14324,210
s-oPv77LpQg,You weren't supposed to see this...,2022-04-09T18:00:04Z,144640,10012,223
lsD2oNq25os,"So you're down bad, huh?",2022-04-04T18:00:12Z,98710,6953,119
FigXaRIplNc,"SUCK THE FEET - Human Fall Flat ft. Froot, Haruka, Silvervale & Veibae",2022-04-03T18:09:50Z,34728,2911,38
ez94EhjrozY,I hate it here...,2022-03-29T17:00:13Z,148307,9880,213
