id,title,publishedAt,viewCount,likeCount,commentCount
NHj7Aiyyob4,I Would NOT Recommend Doing That...,2025-12-13T16:00:40Z,8792,1486,67
2XjOlt4yhsQ,A Fan Made Me This AWESOME Model!,2025-12-13T00:30:03Z,15547,2205,76
4LQp3Do4exc,I Blame the Texas Education System,2025-12-12T16:00:08Z,19730,2165,26
P3q8CYYWNAc,He's Gonna Have a Nice Nap,2025-12-11T16:00:45Z,18103,1969,18
FcHTQBBnzcw,Matara’s Debut TERRFIED Me!,2025-12-11T00:30:17Z,28651,2984,80
sgmA2kZKvCY,God You're So Old,2025-12-10T16:01:36Z,54877,4678,60
1C0SIoqhpO4,How to Properly Power Scale,2025-12-09T16:00:08Z,30183,2904,38
JPZnGWyQizo,Zentreya Is OBSESSED with Shadow!,2025-12-09T00:30:19Z,15519,1657,83
U24tZUt5R9Y,I Should Have Seen That Coming...,2025-12-08T16:00:59Z,30036,2833,37
gAGDxamNQeU,That's a Nice View,2025-12-07T16:01:08Z,74865,5610,84
jJzre9yN1Vo,Zen's Annoyed Face,2025-12-06T16:01:16Z,90419,6860,100
PJuMcHt1izI,Zen's New Mascot Gives Her CUTENESS AGGRESSION!,2025-12-06T00:30:25Z,20028,2209,114
YP3X4Ph0hTg,Making Silly Faces,2025-12-05T16:01:06Z,851378,42306,574
dkQQpCQIU10,Was That Too Much?,2025-12-04T16:01:04Z,55027,5502,239
oOMcomERgMA,How Do You Explain What a Vtuber Is?,2025-12-04T00:30:47Z,13561,1750,133
ghaJRHJBIzc,I'm Good,2025-12-03T16:01:12Z,41013,3053,30
ZSP1ySm0AyE,"Hey Texas Rangers, Need a Vtuber?",2025-12-02T16:01:02Z,31888,2716,63
XaD5FvNpWvI,General Zen Wants YOU to Join the Army,2025-12-02T00:30:28Z,31338,4573,564
ZZuz-dCit1I,END THAT GUY RIGHT NOW,2025-12-01T16:00:54Z,39429,3802,31
BU_PADxToxI,Don't Be a Stranger,2025-11-30T16:00:18Z,32023,3646,34
DjlTQzolH5I,Is Matara Ok?,2025-11-29T16:00:20Z,94410,6174,66
cfFWheColdM,Zen Has a Freudian Slip,2025-11-28T16:01:12Z,32892,2639,32
l315xE-fbYU,We've Come to a Decision,2025-11-27T16:01:17Z,66468,7247,108
tIrLAolwt4k,8 YEARS ANNIVERSARY : GENERAL ZENTREYA ARRIVES! + A WHOLE LOT!,2025-11-27T01:57:59Z,58546,3992,99
jEi_XD7kv3k,An Anthem In Blood - A General Zentreya Original Score,2025-11-26T21:01:02Z,29419,4596,223
NJDD0IKz8Bg,Admit That I'm a Gamer,2025-11-26T16:00:38Z,46951,4903,118
Hr6Gfg7zvQ0,Zen Gives Chat An Existential Crisis,2025-11-26T00:30:14Z,32365,3454,220
ImjxIIBAjbE,Zentreya Pulled Something Off,2025-11-25T16:00:26Z,31835,3250,33
fn-20wt5jdM,RETURN.,2025-11-24T18:39:23Z,15444,2059,132
ZRPrNghAhAM,"I'm Just Tired, Man",2025-11-24T16:01:06Z,38441,4038,31
HkSaGWj1gMk,Zen Is Bing Chilling,2025-11-23T16:00:22Z,33991,2880,46
MO-c3mmSIpM,Trust Fall Fail,2025-11-22T16:00:39Z,42440,4444,58
8A7QEGmR49Y,This Horror Game Mimics Our Voices and Pretends to Be Us?!,2025-11-22T00:30:08Z,24693,2214,51
RXMFb8hSraE,Zentreya Is SO FLEXIBLE!,2025-11-21T16:00:55Z,66871,7042,116
gdcJ3e_gars,Need to Get Through NNN?,2025-11-20T16:01:11Z,43795,4540,121
DCxtEzjvG-o,Zen Has the ULTIMATE Crashout,2025-11-19T16:00:21Z,117892,9220,140
YwkYYl88BH8,ITS ONLY UP FROM HERE! CHAOTIC DAY! ( PEAK COLLAB LATER w FRIENDS! ),2025-11-19T00:06:35Z,17703,1522,16
lipAchGXZpw,Stop Paying Attention to the DVD Logo!,2025-11-18T16:01:19Z,40698,4064,56
vvmNNTOLMdg,It's Not Zen's Fault They're So Huge! - Best of Zentreya,2025-11-18T00:30:50Z,67818,6929,176
BiNYSbrMDUE,Zentreya Shows Off the New Legs,2025-11-17T16:00:15Z,46656,4578,77
N3G4BCKpVW8,Listen to Zen's New Model,2025-11-16T16:00:39Z,126107,9338,129
0XgzvWqujh4,Zentreya’s New 3D Model Has INSANE Detail and RTX!,2025-11-16T00:30:02Z,52257,6414,300
fX6GWXX-Wwg,Does Zentreya Sound Like WatchMojo?,2025-11-15T16:00:59Z,38681,3380,34
bWPNiXoai0k,NEW 3D/4K CYBER ZENTREYA MODEL DEBUT!,2025-11-15T01:09:11Z,87553,5373,49
rbbucI_Fd2s,Zen Confesses Her Love?!,2025-11-14T16:01:32Z,35756,3506,42
FzpdYEnuSrg,Zen Likes Raw Men,2025-11-13T16:00:34Z,33655,3749,56
5CnhQ3850HE,Zentreya Confesses Her Love for Matara!,2025-11-13T00:30:08Z,34163,4220,79
jK4T0Gw0pXI,This Is NOT Looking Good,2025-11-12T16:01:11Z,29403,2898,42
PMnkp1jW6WM,There Goes My Hero,2025-11-11T16:00:41Z,28783,2924,32
2ogUAqMDu88,Zen Loves Making Cotton SCREAM!,2025-11-11T00:30:04Z,23379,2302,71
nyOPvpHwyUQ,Everything Was NOT Fine,2025-11-10T16:01:18Z,25308,2519,34
7FR_i76mzlw,Zentreya Cannot Control Herself,2025-11-09T16:00:10Z,57018,5932,161
SBHjgzktYdg,Zen Accidentally SMACKS Herself IRL,2025-11-08T16:00:46Z,48634,4490,46
zmDjTpgDwE0,NO ONE IS SAFE! - Best of Doom 3,2025-11-08T00:31:02Z,13176,1571,71
dCB2BHKNSV0,YOUTUBES FIRST M&G LIVESTREAM!,2025-11-07T20:10:46Z,16435,1669,31
g2GnfJxOH9w,Zen Pulled the Wrong Lever!,2025-11-07T16:01:07Z,31716,2718,23
rAM6MI_3SGU,Zen Breaks Another Game,2025-11-06T16:01:24Z,64708,5862,68
GQoMmAeQRuU,I Have the WORST Timing with Scary Games...,2025-11-05T16:00:32Z,39069,3332,30
uXi8DlqdWi8,"It Was an Accident, I Swear",2025-11-04T16:01:26Z,38099,3551,49
W2Q2hxkflc0,Zen Has Tongue Physics,2025-11-03T16:00:49Z,38029,4449,112
uWfrN8tD8AI,Zentreya Has an UwU Voice?!,2025-11-02T16:01:22Z,106610,8748,206
_4Me6SdxyB8,Chat Helps with Zen's Promo,2025-11-01T15:01:06Z,31949,3320,32
wMFS7DKefwU,HAPPY HALLOWEEN! 🎃,2025-10-31T21:57:33Z,36644,3285,23
nmj4lzoa3vM,That's Actually Crazy,2025-10-31T15:01:45Z,31769,2525,28
phT1Z1xncDo,Exploding Chat with My Mind,2025-10-30T15:01:38Z,53075,4470,57
rNbivMG5cg8,I Made Everyone Go Deaf,2025-10-30T15:01:38Z,32730,3163,65
olI0BYjFJ8Q,Eaten by Zentreya?!,2025-10-29T15:01:37Z,55181,5539,176
81FxWEOf6uA,When Life Gives You Lemons,2025-10-28T15:00:26Z,108258,6257,91
JgJNpGqOpyk,"1 Bear vs 4 Vtubers, WHO WILL WIN?",2025-10-27T16:00:36Z,21560,2039,39
_EwO7ghyAzM,"Well, That's Embarrassing for Me",2025-10-27T15:01:10Z,27008,2586,20
Waq-pDa9bIQ,Mom Thinks I'm Stupid,2025-10-26T15:00:56Z,42030,3943,36
xW60mF4NpsA,ANOTHER YOUTUBE STREAM! CHAOS TIME,2025-10-25T23:11:03Z,29015,2857,21
AVvJNGtWTOU,It's Not My Fault,2025-10-25T15:00:14Z,193903,14740,307
3r4r3aDIAn0,MULTI-STREAM TIME! FIRST RUN! HELLO YOUTUBE!!,2025-10-24T23:26:47Z,36017,3922,35
E6VJFVGcLyQ,Zen and Matara Flirt IRL?! - TwitchCon 2025 Walk Around Day 1,2025-10-24T16:00:34Z,27287,2219,57
pdhe9HWZrFw,Where Did Zen Go?,2025-10-24T15:01:46Z,38463,2577,36
V6iIW70HPIw,I Put a Curse on my Chat,2025-10-23T15:01:01Z,57938,4334,63
456NijSFip8,This Developer Trolled Me,2025-10-22T15:00:08Z,36181,3049,34
RF_88EHJKws,Chat Made Me Say This,2025-10-21T15:00:48Z,43622,3374,35
LsvOpmgQiKA,Cotton Wants Zen to Do WHAT?! - Best of Zentreya,2025-10-20T16:00:38Z,45775,5063,105
LtCNsl1zSaY,Zen Got Caught Clip Farming,2025-10-20T15:00:35Z,32713,3014,31
3XQUNZLmgm0,You Need to Realize Something,2025-10-19T15:00:11Z,57088,5430,159
j7bSQwlK8kQ,The Physics On Zen's Model Are CRAZY!,2025-10-18T15:01:22Z,69538,6903,124
Y3lYAOekelY,I Watched All My Friends Turn into Monsters,2025-10-17T16:01:03Z,14089,1527,48
OF5H2rULYMM,Camila Hates Me,2025-10-17T15:00:57Z,101936,6680,90
cccIolITEwQ,Zen Is a Terrible Lifeguard,2025-10-16T15:01:11Z,35174,2608,26
aKzNYl7lo88,I Have a Condition,2025-10-15T15:00:02Z,57578,4207,40
PgGuKFViVlY,Does Jowol Have More Cake Than ME?!,2025-10-14T15:00:56Z,45398,4323,70
hsqpTEZWp3o,Zentreya LOSES HER MIND Playing R34 Higher or Lower!,2025-10-13T16:01:20Z,57857,4325,164
3ko9Atj9qVc,Don't Mess with Neuro,2025-10-13T15:00:07Z,39806,2756,25
cHW5pxsp64I,Your Kalimba Will Not Save You,2025-10-12T15:01:06Z,38701,3560,29
NjzfWcdgSPM,This Little Freaking Orca,2025-10-11T15:00:39Z,47714,4861,58
Sg2kEidHrDA,There's Nothing Wrong with Me,2025-10-10T15:00:53Z,46231,4998,113
vAKZPQ97iNs,Meet My German Boy,2025-10-09T15:01:48Z,33254,2695,32
K2ifqn-DvCo,Did You See It?,2025-10-08T15:00:26Z,31165,3254,59
sQehC92MyCs,Zentreya Is Your Dungeon Master! - New Outfit Debut Highlights,2025-10-07T16:01:25Z,19513,2387,106
Uwxl076zm9I,What Did She Say?!,2025-10-07T15:00:53Z,33953,3090,44
JNCelT8xpPI,When I Try to Tell a Story,2025-10-06T15:00:34Z,34006,3549,32
us0WEEB1UWI,That Is NOT Normal,2025-10-05T15:01:35Z,30370,2431,24
3mafZf82juY,Chat Cooked Up a New Roast,2025-10-04T15:00:07Z,54008,5217,64
gac5Esr-jH4,Zentreya Becomes a BUNNY GIRL?!,2025-10-03T16:01:17Z,21416,2410,96
itwewfCQJFk,Zen Feels Naked,2025-10-03T15:01:28Z,74120,7466,133
6eytmpNeIww,Dungeon Master Zentreya Rolls to Attack,2025-10-02T15:00:13Z,34956,3094,31
l4LNgvSvuBg,Zentreya Is Your Dungeon Master,2025-10-01T21:00:56Z,64328,8000,286
qUgfTSJ61_s,PLEASE MOMMY ZEN!,2025-10-01T15:01:38Z,28587,2380,43
ku-JID4_NmQ,Neuro HATES Zentreya for This,2025-09-30T15:01:28Z,37630,3283,31
NzBnG3CiZgo,We Got Into Trouble at Anime NYC 2025?!,2025-09-29T17:00:28Z,22384,1814,47
gQ6Yavo5Rl0,Neuro Destroyed Me,2025-09-29T15:01:14Z,90266,5983,88
xJK19V5LWcE,Jerk Responsibly,2025-09-28T15:01:37Z,39667,3469,60
fKvLQppIi5M,Zen Left Him Behind,2025-09-27T15:01:15Z,30439,2707,22
0jRT6kQXvXo,Zentreya Running a Waterpark Is ABSOLUTE CHAOS!,2025-09-26T16:00:06Z,11773,1280,52
nPrjn6LALi4,What Did I Miss?,2025-09-26T15:01:38Z,50173,3411,28
t0p8V_gUK8c,Did You Hear That?,2025-09-25T15:01:41Z,30404,2631,22
eyGi-_RrjsM,The Zentreya Waterpark Experience,2025-09-24T15:01:24Z,55493,4586,40
HDfaz49rRkY,Target Acquired,2025-09-23T15:00:25Z,91683,9332,107
kmv0InQTen8,Zentreya Debuts Her NEW Cyber Dragon Model!,2025-09-22T16:01:19Z,21752,2587,183
LReCnRnKlOI,Is Zen Cute...or EVIL?,2025-09-22T15:00:38Z,216440,16684,399
Sso-yODHwDY,What's Under Zen's Mask?,2025-09-21T15:00:49Z,180810,13591,151
1_vfCdGqK-s,Cyber Dragon Zentreya Looks Like a DIGIMON?!,2025-09-20T19:15:00Z,307481,24883,522
Z2I9smC0GT0,"Step One, then Step Two",2025-09-20T15:00:59Z,49264,4551,48
GOGDCxVN-SA,Zentreya Has EVEN MORE New TTS Voices?!,2025-09-19T17:00:26Z,30763,2499,93
Q1zt941Uhm0,Only Suffering Remains,2025-09-19T15:00:47Z,33873,2733,20
4nsm9c5P4rU,Is That What You Wanted?,2025-09-18T15:00:09Z,47853,4526,82
7zGzDSquj-E,Zen Got Flashbanged in Battlefield 6,2025-09-17T15:00:25Z,62036,3491,47
gVVWiVaDaLk,Zen Got Roasted by Mom,2025-09-16T23:15:03Z,49732,4669,51
gRH-maTIerA,I think...,2025-09-16T23:00:47Z,54434,3923,24
IA1sDQb0bwY,"Thanks, Cameraman!",2025-09-16T22:45:01Z,81756,7419,115
YLAIKREJ4LI,I Hate it Here,2025-09-16T15:01:07Z,35006,2602,23
I2dJ0zUttQs,Some of the Most VISCERAL Vtuber Screams - Zen & Friends Play PEAK!,2025-09-15T16:00:34Z,16197,1717,72
kR7T94PyZWs,They Are NOT Good,2025-09-15T15:01:19Z,25995,2172,20
nT1pnd8v_-Y,Zen Can Finally Scream,2025-09-14T15:01:21Z,95534,6951,69
0g5gStvhreE,That Went HORRIBLY Wrong,2025-09-13T15:00:03Z,37192,2723,30
dUZnKAX-gGU,Zentreya RUINS FRIENDSHIPS in Mario Party!,2025-09-12T16:01:13Z,23781,1877,78
OboMFiVdT2E,Zen Bullying Chat Again,2025-09-12T15:00:50Z,40598,3312,39
uHz6T89MYT4,Where Did That Mango Come From???,2025-09-11T15:01:47Z,42139,3338,31
LoLZRnBwGuU,That Timing Couldn't Have Been Better,2025-09-10T15:00:42Z,113021,6747,52
YjUr0TiPNS8,Zentreya Reacting to SpongeBob HORROR?!,2025-09-09T15:01:03Z,35551,2547,37
9VbV8gqzwHk,We Are NOT Having This Discussion Again... - BEST OF ZENTREYA,2025-09-08T16:00:20Z,29890,3337,108
ncnO3abDjPo,NOT ANOTHER EYEBROWS ROAST!,2025-09-08T15:01:33Z,193795,15569,159
6y-gLQbjl00,No Back Shots for You,2025-09-07T15:00:11Z,61284,5377,45
O1oG5xRpjlE,I Didn't Mean It Like That Chat,2025-09-06T15:00:41Z,34775,3086,39
RSA2XG2-Ho4,Zentreya Does NOT Want to Open That Door...,2025-09-05T16:01:00Z,14231,1579,47
RCLgqXahmuo,How Is My Narration Guys?,2025-09-05T15:00:46Z,30748,3077,94
owHg7GH5Etg,Zen Is Sorry,2025-09-04T15:01:36Z,120707,11130,77
Ng7EMQ246Ek,My Favorite One Piece Pose,2025-09-03T15:00:39Z,49864,4796,76
aJXbxzyqQ1I,Zentreya LOVES Teasing Chat,2025-09-02T15:00:01Z,44189,5123,96
c0KMRGzcgWw,Zentreya Debuts Her New REGAL Outfit!,2025-09-01T16:01:07Z,38736,4716,165
gZqldmlt2v4,I Forgot He's Goku,2025-09-01T15:01:17Z,31857,3021,40
OQhx0QokOrM,NO TOUCHING!,2025-08-31T15:00:40Z,61002,6766,120
pzZ3auZUbTU,Zentreya Debuts Her New Regal Outfit!,2025-08-30T15:01:24Z,58666,7095,186
qw1GlvixSx8,They Got BIGGER Again!,2025-08-29T20:00:43Z,65656,7079,129
0-o1KFSozUQ,Are Zentreya's Friends Smarter Than a 5th Grader?,2025-08-29T16:00:01Z,23700,2091,96
ppnUkdZLluI,Bullying Zen for Her Long Neck,2025-08-29T15:01:38Z,39988,3257,28
UA4rs0ayK0k,I Can't Even Say Haruka's Name!,2025-08-28T15:00:51Z,43725,4096,64
CriyQWV_5A0,Zen Got Knocked Up,2025-08-27T15:00:32Z,47450,3816,84
Ejk72j_1768,Zentreya's New Voice DESTROYS Us!,2025-08-26T15:00:31Z,87148,6923,81
1KwdyxwVrHY,Meeting Vtuber Fans and Cosplayers at ANIME EXPO 2025!,2025-08-25T16:00:03Z,28210,2441,61
5CfoFKsBOyc,Zen's Thoughts On the New Predator Badlands Trailer,2025-08-25T15:00:09Z,31338,3022,39
jsSUqg4m2qY,Zentreya's New Voice Is TOO POWERFUL!,2025-08-24T15:01:09Z,49592,5341,91
7qF--LzyJL4,Give Me Something Harder,2025-08-23T15:00:24Z,38411,4135,115
pKmrollMCXg,BEST OF ZENTREYA - July 2025,2025-08-22T16:01:33Z,21228,3284,78
rroH5cZyaoM,Zen Said Her Own Name...Sort Of,2025-08-22T15:01:29Z,44717,3638,31
zZbCtl1JcQM,This Got Me Shaken Up,2025-08-21T15:01:45Z,44571,3624,31
Xgk7fizL8ik,Zentreya Is Stinky,2025-08-20T15:00:54Z,47664,4708,47
x7GtLVgTWI4,That Was SUCH a Fast Response,2025-08-19T15:01:38Z,31819,3294,40
DChMcDVCZMY,Zentreya Debuts Her ORIGINAL Outfit!,2025-08-18T16:00:31Z,40028,5436,203
qdFb9e6N_pE,YOU Did That.,2025-08-18T15:01:22Z,49584,3385,31
WMITq1l3ECc,Optimus Prime Called Me Out,2025-08-17T15:00:52Z,32404,3671,52
yhTmZ21wfrU,My Friend is a FREAK,2025-08-16T15:01:37Z,32761,2456,34
xm2P1aj_9wY,Zentreya's Fast Food Tier List Gets UNHINGED!,2025-08-15T16:01:47Z,21223,2237,130
ZBT0ufUt2kU,My Editor JUMPSCARED Me,2025-08-15T15:01:05Z,61582,3944,27
YYJME1DNjOo,It's Just a Flesh Wound,2025-08-14T15:00:56Z,34685,2827,50
vJ9Rw5UoqOI,Omae Wa Mou,2025-08-13T15:01:40Z,40124,2995,22
o0i7S74wDwY,Heavenly Didn't Like That Angle,2025-08-12T15:01:30Z,65533,4862,44
BgCWmIshV9k,Zentreya Debuts Her NEW TTS Voice!,2025-08-11T16:00:22Z,261945,26571,704
nS202Kh5qEk,"RAWR, JOB APPLICATION!",2025-08-11T15:01:32Z,279689,14267,108
W-muxwCz1NQ,Can You Hear Me?,2025-08-10T15:01:02Z,44726,3248,26
hAdFFjlyh0k,Look How Cute Layna Is!,2025-08-09T15:01:19Z,31554,3384,35
wvccm-4JbWY,Zentreya and Friends INVADE Comic-Con 2025!,2025-08-08T16:01:45Z,17386,1710,74
8ZjUjK5vh_U,I'm Never Letting Froggy Pick a Video EVER Again,2025-08-08T15:00:19Z,34567,2279,31
gj19wyKwqDA,JOB APPLICATION JUMPSCARE!,2025-08-07T15:01:29Z,43950,4634,74
aPJrBAT0x34,WHO PUNCHED MIKU?!,2025-08-06T15:00:02Z,33880,2630,37
VR3UCVTZvlk,Chat Is Tracking WHAT?!,2025-08-05T15:00:50Z,56630,4322,89
3VsEdkU4Fgc,Evil Neuro TAKES OVER Zentreya's Disney Movie Tier List!,2025-08-04T16:00:05Z,18804,1825,74
ZnQJz64VUjc,This Toilet Is TERRIFYING...,2025-08-04T15:01:06Z,44392,3113,54
LAe_-42jPSU,We Lost Grandma...,2025-08-03T15:00:29Z,44109,3678,40
gNZsnOqvrds,"Frankie, Is That You?",2025-08-02T15:01:08Z,33382,2511,19
gNcuY46FxFc,Vtubers Visit the LAST Blockbuster!,2025-08-01T16:01:18Z,60723,4859,206
_0sGiV8KTqs,"BOUNCE ON IT, DAIYO!",2025-08-01T15:01:07Z,39999,2836,16
WFPHv4pI9z8,The Game SUCKS!,2025-07-31T15:01:01Z,28800,2173,30
N7SVlvaT_3o,It's Part of the Game!,2025-07-30T15:00:42Z,50034,3682,69
lQ9AHO2i-Pk,OOF,2025-07-29T15:01:26Z,36575,3246,32
2V9sH_t251E,How Bad Could It Be?,2025-07-28T15:00:03Z,40401,3697,71
vlmq1fA2mEg,Are We the Same Size?,2025-07-27T15:01:32Z,46801,3664,35
Oofhv77X2js,Are You Single?,2025-07-26T15:00:40Z,43999,3366,79
HzSJK_EGwm8,Gecko ca,2025-07-24T15:00:28Z,63187,6549,112
R2k1fcq5Kts,Finger,2025-07-23T15:00:57Z,120211,7063,58
bPjgi1LM6nY,scream,2025-07-22T15:01:12Z,37349,3097,35
5Pw4Foa-sEg,Where Am I,2025-07-21T15:00:17Z,45034,2896,31
aYCW2Msaq-w,GOAT,2025-07-20T15:00:02Z,44222,2821,20
MgzXez4kagE,Fisicas,2025-07-19T15:00:38Z,48925,3780,54
9SvZqJWeCso,Coco,2025-07-18T15:00:27Z,99308,5925,45
eKNV90N4_9w,Backshot,2025-07-17T15:01:14Z,47949,3444,47
WH2sB73hEYU,Women,2025-07-16T15:00:51Z,48702,3825,57
YlWc_l5DV9c,RTX Zentreya,2025-07-15T15:00:59Z,42489,2974,47
BV7o5_LJGJ8,stuck,2025-07-14T15:00:19Z,28326,2514,32
rwlcNUr7Gjc,No way fnaf,2025-07-13T15:01:30Z,47164,3626,60
fS_2vHQqiFU,nuevas fisicas,2025-07-12T15:00:59Z,54978,4764,85
7_qJfzsuPHs,Mind no se que game,2025-07-10T15:00:21Z,30557,2103,27
w7KcOsJbeiQ,foot realistic,2025-07-09T15:01:47Z,36314,2611,37
V-WvoCOmX64,Banana,2025-07-08T15:00:51Z,51964,4532,66
0-y7LebE2GA,I made Nostro pee himself,2025-07-07T15:00:01Z,31770,3175,22
Z9RcEXm5zUY,ZEN PUT THOSE GRIPPERS AWAY,2025-07-06T15:01:03Z,42378,4132,66
cVzWha7mPLI,Im gonna CRASH OUT,2025-07-05T15:01:09Z,56087,5044,42
fGC2N0j20yw,Zen got that Princess Peach moveset,2025-07-04T15:01:19Z,39985,4112,59
TcthtWUEiiI,Has anyone played of this game,2025-07-03T15:01:02Z,27763,2698,139
A5SUDDYAyM4,GET THOSE GRIPPERS AWAY,2025-07-02T15:00:13Z,53499,4783,38
c-oFbgeCjLU,She did NOT have to say all that,2025-07-01T15:01:24Z,54885,5531,68
jTFKQhO1JCE,Just wanted a little taste of chat,2025-06-30T15:01:20Z,36457,3771,68
EoZ4NzJtAKA,GIANT ROBOT YAY GIANT ROBOT YAY,2025-06-29T15:00:33Z,33301,3589,85
ynFIzjBwoa4,This is absolute cinema,2025-06-28T15:01:41Z,105164,8266,85
Q9E3CoTVi_8,A TOAST w/ Zentreya Podcast ep.3 ft. Amalee and Cy Yu,2025-06-27T19:00:23Z,36822,2487,122
NZTsnhbpAiA,They put me in a doom game,2025-06-26T15:00:40Z,35637,3585,72
v0lh57IO2oc,Zen cant handle Cottontails RIZZ,2025-06-25T15:01:28Z,44875,4604,53
GkqKCIczFeI,Chat is OBSESSED with this model,2025-06-24T15:00:33Z,41160,3595,57
wUghkVUqO_0,I am so COOKED next year,2025-06-23T15:01:40Z,148667,12428,224
2K8otuoMfII,Is this really an insult,2025-06-22T15:00:05Z,43448,2835,24
hNvzzHQEULM,Luck was not on our side today,2025-06-21T15:01:16Z,17728,1386,15
qK63FTJH48U,The timing couldnt be better,2025-06-20T15:01:39Z,26690,2369,40
i2IRy9CoKBQ,I almost broke the game already,2025-06-19T15:01:10Z,27889,2405,31
K4r-USCS03E,Zen finds her clone,2025-06-18T20:00:12Z,33789,3715,55
6RwCIX_9gI4,Nagzz  trolling Cinema,2025-06-17T15:00:08Z,27834,2027,14
gjWlwAbc_g4,Aint no way this happen,2025-06-16T15:01:09Z,36484,3233,46
-ADSezKPyDA,When trying to get a collab goes wrong,2025-06-15T15:00:00Z,60358,4833,59
hSHslMOezYQ,I need to stop talking so fast,2025-06-14T15:01:07Z,48831,4473,47
mlbIeUIxrag,I need to go outside more,2025-06-13T15:01:28Z,40929,3386,64
NXEutXtLxJM,Not this again with the ghost,2025-06-12T15:00:41Z,27282,2186,25
ZSG2rSJsTIQ,Fine I finally admit,2025-06-11T14:01:02Z,41723,3137,60
-E81k3786VE,I cant believe I agree to this,2025-06-10T14:00:01Z,33557,2752,30
rKtnUn5D_qg,Chats DOWNBAD for this outfit,2025-06-09T14:01:19Z,42220,4572,72
aWTtMwJgpLE,Zen finally takes a bath,2025-06-08T14:00:04Z,35434,3968,47
hi8VLzpBPKI,SUMMER OUTFIT REVEAL,2025-06-07T14:01:06Z,49667,5301,156
SXyF8nqlAQc,For legal reasons this is a joke,2025-06-05T14:00:46Z,38383,3721,72
nnmnTDO00ik,Worst time to call Ari,2025-06-04T14:01:15Z,29880,3049,33
tVWcEfW7MCw,How to impress Zentreya,2025-06-03T18:00:59Z,40407,3449,43
ivy43K5yK0c,This video made jump from my chair,2025-06-02T15:01:13Z,82032,6388,120
9tMtTbcQ6H4,Why is the NPC mean to me,2025-06-01T15:00:12Z,26555,2260,34
Itw3igmwakM,A ghost chased PapaMutt,2025-05-31T15:00:27Z,28399,2167,22
Ybaj5TxPsxw,"A TOAST w/ Zentreya Podcast ep.2 ft. PapaMutt, Froggyloch & Ruben",2025-05-30T17:00:47Z,53387,2998,329
DIin1Yc1-Fk,Zen wins by doing NOTHING,2025-05-30T15:00:21Z,90501,5736,44
1yUwc06coJM,Incoming better watch out,2025-05-29T15:00:04Z,31202,2021,14
ZxzrYndp2vo,Heavens honesty knows no bounds,2025-05-28T15:01:04Z,43282,4531,69
xNcWH8BI4fw,I did not see that coming,2025-05-27T15:01:36Z,27098,3176,42
2r8nKVCaQck,Bro got hulk ulted,2025-05-26T15:00:08Z,33904,3102,29
S0dnClWIz5k,Talking in Zoomer terms to Heavenly,2025-05-25T15:00:45Z,76898,4628,70
vXDvj2iE_mw,Love trolling my friends,2025-05-24T15:01:28Z,54575,4003,54
aOUrDb8G76Y,A TOAST w/ Zentreya Podcast ep.1 ft. Arielle & Haruka,2025-05-23T17:00:03Z,74421,5994,433
Jdx1kILgod8,Im just looking repectfully,2025-05-22T15:00:35Z,47231,3980,45
WzwIPgWSDbs,Leave Out All The Rest - Zentreya Cover ( ft. Ironmouse ) | Fully Animated Video,2025-05-20T17:00:44Z,91609,11688,800
EmKLSwipSSU,That timing was unbeatable,2025-05-19T19:00:12Z,48410,3712,45
12eZx9ilQWw,Zentreya ANSWERS Your Burning Questions!,2025-05-16T16:00:04Z,84930,11416,602
D1QO0rrNahY,Zen Butt Stabber,2025-05-15T15:00:21Z,29944,2478,46
79Az-1EhK8I,Chat wants to renact that one scene,2025-05-14T15:00:19Z,31085,2543,24
wbEtRwdKM04,We got a problem here,2025-05-13T15:01:41Z,27743,2413,19
bA4xQZK2W1g,I learn something cool,2025-05-12T15:01:02Z,62508,5611,59
tnSYAsm-jXo,Saying the line,2025-05-11T15:01:18Z,37086,3010,46
897K9Q9NkvM,Why are the boys like this,2025-05-09T15:00:12Z,24199,2290,27
b_PddGPamIc,Froggy might get FIRED from this,2025-05-08T15:00:53Z,27869,2488,22
tQZQJf1Kqd0,I cant believe I said that in public,2025-05-07T15:01:33Z,30687,2566,35
gkzMetlI6b0,IMPORTANT YOUTUBE UPDATE!,2025-05-06T16:01:08Z,136054,20013,942
kw9eF-GTAws,Why did my TTS say that,2025-05-05T15:01:16Z,40689,3357,73
HhL4atvxdm8,Zen Idiot Driver,2025-05-04T20:00:08Z,89770,4329,33
0Dn2vwvcxxk,Getting called out by a game,2025-05-04T15:00:01Z,99226,4593,38
sJNxxFJNK28,Can You Survive The DEADLIEST Game Of 2025?,2025-05-03T17:30:12Z,19144,1927,51
EYeeO9-1phg,I broke the game host,2025-05-02T20:00:07Z,78470,6483,41
OkPnNLZEL4M,Perfect moment for the music,2025-05-02T15:00:44Z,34541,2321,20
CKgD8Uy54YY,Never heard Haruka so mad,2025-05-01T20:00:15Z,265007,18395,216
EXZYILcXrxM,Chat just wanted to say hi,2025-05-01T15:00:22Z,41773,4454,49
ftJ_DXT7WN4,Pov  You get knocked out,2025-04-30T20:00:34Z,21835,2530,64
4pEf7aBiJQE,Becoming a phone,2025-04-30T15:00:08Z,31552,3092,55
8LB16NhKet0,Dont get caught watching Zentreya,2025-04-29T20:00:05Z,48540,4912,85
qTn5dpu1y_c,Zen REPO,2025-04-29T15:01:31Z,29467,2282,16
2DNLge5Jw38,Haruka did NOT hold back,2025-04-28T20:00:03Z,78532,6521,46
lBmDOlpqaKs,Ari got her revenge,2025-04-28T15:01:19Z,25030,2509,43
Jf9SxjpBsqo,Zen cant stop trolling,2025-04-27T20:00:09Z,22066,1931,21
pyzdMPXxo98,Zen causes MAYHEM,2025-04-27T15:01:24Z,22165,2320,41
z67a7AqgJBQ,Zen Eyes Up Here,2025-04-26T22:01:03Z,45307,4128,44
g9e4Y-bEG34,VTubers IRL,2025-04-23T22:00:48Z,140453,12091,165
7wzIWb2BzAA,"Why god, why god",2025-04-22T17:00:18Z,40259,3448,52
8U8s1pQz97U,Something nice about you,2025-04-21T17:00:14Z,42550,3985,61
mjnYuu1QuGw,o7 Heavenly,2025-04-20T21:00:43Z,53297,5204,32
8koNQ0Cxg9M,Am I the REAL Monster in  R.E.P.O.?,2025-04-19T18:00:04Z,29815,2528,58
ag7tHE56CXg,Custom character,2025-04-17T17:00:03Z,48263,3008,49
K7zZ3VBxMK0,helicopter,2025-04-16T20:00:13Z,42751,5113,68
ClnEjCVNuGM,N U T,2025-04-16T17:00:15Z,46975,3749,62
RONwTFrQMKo,Mama,2025-04-15T20:00:17Z,41308,2920,45
hY1ovn2s5HM,Are u winning son,2025-04-15T17:00:48Z,36296,3087,41
keWLTj_12lM,Arielle vs chat,2025-04-14T20:00:36Z,39755,3078,28
G2GqkEvGkZA,Describe game contest,2025-04-14T17:00:29Z,30637,2550,40
3LyiCqyngjg,First time,2025-04-13T21:00:06Z,60661,4835,69
bb4Mqoss7yo,The Geckos Want REVENGE on VShojo?!?,2025-04-12T17:00:42Z,27251,1727,44
d5j9YGtkQYs,Alright you got what you wanted..,2025-04-11T20:00:33Z,43450,3625,45
tBVkYbBfaBI,Never smack a 🍑,2025-04-10T20:00:40Z,41499,2863,33
BZN-my84ZoQ,Im not hiding anything,2025-04-10T17:00:24Z,45497,3140,63
EHQrjASxOPI,Not that type of sack,2025-04-09T17:00:14Z,30886,2507,35
RqD0JWHRilk,Watch your step Zen,2025-04-08T17:00:33Z,124271,12719,121
myKipVz17mU,This was not the time to fart,2025-04-07T17:00:51Z,39661,3043,37
vMBCTYWb-X0,Zen chokes her chat,2025-04-06T17:00:54Z,24878,3472,37
AuuQzgGoRbM,take a shower Zen,2025-04-05T17:00:12Z,36184,3761,32
DTpDpEtzqpw,Zentreya and VShojo’s Monster Hunter Wilds Collab is INTENSE,2025-04-04T17:00:25Z,35398,2698,82
Ei9TBga-Zx0,Reacting to the new Doom game,2025-04-03T17:00:17Z,439875,35820,609
JCdoS7gDp0w,My stream crashed,2025-04-01T17:00:14Z,36673,3098,27
zbaPsLmq3_U,Falling for this trick,2025-03-31T17:01:02Z,40032,3577,34
YvPy68vM3iE,How to beat a Dark Souls 2 boss,2025-03-30T17:00:26Z,35741,3521,56
_88yGDE4DOM,I traumatize Henya by what I did,2025-03-29T20:00:16Z,29289,3150,37
P038_isHDvY,Slapping chat so hard that they spazzed out,2025-03-29T17:00:20Z,27409,3136,40
O394c7RhRQ0,ZENTREYA'S WILD New Outfit Reveal!,2025-03-28T16:00:34Z,84418,9198,329
E3PDve8uKR8,Froggy is wild for saying that,2025-03-27T20:00:08Z,434898,32447,176
ce7jdInUaDw,Roasting Haruka wasnt a good idea,2025-03-27T17:00:43Z,25025,3375,31
6A8rfV42zhQ,It was in fact not easy,2025-03-26T20:00:02Z,16157,1948,23
PRrEjZUj2rA,The CRAZIEST hitbox in history,2025-03-26T17:00:27Z,16063,2098,50
eL3OFjCd9kA,Zentreya eat those kind of cheese sticks,2025-03-25T17:00:51Z,21459,2883,52
euqXRlSFHCM,Zen always jinxes it,2025-03-24T18:00:35Z,17860,2444,26
4biLxSkKVEo,Finger my what?!,2025-03-23T17:00:03Z,20416,2869,41
qD0NkQ-dMLI,Henya if she was chag,2025-03-22T20:00:24Z,19656,2517,35
o8w1-jHytZM,life is unpredictable,2025-03-22T17:00:58Z,26633,3560,38
B4623MInkt0,Respectfully right!,2025-03-21T20:00:11Z,25500,3226,52
7gAiIoQ_tEA,PERSONA *chat deleted*,2025-03-21T17:00:12Z,28587,3463,37
cYw0TOTEnlM,looking respectfully,2025-03-20T20:00:20Z,22353,3132,45
lXdY4DNJmGY,that's not a cat...,2025-03-20T17:00:55Z,18415,2340,27
6ugX9wn9rHY,MARIO PARTY but everyone is absolutely INSANE!,2025-03-19T17:00:14Z,38976,3140,95
BtaUIdRjdkI,Alabama state,2025-03-18T20:00:09Z,20973,2627,53
mn1_jYzbBI4,bark,2025-03-18T17:00:56Z,32973,4373,39
xGjLHhXNyVs,Do math,2025-03-17T20:00:27Z,20210,2872,30
dSyyBi6YUNE,fire alarm,2025-03-17T17:00:42Z,18771,2809,16
eEWRWL58tOc,Sims experience,2025-03-16T20:00:16Z,15520,2303,34
7tk4PSt53KQ,Chat is an imposter,2025-03-16T17:00:14Z,16069,2395,26
tTct0vCo0FI,Got thicc,2025-03-15T20:00:29Z,16504,2239,32
rT6ai46Ml_k,I hate Zentreya from VShojo,2025-03-15T16:00:58Z,20224,3089,30
iA4P8oJiemE,Zen Anime Impulse,2025-03-14T16:01:01Z,20123,2578,18
o7dBDArkcxA,Zen takes down grandma,2025-03-13T16:01:04Z,42244,6932,36
poTHMP6x13Q,Is ZENTREYA HAUNTED!?,2025-03-12T15:01:09Z,28519,2520,100
