id,title,publishedAt,viewCount,likeCount,commentCount
FUZrEFuAlqI,I AM VERY SMART! - Zentreya Reacts,2022-03-27T17:33:29Z,98883,6606,113
cC9fCdQCQg8,It's not what you think it is... - Best of Zentreya,2022-03-23T23:11:45Z,107835,7347,108
vTVj36Fmrvk,"Dark Souls 3, but my viewers control the game",2022-03-19T19:08:48Z,31805,2741,58
XXnsGKoeILg,Zentreya goes to Japan! ft. Highgai,2022-03-18T19:37:25Z,43048,3452,62
zvrc3vLRo-g,This is the worst idea I've ever had...,2022-03-06T02:55:03Z,64089,4998,123
qxeYIljicfg,Sounds like death... - VR horror ft. Haruka,2022-02-22T01:47:04Z,51954,4651,64
lnpMz-WJ0y8,Make out after stream? - Best of Zentreya,2022-02-21T01:51:04Z,360067,20635,280
xZfvqdfAyL8,I am perfectly sane.,2022-02-14T03:39:48Z,211203,13603,288
LbEcNz1Igpo,IMPOSSIBLE SHOT?!?! - Apex Legends with Froot and RPR,2022-02-08T17:48:06Z,31391,2795,70
PzQpEpB_Jqc,This game is strange...,2022-02-06T00:00:46Z,71545,5920,73
o_wzmGHbuaI,This was a bad idea... - Reacting to Clips from 2021,2022-01-27T01:11:31Z,156131,11982,140
Ij7WtOhdLQM,I tried playing Geoguesser...,2022-01-25T23:54:57Z,83170,5970,102
Xe7BnMkfICg,"Hello, my name is Zen and welcome to Jackass",2022-01-14T22:37:04Z,63371,5593,103
PN_skuxtCFA,I've got nuts in my mouth... - Zentreya Out of Context #4,2022-01-10T19:53:29Z,52553,4755,75
KCSowcEgn3o,BEST OF ZENTREYA 2021,2022-01-07T20:14:35Z,126829,10102,166
EPx4acUfF60,"Honestly, I would've cried..",2022-01-05T17:50:17Z,176105,11706,191
_LGVB_6Bm28,POV: You are a literal scrap of trash,2022-01-03T03:01:32Z,52786,5369,310
IPsfLXwiNZU,LET ME LEAVE!! - Bloodwash Highlights,2022-01-02T22:56:10Z,25401,2727,59
bv0OCZseUjE,you're breathtaking,2021-12-28T22:37:14Z,144889,10599,244
tKoSMk1MxM8,My Halo Infinite singleplayer experience.,2021-12-26T22:03:23Z,36856,3473,73
9AiZNFd2fWc,your heart was delicious.,2021-12-18T23:39:35Z,110104,8605,188
hWLI9efa5dU,I guess there will be breeding today - Best of Zentreya #3,2021-12-11T20:32:00Z,97227,8326,163
DPrgO6Od9to,I have something important to tell you...,2021-12-08T17:26:42Z,131534,9324,230
Eywlatn875A,Don't do this... - Zentreya Reacts to Cringey Memes #2,2021-12-04T00:37:32Z,62342,5198,127
rQlwVX1mhPk,these bit gang wars need to stop..,2021-12-02T00:48:48Z,129361,8800,198
BJjOCqQHq_Q,I tried giving chat a new redeemable alert...,2021-11-25T21:14:41Z,261776,17048,365
Bes8QRoHrao,Welcome to the World of Pokémon..,2021-11-23T17:08:49Z,93648,7490,209
B3u1NXB_plI,I would've just kept scanning and walked away.. ► Zentreya Reacts to Unusual Memes,2021-11-21T23:35:40Z,243001,14910,200
eBCr6doLGJU,Anka Dance ROCKS with Zentreya ( Little V - Camel by Camel ),2021-11-16T21:22:09Z,122516,10684,464
42jBiqevnLw,Zentreya Ankha Dance - Best of Zentreya #2,2021-11-10T18:07:14Z,302294,20868,371
UTKas1dJ4Vg,WHY DID I GO BACK TO THIS GAME. I PUNCHED MY MONITOR.,2021-11-03T19:00:16Z,74691,5016,128
aVGFC_EANOc,"WHAT IS THIS GAME, IT'S SO BRUTAL",2021-11-03T17:09:17Z,72018,4804,76
UeYMOK8X70o,"Jumpscares, Fails and Funny Moments ► Best of Zentreya",2021-11-01T21:09:52Z,295426,15805,258
8xAbyY1MnM4,Zentreya Out of Context ( Kind of?? ) #3,2021-10-27T20:00:02Z,110677,7196,108
wm2aUWZ32EE,I peed myself ON STREAM playing Poppy Playtime,2021-10-27T17:09:30Z,361453,22349,665
fTavbJgzx6I,YOU KNOW WHAT THEY SAY ABOUT BIGFEET-  [ BIGFOOT w. HARUKA ],2021-09-21T17:53:57Z,73706,4518,97
5Q1VWhZEPSE,Zentreya and Haruka FIGHT in Ben & Ed 9 [ BEST MOMENTS ],2021-09-19T17:15:01Z,37364,2626,44
dHqDLbClT4o,Zentreya Out of Context ( Kind of? ) #2,2021-09-12T17:30:01Z,209937,12165,190
Ai_JmPE1lzo,Smile,2021-09-09T17:58:06Z,61747,6884,193
JkSlEUUQ32Q,"I kept working at the store, it got worse..",2021-08-23T17:45:07Z,53228,3402,76
yUHIDGlfYd4,"I started a job overnight at a local store, I regretted it..",2021-08-23T17:36:29Z,42387,2979,94
bOHBjL5hOxA,I HAVE NEVER RAGED AT A GAME THIS MUCH,2021-08-13T16:41:26Z,63062,4764,180
1xT65wUE9AQ,GMOD PROP HUNT BUT WITH ALOT OF VTUBERS,2021-08-07T16:45:00Z,55154,4330,118
mBoFCKCPh0M,I DESTROYED MY FRIENDS,2021-08-06T18:19:46Z,97172,6414,122
ZOivyN4Q7tY,OMAE WA MOU  - deadman 死人 | Caleb Hyles + Ironmouse (ft. Zentreya ) Cover,2021-08-05T19:02:22Z,74348,5787,205
ckxitPoEdhg,Zentreya Out Of Context ( Sort of ) #1,2021-07-24T18:21:22Z,83237,7492,154
fmL6YyOZc_E,Lets talk about YOUR deck.,2021-07-14T19:00:09Z,52215,5521,217
12FgAqVKW_Y,I PLAYED PHASMOPHOBIA DRUNK WITH MY FRIENDS,2021-07-09T18:00:01Z,48861,3786,67
WpR_fWgZ20Y,HUNTING VTUBERS IN PROP HUNT - GARYS MOD,2021-07-07T17:25:32Z,80985,5822,147
dFO3fuXxVOg,"【CHATTING + GAMES】DRAGON RETURNS, NEW LOOK DEBUT! | VSHOJO",2021-07-03T23:45:34Z,101060,7070,83
GVM2Au58QdY,tail,2021-06-15T17:30:02Z,57517,6350,283
YtOdf1EwaFg,when your favorite vtuber shows butt,2021-06-11T17:00:31Z,61031,7529,201
qbrvIRcphY0,context and vtubers,2021-06-02T17:15:01Z,64054,7917,230
FGIh2AQQgIc,game over,2021-05-25T17:14:54Z,58895,7362,188
zG-ZMj6UewA,swim,2021-05-18T17:15:03Z,67153,7926,277
nKKFRhlE1qE,I played a game with a steering wheel and...,2021-05-18T17:00:17Z,60379,4774,190
zPdTUh7GWEI,Hi,2021-05-11T17:36:05Z,151356,18959,953
EKUnvS94_f0,I FINALLY SAW FROOTS CAKE OH MY GOD,2021-05-11T17:04:44Z,46657,3268,75
r_SYIHswRRY,MACHO MAN'S A FREAKIN DRAGON?!!? OH NOOOOOO,2021-04-27T19:00:22Z,35788,2645,120
gnjzALZo6eY,Zentreya Official Starting Intro (MV) - Overkill by RIOT,2021-04-27T18:16:44Z,115345,5803,228
yerfo3x6P9k,Zentreya Official Lore Video,2021-04-27T18:10:21Z,56175,5019,314
feQeDTlBwWY,The day I became a GECKO...,2021-04-23T17:15:00Z,202975,13639,401
wFp_G7vo3G8,RETURN TO GECKO,2021-04-20T17:27:26Z,61116,6410,319
QE6IlCvVS4o,I WAS 2D AND THEN BECAME 3D!,2021-04-20T17:10:18Z,324296,21000,549
RnZiVU130ec,When you taking cooking lessons from Haachama..,2021-04-06T18:00:30Z,57197,5103,206
6z5CoP8Kh1Y,I CAN'T FLY D:,2021-03-23T18:15:00Z,64776,4881,228
scOumcXSIxY,When you leave Incognito Mode open..,2021-03-23T17:15:01Z,55643,4763,159
nRzJ5OXavXk,"RAISING $42,000 FOR CHARITY IN A WEIRD WAY..",2021-03-16T18:00:12Z,54273,4791,153
gjfLA89MLss,When you pet a dragon Vtuber,2021-03-16T17:15:01Z,147734,14182,264
OOvXITlJcTY,I ALMOST THREW UP AT CURSED FOODS...,2021-03-08T19:15:00Z,189314,9830,310
QK2io7ASoWw,A SPOOPY GAME w/ ISAIAH CREWS! (TERRY CREWS'S SON),2021-03-08T18:15:01Z,21919,1839,69
GhabnkkPFG4,When you watch all the Final Destination movies,2021-02-27T18:19:43Z,42136,3608,239
_N4mAR5JBSk,When the SUS gets too real,2021-02-26T18:05:03Z,42169,3726,153
woUsUiPDSIU,When you turn Discord Light mode at 3 AM ..,2021-02-24T19:11:25Z,94636,8256,283
3QBfBAngJ20,When your favorite Vtuber Ara Ara's for the first time,2021-02-22T18:27:54Z,753349,55826,637
kAfRzXuIZb0,When you find out your new friend has the same music taste.,2021-02-21T18:23:57Z,148089,15149,504
EdRNjnTKrh0,"RIDE FROOT, FROOT DED, REGRET... ; VALHEIM",2021-02-19T20:54:20Z,143598,9522,202
KyTKEnd7zNU,THE LONGEST JOHNS : WELLERMAN ft Zentreta (Drums) - SEA SHANTY-,2021-02-10T17:50:21Z,42861,2958,142
flJjowiMPJQ,VShojo Collab Song: Silvervale - Home ft. Zentreya (Drums),2021-02-10T03:58:28Z,55627,3854,199
XrYRdDRTqcE,"2 VTUBERS , 1 GHOST : Phasmophobia",2021-01-31T22:56:02Z,58737,3638,118
lDXZdNIwgzY,BURNING DOWN THE CITY IN GTAV,2021-01-30T20:56:31Z,84010,4862,173
sEeAKzz3ViM,ME AND FROOT BECAME SPACE MARINES!,2021-01-19T21:37:19Z,97343,5624,215
NnPL7-1pIpM,FROOT IS LITERALLY A DEMON,2021-01-17T20:00:50Z,250673,14406,369
OhUjvOMAl2U,PLAYING RING FIT AFTER 2020 LOCKDOWN...,2021-01-17T19:50:28Z,82370,4551,109
5rUO6lXnZ-w,FROOT SEES WITH HER SPECIAL EYES...,2021-01-09T20:50:26Z,136993,7492,179
8iHf2qr2YWY,VTUBER VS. OBLIVION GUARDS,2020-12-30T22:19:13Z,87854,5728,249
Dph8KvPhufw,I ATE A SHARK NAMED ARTEMIS!,2020-12-23T19:32:06Z,56048,4492,140
cqJhtHDNZNg,I PLAYED DARK SOULS 3 FOR THE FIRST TIME...,2020-12-17T19:36:09Z,94609,5403,211
z6j1ob-YFNc,I KILLED ONE OF IRONMOUSE 'S CATS... ( I'M SO SORRY),2020-12-09T18:41:37Z,171235,9825,454
bX9AmrJjX-g,MY BAKING ISN'T THAT BAD..RIGHT??,2020-12-02T21:36:41Z,85329,4580,204
D9NezlK7JEs,I JOINED VSHOJO!,2020-12-02T21:20:13Z,141910,7960,411
a-Adx7DsXRo,I SHOULDN'T BE ALLOWED TO HELP IN MINECRAFT....,2020-11-17T20:18:23Z,38855,2076,77
XBvZPpgSbU0,I PLAYED PHASMOPHOBIA DRUNK AND....,2020-11-08T18:46:14Z,53041,3066,88
-yh2suRdUO4,WE HAD A BABY IN MINECRAFT...,2020-11-05T20:07:02Z,40968,2707,89
VfHCB6XR1D8,"BURNING DOWN THE COMPETITION IN... FALL GUYS (w Veibae, Sivlervale, Fefe)",2020-10-28T22:17:52Z,33452,2073,70
t3x8mJHYnt4,🐉 DRAGON VTUBER ISEKAI'D! ! 🐉,2020-10-28T21:45:19Z,77512,4716,191
kaKL9_tn2d4,I TROLLED MY FRIENDS AND... (Phasmaphobia),2020-10-20T21:00:07Z,39886,2635,89
j4jyBy8-Tfc,I WENT GHOST HUNTING BY MYSELF AND...  (Phasmaphobia),2020-10-20T19:52:24Z,21275,1685,73
f1knDM4ol0o,WHO WINS? ONE SKINNY BOI or A THICC DRAGON? : ALIEN ISOLATION DLC,2020-10-13T19:00:10Z,35871,2598,76
kqdvb4W6w2w,"TAUNTING GHOSTS WITH MY BUTT | Phasmaphobia VR w Natsumi Moe, BunnyGIF, Nagzz21",2020-10-12T18:26:47Z,54071,3281,111
sRjhUoyWK2Q,"I JOINED THE EMPIRE, REBELS SUCK : STAR WARS SQUADRONS (ACE)",2020-10-06T19:00:33Z,38265,2678,198
SAkxAhk1py8,When its finally October,2020-10-02T19:41:13Z,55317,3850,206
GxFZJWED0ZM,"BEING SUS in AMONG US ft. Mouse, Silver, Arcadum, Momo, Nagzz, Bunny, Wolfy , and more!",2020-09-30T19:58:58Z,47840,2922,95
5ggqwbifCes,"I BETRAYED MY IMPOSTOR FRIEND! - ft. Mouse,Silver,Melody,Bunny,Momo,Vei,Moe,Mira,Nyanners",2020-09-22T20:14:27Z,39057,2579,88
jj5qgCCslT8,I WORE A BANANA SUIT ON STREAM AND....,2020-09-22T19:46:49Z,121221,7163,435
QMAzux73FJ0,"VTUBER SURVIVAL 101 w. Mouse, Silver, Melody, Bunny and Momo! (7 Days to Die)",2020-09-17T19:53:11Z,38890,2558,69
t0ApO6WHeg8,VTUBER ALMOST PEE'S THEMSELVES: SCP: CONTAINMENT BREACH,2020-09-15T20:45:10Z,56718,3615,163
Z_XiVn-acR8,VTUBER COSPLAYS PLAYBOY BUNNY AND WINS! FREAKS OUT! - FALL GUYS HIGHLIGHTS,2020-09-11T22:44:02Z,62001,3968,176
aIwDr-ulB6g,VTUBER VS. : Zentreya vs VEIBEI in FALL GUYS U.K,2020-09-07T20:07:07Z,37139,2547,105
A4KxpmYq634,VTUBER GETS A BIG UPGRADE!!!,2020-08-25T19:36:53Z,278543,13008,574
lhtO7mjYTwk,VTUBERS ARE : WAIFUS OF THE CARIBBEAN ; WAIFUS TELL NO TALES,2020-08-18T19:23:05Z,54867,3625,152
FAKhYXRfb4M,VTUBERS MEETS PIRATES! YO-HO-WHOA EDITION,2020-08-04T19:37:40Z,93030,4694,117
sBOaSrnLjTQ,"MEET THE DOMINANT VTUBER, DOMMY MOMMY - ZENTREYA",2020-07-28T19:45:42Z,176696,8848,283
GbABcls_GEo,DEAD BY DAYLIGHT DELIGHT,2020-07-06T19:07:01Z,25074,1325,51
rpvUT7HpiOM,"VTUBER, MEET THE CARLOS DILEMMA (PART 3)",2020-07-06T18:58:02Z,50489,2436,80
tA-weR1DOw8,CUPHEAD BUT I SCREAM INTERNALLY,2020-06-29T18:55:26Z,25279,1380,77
_MLypDHGSuo,"VTUBER, MEET STALKER, NEMESIS (PART 2)",2020-06-22T00:39:18Z,45513,2389,85
WRYNytLAfVw,"VTUBER, MEET SHIRTLESS CARLOS",2020-06-21T22:33:01Z,159982,6643,153
HhGI0sdKbCs,"BEST WORST VTUBER PILOT, REPORTING!",2020-06-17T21:14:14Z,39277,2220,213
_dcx9OzdUm8,MELODY TOOK MY SECOND DATE?!,2020-06-06T19:16:32Z,105392,4436,172
Aq0DSYIPv8c,MY DOOM ETERNAL NIGHTMARE EXPERIENCE IN 6 MINUTES - (1 SHOT A MARUADER TRICK) / VTUBER,2020-05-19T18:51:18Z,89656,3976,178
HUOknl0o-iA,U GOT THAT by HALOGEN / Cover by Little V (Zentreya Dance MMD),2020-05-08T14:00:08Z,59062,2876,211
ydQrEQqC5lE,Follow the Leader - MMD Dance w*  Zentreya,2020-04-19T17:54:14Z,88421,3260,214
4Y5hnUOwtGo,I REALLY MESSED UP - VTUBER / HIGHLIGHTS,2020-03-23T17:37:58Z,51137,1567,57
sqoJAShUERc,MOVE YOUR BODY - MMD Short ft.  Zentreya (Eiffel 65),2020-03-22T19:37:33Z,38929,1910,83
hrM1ZgiY1c8,D A N C I N G - Short Zentreya MMD Shuffle,2020-03-17T18:06:24Z,59033,3807,200
-YIG2a3aY1c,THIS GAME ALMOST MADE ME UNMUTE - VTUBER,2020-03-10T18:37:55Z,58522,2273,89
xHY6z6AQ-1A,MY SUBNAUTICA EXPERIENCE IN 5 MINUTES - VTUBER,2020-03-06T21:43:05Z,66602,2964,108
H3THlSA2Klg,HAVING A GOOSE TAKE OVER STREAM - VTuber/VRChat,2020-03-02T18:44:32Z,93663,2988,138
